"gene_ID","p_val","avg_log2FC","pct.1","pct.2","p_val_adj","AT_ID","TF","TF_family","Gene_code_name","Gene_functions"
"Chir08Ox-b22580.2",0,0.373443322805326,0.726,0.376,0,NA,NA,NA,NA,NA
"Chir04Ox-b12980.2",0,0.292017428248488,0.726,0.418,0,"AT2G31160",NA,NA,"LSH3","maintenance of shoot apical meristem identity, mRNA transcription, nucleus, organ boundary specification between lateral organs and the meristem, petal development, post-embryonic plant morphogenesis, response to light stimulus, specification of petal number"
"Chir02Ox-b14000.2",0,1.1647357009162,0.781,0.477,0,"AT1G67750",NA,NA,"AT1G67750.1","extracellular region, meiotic cell cycle process, mitochondrion, pectate lyase activity, pectin catabolic process, response to nutrient levels"
"Chir07Ox-b35240.2",0,0.935935892645068,0.797,0.489,0,"AT4G37800",NA,NA,"XTH7","cell wall biogenesis, cellular component biogenesis, extracellular region, hydrolase activity, hydrolyzing O-glycosyl compounds, plant-type cell wall organization or biogenesis, polysaccharide binding, xyloglucan metabolic process, xyloglucan:xyloglucosyl transferase activity"
"Chir02Ox-b11660.2",0,0.705232190314389,0.838,0.527,0,"AT1G65960",NA,NA,"GAD2","calmodulin binding, cytosol, glutamate catabolic process, glutamate decarboxylase activity, glutamate metabolic process, nitrogen compound metabolic process, nucleus, pyridoxal phosphate binding"
"Chir05Ox-b28860.2",0,0.82229210051677,0.872,0.57,0,"AT3G63200",NA,NA,"PLP9","anatomical structure formation involved in morphogenesis, cellular polysaccharide metabolic process, meiotic cell cycle, plant-type cell wall organization or biogenesis"
"Chir01Ox-b14810.2",0,1.05105251448961,0.898,0.571,0,"AT1G14700",NA,NA,"PAP3","acid phosphatase activity, dephosphorylation, ferric iron binding, ferrous iron binding, generation of precursor metabolites and energy, negative regulation of cellular metabolic process, negative regulation of cellular process, nucleus, plant-type vacuole, response to light intensity"
"Chir05Ox-b12990.2",0,0.892590082668978,0.899,0.573,0,"AT3G48100",NA,NA,"ARR5","circadian rhythm, cytokinin-activated signaling pathway, cytoplasm, nucleus, phosphorelay response regulator activity, protein binding, regulation of DNA-templated transcription, response to cytokinin, response to red light"
