"gene_ID","AT_ID","Gene_code_name","avg_log2FC","pct.1","pct.2","p_val","p_val_adj","TF","TF_family","Gene_functions","source"
"Chir07Ox-b14860.2","AT4G17980","anac071",0.324327718970727,0.143,0.033,2.42722537712746e-105,4.77192509143259e-101,"Yes","NAC","cell division, cellular response to auxin stimulus, DNA binding, DNA-binding transcription factor activity, nucleus, regulation of DNA-templated transcription, response to wounding, sequence-specific DNA binding","DEGs"
"Chir08Ox-b22680.2","AT5G60200","DOF5.3",0.319351406987423,0.289,0.082,1.18902482072443e-162,2.33762279754422e-158,"Yes","Dof","DNA-binding transcription factor activity, nucleus, phloem or xylem histogenesis, regulation of DNA-templated transcription, root development, root radial pattern formation, transcription cis-regulatory region binding","DEGs"
"Chir05Ox-b15760.2","AT3G50410","DOF3.4",0.835166110332005,0.56,0.133,0,0,"Yes","Dof","cell wall modification, DNA binding, DNA-binding transcription factor activity, nucleus, positive regulation of cell cycle, positive regulation of DNA-templated transcription, protein binding, response to auxin, response to salicylic acid, transcription cis-regulatory region binding, zinc ion binding","DEGs"
"Chir08Ox-b29440.2","AT5G66940","AT5G66940.1",1.56098102893428,0.663,0.171,0,0,"Yes","Dof","DNA binding, DNA-binding transcription factor activity, nucleus, regulation of DNA-templated transcription, transcription cis-regulatory region binding, zinc ion binding","DEGs"
"Chir01Ox-b19750.2","AT1G19850","ARF5",0.973883206569267,0.69,0.197,0,0,"Yes","ARF","DNA-binding transcription factor activity, embryo development ending in seed dormancy, flower development, identical protein binding, leaf vascular tissue pattern formation, longitudinal axis specification, meristem development, nucleus, protein binding, regulation of DNA-templated transcription, response to auxin, root development, transcription cis-regulatory region binding, xylem and phloem pattern formation","DEGs"
"Chir03Ox-b13250.2","AT3G13810","AtIDD11",0.290730555362995,0.52,0.216,2.55876381818912e-171,5.03052966655981e-167,"Yes","C2H2","DNA-binding transcription factor activity, nucleus, regulation of DNA-templated transcription","DEGs"
"Chir06Ox-b28190.2","AT5G11060","KNAT4",0.455328625173812,0.618,0.299,3.59146878086072e-196,7.06082762317219e-192,"Yes","TALE","cytoplasm, cytosol, DNA-binding transcription factor activity, DNA-binding transcription factor activity, RNA polymerase II-specific, nucleus, regulation of transcription by RNA polymerase II, response to light stimulus, RNA polymerase II cis-regulatory region sequence-specific DNA binding","DEGs"
"Chir01Ox-b29910.2","AT1G31320","AT1G31320.1",0.630154892179037,0.67,0.356,3.44686140741841e-186,6.77652952698459e-182,"Yes","LBD","nucleus, phloem or xylem histogenesis, protein binding, transcription cis-regulatory region binding","DEGs"
"Chir01Ox-b04960.2","AT1G05710","F3F20.16",0.439742376771444,0.7,0.395,7.80936415796055e-146,1.53532099345504e-141,"Yes","bHLH","DNA-binding transcription factor activity, DNA-binding transcription factor activity, RNA polymerase II-specific, nucleus, protein binding, protein dimerization activity, regulation of transcription by RNA polymerase II, RNA polymerase II cis-regulatory region sequence-specific DNA binding","DEGs"
