"gene_ID","AT_ID","Gene_code_name","avg_log2FC","pct.1","pct.2","p_val","p_val_adj","TF","TF_family","Gene_functions","source"
"Chir08Ox-b07020.2","AT4G11140","AT4G11140.1",0.319602609077518,0.492,0.074,0,0,"Yes","ERF","cotyledon development, DNA-binding transcription factor activity, leaf development, nucleus, protein binding, regulation of DNA-templated transcription, transcription cis-regulatory region binding","DEGs"
"Chir03Ox-b16050.2","AT3G16280","ERF036",0.792568087844838,0.674,0.077,0,0,"Yes","ERF","alpha-amino acid metabolic process, carboxylic acid biosynthetic process, DNA-binding transcription factor activity, glucosinolate metabolic process, nucleus, regulation of DNA-templated transcription, response to inorganic substance, response to wounding, transcription cis-regulatory region binding","DEGs"
"Chir08Ox-b00690.2","AT4G00540","ATMYB3R2",0.36325137139359,0.607,0.147,0,0,"Yes","MYB","DNA-binding transcription factor activity, DNA-binding transcription factor activity, RNA polymerase II-specific, nucleus, regulation of circadian rhythm, regulation of DNA-templated transcription, RNA polymerase II cis-regulatory region sequence-specific DNA binding, sequence-specific DNA binding","DEGs"
"Chir07Ox-b35530.2","AT4G38070","F20D10.190",0.535949387433292,0.69,0.149,0,0,"Yes","bHLH","DNA-binding transcription factor activity, mitochondrion, nucleus, protein dimerization activity, regulation of DNA-templated transcription","DEGs"
"Chir06Ox-b27720.2","AT5G11510","MYB3R-4",0.350679631886486,0.678,0.196,0,0,"Yes","MYB","cytokinesis, defense response to fungus, DNA-binding transcription activator activity, RNA polymerase II-specific, DNA-binding transcription factor activity, DNA-binding transcription factor activity, RNA polymerase II-specific, negative regulation of cellular response to caffeine, nucleus, phragmoplast, positive regulation of DNA-templated transcription, protein binding, regulation of cytokinesis, regulation of DNA endoreduplication, regulation of DNA-templated transcription, response to fungus, response to salicylic acid, RNA polymerase II cis-regulatory region sequence-specific DNA binding, sequence-specific DNA binding, spindle, transcription cis-regulatory region binding","DEGs"
"Chir07Ox-b20760.2","AT4G23750","TMO3",0.330910483746652,0.669,0.297,2.8179332892703e-233,5.54005684670541e-229,"Yes","ERF","cotyledon development, DNA-binding transcription factor activity, identical protein binding, nucleus, protein binding, regulation of DNA-templated transcription, root development, transcription cis-regulatory region binding","DEGs"
"Chir01Ox-b38410.2","AT1G49480","RTV1",0.499520130775337,0.923,0.574,0,0,"Yes","B3","DNA binding, nucleus, plasma membrane, protein binding, response to cold","DEGs"
