"gene_ID","p_val","avg_log2FC","pct.1","pct.2","p_val_adj","AT_ID","TF","TF_family","Gene_code_name","Gene_functions"
"Chir02Ox-b11950.2",5.67850642688548e-44,0.426668391924272,0.547,0.407,1.11639436352569e-39,"AT1G66180",NA,NA,"F15E12.7","aspartic-type endopeptidase activity, cellular response to hypoxia, extracellular region, Golgi apparatus, proteolysis, response to L-ascorbic acid, response to light stimulus"
"Chir03Ox-b04470.2",6.99246500781035e-52,0.363076341461458,0.543,0.407,1.37471862053551e-47,"AT3G05120",NA,NA,"ATGID1A","cellular response to hypoxia, cytoplasm, floral organ morphogenesis, gibberellin binding, gibberellin mediated signaling pathway, nucleus, positive regulation of gibberellic acid mediated signaling pathway, protein binding, raffinose family oligosaccharide biosynthetic process, response to gibberellin"
"Chir06Ox-b06620.2",1.12712524503083e-92,0.982496250949644,0.614,0.407,2.2159282317306e-88,"AT5G43150",NA,NA,"MMG4.18","cellular lipid metabolic process, lipid biosynthetic process, mitochondrion, molecular_function, response to light stimulus"
"Chir02Ox-b13530.2",1.08626378333069e-55,0.489049718889284,0.553,0.408,2.13559459802813e-51,"AT1G67360",NA,NA,"SRP1","cellular response to hypoxia, cytoplasm, developmental vegetative growth, endoplasmic reticulum, lipid droplet, lipid droplet organization, plant-type vacuole, pollen development, positive regulation of growth, positive regulation of response to water deprivation"
"Chir05Ox-b19160.2",5.49808128407368e-61,0.897927435079502,0.575,0.408,1.08092278044889e-56,"AT3G53620",NA,NA,"AtPPa4","cytoplasm, cytosol, inorganic diphosphate phosphatase activity, magnesium ion binding, nucleoplasm, phosphate-containing compound metabolic process"
"Chir06Ox-b36610.2",0,2.17707767041641,0.795,0.408,0,"AT5G02380",NA,NA,"MT2B","copper ion binding, oxoacid metabolic process, secondary metabolic process"
"Chir05Ox-b22000.2",4.86695269398562e-65,0.357759893161058,0.572,0.409,9.56842899637572e-61,"AT3G56370",NA,NA,"IRK","kinase activity, plasma membrane, protein binding, protein phosphorylation, protein serine/threonine kinase activity, regulation of cell division, root development"
"Chir01Ox-b27560.2",7.41136223540469e-47,0.382578854084895,0.542,0.41,1.45707381548056e-42,"AT4G14600",NA,NA,"SFT11","endoplasmic reticulum, Golgi apparatus, plasma membrane"
"Chir02Ox-b05060.2",5.88378527430918e-51,0.402714184094813,0.543,0.41,1.15675218492918e-46,"AT1G60710",NA,NA,"ATB2","aldo-keto reductase (NADP) activity, cytoplasm, cytosol, nucleus"
"Chir03Ox-b30010.2",0.186321212539127,0.454313814400406,0.392,0.41,1,"AT2G15960",NA,NA,"F19G14.4","carboxylic acid metabolic process, cellular catabolic process, cellular_component, molecular_function, organic substance catabolic process, protein-containing complex assembly, response to light intensity, response to organonitrogen compound, response to temperature stimulus"
"Chir01Ox-b16690.2",3.77275968973743e-50,0.657566556844666,0.551,0.411,7.41724555002379e-46,"AT1G16670",NA,NA,"CRPK1","nucleus, plasma membrane, protein autophosphorylation, protein binding, protein serine/threonine kinase activity, response to cold, response to freezing, response to insect, response to molecule of bacterial origin"
"Chir06Ox-b27180.2",6.26793482048406e-118,0.562993738960478,0.632,0.412,1.23227598570717e-113,"AT5G11950",NA,NA,"LOG8","cytokinin biosynthetic process, cytoplasm, cytosol, hydrolase activity, hydrolyzing N-glycosyl compounds, N6-(Delta2-isopentenyl)-adenosine 5'-monophosphate phosphoribohydrolase activity, nucleus, plasma membrane"
"Chir08Ox-b14210.2",4.75326707336662e-83,0.345925337587268,0.609,0.413,9.34492306623878e-79,"AT5G52540",NA,NA,"F6N7.1","biological_process, chloroplast, chloroplast envelope, molecular_function"
"Chir02Ox-b15110.2",3.17253883586882e-111,0.604541958242626,0.613,0.414,6.2372113513181e-107,"AT1G68760",NA,NA,"ATNUDT1","8-oxo-7,8-dihydrodeoxyguanosine triphosphate pyrophosphatase activity, 8-oxo-7,8-dihydroguanosine triphosphate pyrophosphatase activity, cellular response to DNA damage stimulus, cytosol, dGTP catabolic process, dihydroneopterin triphosphate pyrophosphohydrolase activity, NAD+ diphosphatase activity, NADH pyrophosphatase activity"
"Chir06Ox-b33860.2",7.55183964022199e-36,0.299930507800661,0.519,0.414,1.48469167326764e-31,"AT5G05100",NA,NA,"AT5G05100.1","nucleus, protein binding, response to salt stress"
"Chir08Ox-b19180.2",7.95905919069689e-93,0.414375124893857,0.614,0.414,1.56475103689101e-88,"AT5G57015",NA,NA,"ckl12","cytoplasm, endocytosis, mitochondrion, nucleus, peptidyl-serine phosphorylation, protein serine/threonine kinase activity, signal transduction"
"Chir01Ox-b25330.2",2.05705912646963e-39,0.298085760171993,0.534,0.415,4.04417824263929e-35,"AT1G25420",NA,NA,"ISTL2","mitochondrion, molecular_function, protein localization, protein transport"
"Chir05Ox-b00930.2",2.12978758268115e-24,0.453818954353731,0.473,0.415,4.18716238755114e-20,"AT2G01918",NA,NA,"PQL3","calcium ion binding, chloroplast, chloroplast thylakoid lumen, electron transporter, transferring electrons within the cyclic electron transport pathway of photosynthesis activity, extrinsic component of membrane, photosynthetic electron transport chain, photosystem II oxygen evolving complex, response to cold"
"Chir07Ox-b01580.2",2.53186836578557e-40,0.351597298782137,0.541,0.415,4.97765320713442e-36,"AT5G40880","Yes","C3H","C3H59","nucleus, protein binding, response to temperature stimulus"
"Chir08Ox-b18670.2",2.36046753199557e-144,1.24516058851694,0.678,0.415,4.6406791679033e-140,"AT5G56550",NA,NA,"ATOXS3","nuclear speck, nucleus, protein binding, regulation of photoperiodism, flowering, regulation of response to water deprivation, response to cadmium ion, response to copper ion, response to far red light, response to light stimulus, response to oxidative stress, response to red light, response to wounding, response to zinc ion"
"Chir08Ox-b21750.2",2.56907808765281e-41,0.270728267359833,0.533,0.415,5.05080752032542e-37,"AT5G59420",NA,NA,"AT5G59420.1","autophagy, carboxylic acid metabolic process, cellular response to organic substance, cellular response to oxygen-containing compound, cytosol, defense response to bacterium, intracellular membrane-bounded organelle, leaf senescence, membrane, nucleus, plastid, response to water deprivation, response to wounding, sterol binding, sterol transporter activity"
"Chir04Ox-b19280.2",2.89609001050694e-38,0.253854472344247,0.535,0.416,5.69371296065664e-34,"AT2G36900",NA,NA,"MEMB11","cis-Golgi network, endoplasmic reticulum membrane, ER to Golgi transport vesicle membrane, Golgi apparatus, Golgi trans cisterna, late endosome membrane, protein binding, SNAP receptor activity, SNARE binding, SNARE complex, vesicle fusion, vesicle-mediated transport"
"Chir08Ox-b26890.2",4.48596441068696e-99,0.469125308007258,0.609,0.416,8.81940603141057e-95,"AT5G64340",NA,NA,"AT5G64340.1","DNA-binding transcription factor activity, nucleus, protein dimerization activity, regulation of DNA-templated transcription, unidimensional cell growth"
"Chir03Ox-b03490.2",5.13447616226232e-44,0.268970240046887,0.554,0.417,1.00943801350077e-39,"AT3G04240",NA,NA,"AT3G04240.1","glycosyltransferase activity, negative regulation of flower development, nucleus, protein binding, protein O-acetylglucosaminyltransferase activity, protein O-linked glycosylation, vegetative to reproductive phase transition of meristem"
"Chir03Ox-b19370.2",1.06130852499317e-108,0.513659561040144,0.618,0.417,2.08653256013657e-104,"AT3G19540",NA,NA,"BDR4","meiotic cell cycle, mitochondrion, molecular_function, organelle organization, response to chitin"
"Chir05Ox-b24330.2",2.33017096460951e-42,0.289219636256558,0.545,0.417,4.5811161164223e-38,"AT3G58490",NA,NA,"AtSPP1","endoplasmic reticulum membrane, extracellular region, membrane, phospholipid dephosphorylation, response to abscisic acid, sphinganine-1-phosphate aldolase activity, sphingolipid metabolic process, sphingosine-1-phosphate phosphatase activity, stomatal closure"
"Chir07Ox-b18780.2",2.41157725034124e-47,0.279514196136109,0.555,0.418,4.74116087417089e-43,"AT4G22150",NA,NA,"PUX3","autophagosome assembly, cytosol, Golgi organization, membrane fusion, nuclear membrane reassembly, nucleus, proteasome-mediated ubiquitin-dependent protein catabolic process, ubiquitin binding"
"Chir06Ox-b25980.2",4.34543640052056e-59,0.418896514745484,0.586,0.419,8.54312796342342e-55,"AT5G13490",NA,NA,"AAC2","ATP:ADP antiporter activity, chloroplast envelope, copper ion binding, mitochondrial ADP transmembrane transport, mitochondrial ATP transmembrane transport, mitochondrial envelope, mitochondrial inner membrane, mitochondrion, plant-type vacuole, plastid, protein binding, purine nucleotide transport"
"Chir05Ox-b11190.2",3.33254143404669e-42,0.310326978653455,0.55,0.42,6.55177645933579e-38,"AT3G46440",NA,NA,"UXS5","chloroplast, cytoplasm, cytosol, D-xylose metabolic process, NAD+ binding, plasma membrane, UDP-D-xylose biosynthetic process, UDP-glucuronate decarboxylase activity, xylan biosynthetic process"
"Chir06Ox-b33960.2",1.24433894259498e-39,0.257123574391779,0.545,0.42,2.44637036114172e-35,"AT5G04990",NA,NA,"ATSUN1","endoplasmic reticulum, endoplasmic reticulum membrane, meiotic attachment of telomere to nuclear envelope, nuclear envelope, nuclear envelope organization, nucleus, nucleus organization, phragmoplast, protein binding, protein heterooligomerization, protein homooligomerization, protein self-association, protein-membrane adaptor activity, regulation of establishment or maintenance of cell polarity regulating cell shape"
"Chir04Ox-b13020.2",1.84617185971296e-28,0.561464297586232,0.52,0.421,3.62957387619567e-24,"AT2G31200",NA,NA,"ADF6","actin cytoskeleton, actin filament binding, actin filament depolymerization, cytoplasm"
"Chir06Ox-b33870.2",3.46867214334143e-86,0.888801540545821,0.603,0.421,6.81940943380925e-82,"AT5G05090","Yes","G2-like","MUG13.5","DNA-binding transcription factor activity, nucleus, regulation of DNA-templated transcription"
"Chir06Ox-b34410.2",2.82249080880638e-40,0.301305912102392,0.518,0.421,5.54901693011335e-36,"AT5G04510",NA,NA,"PDK1","3-phosphoinositide-dependent protein kinase activity, ATP binding, intracellular signal transduction, kinase activity, nucleus, peptidyl-serine phosphorylation, phosphatidic acid binding, phosphatidylinositol binding, plasma membrane, positive regulation of protein kinase activity, protein autophosphorylation, protein binding, protein kinase activity, protein phosphorylation, protein serine/threonine kinase activity"
"Chir07Ox-b30000.2",6.71544821704639e-59,0.321774031609937,0.567,0.421,1.32025711947132e-54,"AT4G32680",NA,NA,"G1IP","biological_process, endoplasmic reticulum membrane, GET complex, protein binding, protein-membrane adaptor activity"
"Chir08Ox-b28680.2",3.01946732505085e-156,0.831536495105388,0.661,0.421,5.93627276104998e-152,"AT5G67600",NA,NA,"WIH1","megasporogenesis, plasma membrane, protein binding, protein homodimerization activity, protein self-association"
"Chir08Ox-b29510.2",2.17647024694113e-19,0.296847052297518,0.489,0.421,4.27894050548626e-15,NA,NA,NA,NA,NA
"Chir02Ox-b17930.2",2.18623400665939e-49,0.304583609622882,0.55,0.422,4.29813605709237e-45,"AT1G71350",NA,NA,"F3I17.23","cellular catabolic process, cellular_component, embryo development ending in seed dormancy, formation of translation preinitiation complex, organic substance catabolic process, tissue development, translation initiation factor activity"
"Chir03Ox-b26320.2",1.76055121917856e-44,0.281443969861704,0.551,0.422,3.46124369690505e-40,"AT2G04350",NA,NA,"LACS8","chloroplast envelope, endoplasmic reticulum, fatty acid metabolic process, Golgi apparatus, long-chain fatty acid-CoA ligase activity, membrane, mitochondrion"
"Chir05Ox-b00950.2",1.43781925110783e-68,0.329806320558381,0.592,0.423,2.82675264767799e-64,"AT2G01930","Yes","BBR-BPC","BPC1","cis-regulatory region sequence-specific DNA binding, DNA binding, DNA-binding transcription factor activity, nucleus, positive regulation of response to salt stress, regulation of developmental process, regulation of plant-type cell wall organization or biogenesis, response to ethylene, sequence-specific DNA binding, sequence-specific double-stranded DNA binding"
"Chir01Ox-b43230.2",1.84654657422052e-29,0.475158937796534,0.524,0.424,3.63031056491754e-25,"AT1G54130",NA,NA,"AT-RSH3","chloroplast, GTP diphosphokinase activity, guanosine tetraphosphate biosynthetic process, leaf senescence, photosynthesis, plasma membrane"
"Chir04Ox-b21000.2",3.99430627187475e-35,0.403863332468165,0.516,0.424,7.85280613050576e-31,"AT3G51650",NA,NA,"T18N14.30","cellular developmental process, cellular localization, chloroplast, developmental growth, meristem development, molecular_function, plant organ formation, regulation of flower development"
"Chir04Ox-b06370.2",5.21416237221166e-37,0.419974467697393,0.556,0.425,1.02510432237681e-32,"AT2G24550",NA,NA,"F25P17.15","molecular_function, nucleus, positive regulation of DNA-templated transcription, response to cadmium ion, response to oxidative stress"
"Chir01Ox-b02220.2",6.6449762077308e-23,0.291770779740871,0.521,0.427,1.30640232243988e-18,"AT1G03080",NA,NA,"NET1D","actin filament binding, defense response to other organism, organic acid metabolic process, plasma membrane, response to wounding, tropism"
"Chir08Ox-b21420.2",3.26381665759948e-95,0.434166478166844,0.613,0.428,6.41666354884057e-91,"AT5G59160",NA,NA,"TOPP2","cytoplasm, mitochondrion, myosin phosphatase activity, nucleus, protein dephosphorylation, protein phosphatase type 1 complex, protein serine/threonine phosphatase activity"
"Chir08Ox-b27880.2",9.48261357280983e-32,0.783717598166603,0.527,0.428,1.86428182841441e-27,"AT5G65207",NA,NA,NA,"cellular response to hypoxia, cellular_component, hormone-mediated signaling pathway, molecular_function, response to hypoxia, response to organonitrogen compound"
"Chir04Ox-b01610.2",2.98316462478578e-38,0.443374151311201,0.524,0.429,5.86490165232885e-34,"AT2G22250",NA,NA,"ATAAT","amino acid metabolic process, aromatic amino acid family biosynthetic process, prephenate pathway, aspartate-prephenate aminotransferase activity, chloroplast, chloroplast stroma, embryo development ending in seed dormancy, glutamate-prephenate aminotransferase activity, L-aspartate:2-oxoglutarate aminotransferase activity, L-phenylalanine biosynthetic process, pyridoxal phosphate binding, transaminase activity"
"Chir01Ox-b01280.2",2.18354427700289e-68,0.480468208094879,0.587,0.43,4.29284804858769e-64,"AT1G01040",NA,NA,"DCL1","cytokinesis by cell plate formation, cytoplasm, DNA binding, double-stranded RNA binding, embryonic pattern specification, flower development, lsiRNA processing, miRNA processing, miRNA-mediated gene silencing by mRNA destabilization, nuclear dicing body, nucleus, primary miRNA processing, protein binding, regulation of seed maturation, ribonuclease III activity, RNA binding, RNA processing, RNAi-mediated antiviral immune response, rRNA processing, seed morphogenesis, siRNA processing, suspensor development, ta-siRNA processing, vegetative to reproductive phase transition of meristem"
"Chir01Ox-b40540.2",4.99468176580094e-24,1.05671440290757,0.493,0.431,9.81954435156464e-20,"AT1G51680",NA,NA,"4CL.1","4-coumarate-CoA ligase activity, chloroplast, CoA-ligase activity, cytoplasm, phenylpropanoid metabolic process, response to fungus, response to UV, response to wounding"
"Chir02Ox-b00410.2",7.41936963073534e-59,0.323792962338253,0.579,0.432,1.45864806940257e-54,"AT1G64440",NA,NA,"RHD1","cell wall biogenesis, cytosol, galactose metabolic process, Golgi apparatus, Golgi stack, plant-type cell wall biogenesis, protein dimerization activity, RNA binding, root epidermal cell differentiation, rRNA processing, UDP-glucose 4-epimerase activity, xyloglucan biosynthetic process"
"Chir05Ox-b27690.2",6.79983411316783e-55,0.407677187093433,0.581,0.432,1.3368473866488e-50,"AT3G61980",NA,NA,"KPI-1","defense response to fungus, membrane, serine-type endopeptidase inhibitor activity"
"Chir08Ox-b04270.2",1.58502559555963e-51,0.345632891841394,0.58,0.433,3.11616032087022e-47,"AT4G05020",NA,NA,"NDB2","alternative oxidase activity, alternative respiration, calcium ion binding, extrinsic component of mitochondrial inner membrane, mitochondrial intermembrane space, mitochondrion, NADH dehydrogenase activity, NADH oxidation, oxidoreductase activity"
"Chir03Ox-b05350.2",6.91259690258308e-34,0.332100735872792,0.531,0.434,1.35901655104783e-29,"AT3G05900",NA,NA,"F2O10.14","cell differentiation, cell wall organization or biogenesis, cytoplasm, cytosol, developmental growth, lipid biosynthetic process, molecular_function, plant epidermis development, response to blue light, root morphogenesis, signal transduction"
"Chir04Ox-b16880.2",3.08096732652196e-37,0.29775133766708,0.542,0.434,6.05718176394217e-33,"AT2G34690",NA,NA,"AT2G34690.1","cell death, ceramide 1-phosphate binding, ceramide 1-phosphate transfer activity, ceramide transport, cytoplasm, cytosol, defense response to bacterium, intermembrane lipid transfer, protein binding, response to salicylic acid, sphingomyelin transfer activity"
"Chir03Ox-b03990.2",4.19766608712858e-34,0.301358432206397,0.533,0.435,8.25261152729479e-30,"AT3G04710",NA,NA,"TPR10","cellular_component, molecular_function, response to inorganic substance, root morphogenesis"
"Chir03Ox-b11760.2",9.837695053575e-51,0.28631358961031,0.589,0.436,1.93409084753285e-46,"AT3G12587",NA,NA,NA,"biological_process, chloroplast, molecular_function"
"Chir08Ox-b27660.2",7.04848540885666e-64,0.317946864352871,0.582,0.436,1.38573223138122e-59,"AT5G65000",NA,NA,"TEX2","chloroplast, endoplasmic reticulum, negative regulation of cytokinin dehydrogenase activity, negative regulation of ER-associated ubiquitin-dependent protein catabolic process, pollen exine formation, protein binding, regulation of shoot apical meristem development, sialic acid transmembrane transporter activity, sialic acid transport, UDP-N-acetylgalactosamine transmembrane transport, UDP-N-acetylgalactosamine transmembrane transporter activity, UDP-N-acetylglucosamine transmembrane transport"
"Chir03Ox-b00740.2",4.2481613314317e-32,0.275096746340414,0.527,0.437,8.35188517759472e-28,"AT3G01400",NA,NA,"T13O15.4","biological_process, cytoplasm, molecular_function, nucleus"
"Chir06Ox-b14490.2",1.95887875241669e-49,0.366988943164906,0.575,0.437,3.8511556272512e-45,"AT5G25280",NA,NA,"AT5G25280.1","cellular response to oxygen-containing compound, defense response to bacterium, immune system process, nucleus, protein binding, response to light stimulus, response to organic cyclic compound, response to osmotic stress, signal transduction"
"Chir01Ox-b12330.2",1.17017569505758e-55,0.339656932412694,0.58,0.438,2.30056541648321e-51,"AT1G12430",NA,NA,"PAK","ATP hydrolysis activity, cytoskeleton-dependent intracellular transport, kinesin complex, microtubule, microtubule binding, microtubule motor activity, microtubule-based movement, preprophase band, regulation of microtubule-based process, root development"
"Chir06Ox-b13200.2",1.00443453603483e-120,0.598842582051664,0.652,0.438,1.97471829784447e-116,"AT5G26600",NA,NA,NA,"auxin metabolic process, cell wall organization or biogenesis, cellular catabolic process, chloroplast, defense response to bacterium, defense response to fungus, glucosinolate metabolic process, jasmonic acid mediated signaling pathway, molecular_function, monocarboxylic acid biosynthetic process, organonitrogen compound catabolic process, regulation of defense response, response to ethylene, response to wounding, tryptophan metabolic process"
"Chir04Ox-b07720.2",1.12089914414821e-103,0.525336300806637,0.621,0.439,2.20368771739538e-99,"AT2G26730",NA,NA,"F18A8.10","cell division, peroxisome, plant-type cell wall biogenesis, plasma membrane, protein binding, protein kinase activity, protein phosphorylation"
"Chir05Ox-b23250.2",2.92578545504581e-139,0.63012734739087,0.708,0.44,5.75209420462005e-135,"AT3G57550",NA,NA,"AGK2","cytoplasm, cytosol, gametophyte development, guanylate kinase activity, nucleotide metabolic process, regulation of developmental growth"
"Chir01Ox-b25500.2",3.84127734034337e-49,0.332354669479776,0.564,0.441,7.55195125111506e-45,"AT1G25280",NA,NA,"AtTLP10","chloroplast, cytosol, nucleus, plasma membrane, plastid, protein binding, regulation of DNA-templated transcription, response to fungus"
"Chir07Ox-b29130.2",0.335907178058998,0.439244894842191,0.438,0.441,1,"AT4G31840",NA,NA,"AtENODL15","electron transfer activity, extracellular region, leaf development, membrane, negative regulation of cellular process, plant epidermal cell differentiation, plant epidermis development, plasma membrane, secretory vesicle"
"Chir08Ox-b20090.2",2.10415804986254e-27,0.286925930893561,0.542,0.441,4.13677472602975e-23,"AT5G57910",NA,NA,"INB2B","catabolic process, cellular response to oxygen-containing compound, defense response to other organism, Ino80 complex, mitochondrion, molecular_function, monocarboxylic acid metabolic process, nucleus, response to ethylene, response to fungus, response to water deprivation"
"Chir02Ox-b24850.2",4.75497943345704e-29,0.315482920283934,0.536,0.442,9.34828956617653e-25,"AT1G77770",NA,NA,"AT1G77770.1","cell differentiation, developmental growth, nucleus, organelle organization, protein binding"
"Chir04Ox-b26040.2",4.07927265360808e-113,0.609535607630202,0.662,0.442,8.01985003699348e-109,"AT2G43320",NA,NA,"AT2G43320.1","cellular response to oxygen-containing compound, chloroplast, defense response to other organism, hormone-mediated signaling pathway, regulation of defense response, response to abscisic acid, response to chitin, response to inorganic substance, response to jasmonic acid, response to oxidative stress, response to wounding"
"Chir07Ox-b33000.2",1.03572650081746e-54,0.387341827510521,0.578,0.442,2.03623830060712e-50,"AT4G35550","Yes","WOX","HB-4","callus formation, DNA-binding transcription factor activity, fruit dehiscence, fruit replum development, nucleus, regulation of DNA-templated transcription, transcription cis-regulatory region binding"
"Chir08Ox-b07420.2",3.01196111197152e-47,0.28649888350035,0.571,0.442,5.92151554613601e-43,"AT4G10810",NA,NA,"F25I24.20","biological_process, molecular_function, nucleus"
"Chir01Ox-b26160.2",8.43546962593835e-30,0.252261456264946,0.548,0.443,1.65841332845948e-25,"AT1G27350",NA,NA,"F17L21.31","cellular catabolic process, endoplasmic reticulum unfolded protein response, mitochondrion, molecular_function, organonitrogen compound catabolic process, response to inorganic substance, response to organic cyclic compound, response to organonitrogen compound, small molecule metabolic process"
"Chir04Ox-b19480.2",1.86984518341402e-149,0.5831148546291,0.688,0.443,3.67611563059197e-145,"AT2G37050",NA,NA,"SIMP1","chloroplast, endoplasmic reticulum, extracellular region, kinase activity, plasma membrane, plasmodesma, protein binding, protein kinase activity, protein phosphorylation, protein serine/threonine kinase activity"
"Chir07Ox-b14740.2",7.66361391282427e-71,0.51162096449087,0.617,0.443,1.50666649526125e-66,"AT4G17900",NA,NA,"AT4G17900.2","cellular response to oxygen-containing compound, defense response to bacterium, defense response to fungus, hormone-mediated signaling pathway, mitochondrion, nucleus, response to chitin, response to fungus, response to organic cyclic compound, response to oxidative stress, response to wounding"
"Chir03Ox-b01880.2",2.71497466076162e-06,0.297596028306973,0.456,0.444,0.0533764018305734,"AT3G02750",NA,NA,"F13E7.31","chloroplast, myosin phosphatase activity, peptidyl-threonine dephosphorylation, protein serine/threonine phosphatase activity"
"Chir03Ox-b07920.2",7.59623114783637e-72,0.456212702344275,0.609,0.444,1.49341904366463e-67,"AT3G08710",NA,NA,"ATH9","cell communication, cytoplasm, cytosol, oxidoreductase activity, plasma membrane, plastid, protein binding"
"Chir03Ox-b35200.2",5.49987067879527e-58,0.74052926744191,0.568,0.445,1.08127457545115e-53,"AT2G20610",NA,NA,"SUR1","adventitious root development, carbon-sulfur lyase activity, cytoplasm, cytosol, defense response to fungus, glucosinolate biosynthetic process, indoleacetic acid biosynthetic process, L-tyrosine:2-oxoglutarate aminotransferase activity, mitochondrion, protein binding, pyridoxal phosphate binding, regulation of cell growth by extracellular stimulus, S-alkylthiohydroximate lyase activity, tyrosine catabolic process"
"Chir06Ox-b05710.2",7.49160754009195e-22,0.390180174740009,0.516,0.445,1.47285004238208e-17,"AT5G43700",NA,NA,"IAA4","DNA binding, DNA-binding transcription factor activity, identical protein binding, nucleus, protein binding, regulation of DNA-templated transcription, response to auxin, transcription cis-regulatory region binding"
"Chir07Ox-b35310.2",1.21061948414073e-61,0.446923216088566,0.607,0.445,2.38007790582067e-57,"AT4G37870",NA,NA,"PCK1","cellular response to phosphate starvation, cytoplasm, cytosol, gluconeogenesis, nucleolus, phosphoenolpyruvate carboxykinase (ATP) activity"
"Chir01Ox-b29180.2",3.37010796885967e-77,0.477004471172977,0.622,0.45,6.62563226677811e-73,"AT1G30620",NA,NA,"HSR8","arabinose biosynthetic process, capsule polysaccharide biosynthetic process, galactose metabolic process, Golgi apparatus, Golgi trans cisterna, plant-type cell wall biogenesis, UDP-arabinose 4-epimerase activity, UDP-glucose 4-epimerase activity, UDP-L-arabinose biosynthetic process"
"Chir01Ox-b44790.2",3.69856652590355e-36,0.748202147046481,0.538,0.45,7.27138178992638e-32,"AT5G48930",NA,NA,"AT5G48930.1","acyltransferase activity, transferring groups other than amino-acyl groups, auxin homeostasis, cytoplasm, lignin biosynthetic process, membrane, positive regulation of flavonoid biosynthetic process, protein binding, quinate O-hydroxycinnamoyltransferase activity, shikimate O-hydroxycinnamoyltransferase activity"
