"gene_ID","p_val","avg_log2FC","pct.1","pct.2","p_val_adj","AT_ID","TF","TF_family","Gene_code_name","Gene_functions"
"Chir01Ox-b41230.2",3.75222838496028e-117,0.853819755360479,0.398,0.155,7.37688100483192e-113,"AT1G52400",NA,NA,"BGL1","abscisic acid glucose ester beta-glucosidase activity, abscisic acid metabolic process, beta-glucosidase activity, carbohydrate metabolic process, chloroplast, defense response to fungus, endoplasmic reticulum, ER body, extracellular region, glucosinolate catabolic process, identical protein binding, nucleus, peroxisome, plant-type vacuole, plasmodesma, positive regulation of abscisic acid-activated signaling pathway, regulation of stomatal movement, response to abscisic acid, response to insect, response to salt stress, response to water deprivation, water homeostasis"
"Chir07Ox-b10870.2",3.07204278853374e-142,0.550607531897128,0.398,0.155,6.03963612225733e-138,"AT4G14740",NA,NA,"AT4G14740.1","anatomical structure formation involved in morphogenesis, auxin-activated signaling pathway, cellular lipid metabolic process, chloroplast, developmental growth, leaf vascular tissue pattern formation, meiotic cell cycle process, meristem maintenance, monocarboxylic acid metabolic process, nucleus, organelle organization, phloem or xylem histogenesis, phosphatidylinositol binding, post-Golgi vesicle-mediated transport, response to light intensity, response to light stimulus, signal transduction, trans-Golgi network"
"Chir08Ox-b18570.2",0,0.819179496621823,0.573,0.155,0,"AT5G56460",NA,NA,"PBL16","plasma membrane, plasmodesma, protein phosphorylation, protein serine/threonine kinase activity, response to light stimulus, response to wounding, tissue development"
"Chir08Ox-b19320.2",3.37239868604698e-176,0.587119354533167,0.427,0.156,6.63013581676836e-172,"AT5G57130",NA,NA,"SMXL5","carbohydrate homeostasis, cellular_component, phloem transport"
"Chir01Ox-b11090.2",5.61193421335816e-56,0.501197530646988,0.316,0.157,1.10330626634622e-51,"AT1G11260",NA,NA,"ATSTP1","carbohydrate transmembrane transporter activity, cytoplasm, extracellular region, monosaccharide transmembrane transport, monosaccharide transmembrane transporter activity, plant-type vacuole, plasma membrane, plasmodesma"
"Chir08Ox-b25160.2",0.748135546194811,0.27580156803899,0.143,0.157,1,"AT5G62630",NA,NA,"HIPL2","hormone-mediated signaling pathway, membrane, molecular_function, plasma membrane, plastid"
"Chir05Ox-b26540.2",1.2718782889067e-26,0.294505919564107,0.259,0.158,2.50051271599057e-22,"AT3G60690",NA,NA,"AT3G60690.1","chlorophyll catabolic process, defense response to other organism, mitochondrion, response to auxin, response to fungus"
"Chir02Ox-b27520.2",8.14789142783025e-93,0.299761059818097,0.354,0.159,1.60187545471143e-88,NA,NA,NA,NA,NA
"Chir06Ox-b15990.2",2.2849074062608e-83,0.335359462166808,0.342,0.159,4.49212796070874e-79,"AT5G23760",NA,NA,"MRO11.20","carboxylic acid metabolic process, cellular catabolic process, cellular_component, metal ion binding, organic substance catabolic process, pigment metabolic process, response to light stimulus, terpenoid biosynthetic process"
"Chir07Ox-b21090.2",0,1.0402259564769,0.604,0.159,0,"AT4G24080",NA,NA,"ALL1","aldehyde-lyase activity, catalytic activity, cytokinin-activated signaling pathway, cytoplasm"
"Chir03Ox-b16240.2",1.04918521869524e-87,0.638888260311045,0.36,0.16,2.06269813995484e-83,"AT3G16460",NA,NA,"AT3G16460.1","copper ion binding, cytosol, nucleus, plasmodesma"
"Chir07Ox-b21280.2",1.43675868321752e-134,0.504461897098034,0.415,0.161,2.82466757120564e-130,"AT4G24230",NA,NA,"ACBP3","cellular response to hypoxia, defense response, defense response to bacterium, defense response to fungus, extracellular region, extracellular space, fatty acid metabolic process, fatty acid transport, fatty-acyl-CoA binding, response to absence of light, response to bacterium, response to hypoxia"
"Chir07Ox-b36460.2",0,0.835475981925611,0.566,0.161,0,"AT4G39230",NA,NA,"AtPCBER1","cytoplasm, lignan biosynthetic process, oxidoreductase activity, acting on NAD(P)H, oxygen as acceptor, phenylcoumaran benzylic ether reductase activity"
"Chir08Ox-b05330.2",4.54832309650923e-68,0.301952490935861,0.331,0.161,8.94200320773714e-64,"AT4G12570",NA,NA,"UPL5","cytoplasm, leaf senescence, nucleus, proteasome-mediated ubiquitin-dependent protein catabolic process, protein binding, response to hydrogen peroxide, response to jasmonic acid, ubiquitin protein ligase activity, ubiquitin-protein transferase activity"
"Chir03Ox-b04420.2",1.34532405163448e-135,0.353933383942931,0.404,0.162,2.64490708551338e-131,"AT3G05050",NA,NA,"T12H1.1","cyclin-dependent protein kinase holoenzyme complex, cyclin-dependent protein serine/threonine kinase activity, nucleus, phosphorylation of RNA polymerase II C-terminal domain, positive regulation of transcription elongation by RNA polymerase II, protein phosphorylation, RNA polymerase II CTD heptapeptide repeat kinase activity"
"Chir05Ox-b22360.2",8.71514359879764e-274,0.54532901786068,0.509,0.162,1.71339723152362e-269,"AT3G56760",NA,NA,"T8M16.90","calcium-dependent protein serine/threonine kinase activity, calmodulin binding, calmodulin-dependent protein kinase activity, cytoplasm, intracellular signal transduction, nucleus, peptidyl-serine phosphorylation, plasma membrane, protein autophosphorylation"
"Chir04Ox-b16010.2",2.89931829164811e-12,0.425420513089404,0.23,0.163,5.70005976138019e-08,"AT2G33830",NA,NA,"AtDRM2","cytosol, endoplasmic reticulum, nucleus, response to bacterium"
"Chir08Ox-b27020.2",1.71552890904829e-50,0.317829189951799,0.307,0.163,3.37272983518893e-46,"AT5G64430",NA,NA,"T12B11.2","cellular catabolic process, cellular response to organic substance, chloroplast envelope, cytoplasm, leaf development, leaf senescence, molecular_function, monocarboxylic acid metabolic process, organic substance catabolic process, plastid, response to ethylene, response to water deprivation, vacuole organization"
"Chir01Ox-b28420.2",5.98722795285481e-27,0.526289692893181,0.267,0.164,1.17708901553126e-22,"AT1G30135",NA,NA,"JAZ8","nucleus, protein binding, regulation of defense response, regulation of jasmonic acid mediated signaling pathway, response to wounding"
"Chir08Ox-b05940.2",6.55192106097428e-57,0.358502523208065,0.319,0.164,1.28810768058754e-52,"AT4G12000",NA,NA,"AT4G12000.1","plasma membrane, response to oxidative stress"
"Chir03Ox-b32240.2",6.04084847546388e-44,0.25122993939656,0.304,0.165,1.1876308102762e-39,"AT2G17787",NA,NA,NA,"molecular_function, nucleus, response to abscisic acid, response to water"
"Chir04Ox-b01030.2",5.24933442614758e-39,0.320275085693218,0.298,0.167,1.03201914818061e-34,"AT2G21780",NA,NA,"F7D8.10","defense response to other organism, molecular_function, nucleus, regulation of defense response"
"Chir06Ox-b03810.2",3.10753018580005e-121,0.470267987832781,0.397,0.168,6.1094043452829e-117,"AT5G45020",NA,NA,"K21C13.21","cytoplasm, fruit development, glutathione transferase activity, nucleus"
"Chir05Ox-b12990.2",3.95637313251205e-83,0.55429104773198,0.365,0.169,7.7782295785187e-79,"AT3G48100",NA,NA,"ARR5","circadian rhythm, cytokinin-activated signaling pathway, cytoplasm, nucleus, phosphorelay response regulator activity, protein binding, regulation of DNA-templated transcription, response to cytokinin, response to red light"
"Chir06Ox-b04050.2",2.18084371302356e-81,0.272857303954144,0.359,0.169,4.28753873980433e-77,"AT5G44790",NA,NA,"RAN1","ATP hydrolysis activity, copper ion binding, copper ion homeostasis, copper ion transmembrane transporter activity, endosome, ethylene-activated signaling pathway, Golgi apparatus, membrane, P-type divalent copper transporter activity, P-type ion transporter activity, regulation of stomatal movement, response to ethylene, trans-Golgi network"
"Chir08Ox-b03650.2",0,0.962584020243406,0.691,0.169,0,"AT4G03415",NA,NA,"PP2C52","myosin phosphatase activity, nucleus, peptidyl-threonine dephosphorylation, phosphoprotein phosphatase activity, plasma membrane, protein binding, protein dephosphorylation, protein serine/threonine phosphatase activity"
"Chir05Ox-b00790.2",1.04968344474594e-98,0.338867700823994,0.377,0.17,2.06367765237051e-94,"AT2G01818",NA,NA,"AT2G01818.1","anatomical structure arrangement, defense response to other organism, nucleus, tissue development, zinc ion binding"
"Chir07Ox-b12350.2",0.164443860901122,0.311508293899185,0.183,0.171,1,"AT4G15830",NA,NA,"DL3955C","cytoplasmic microtubule, microtubule binding, microtubule cytoskeleton organization"
"Chir07Ox-b33640.2",1.01987727699192e-66,0.309662831273117,0.342,0.171,2.00507872656612e-62,"AT4G36120",NA,NA,"T19K4.250","cell differentiation, cell division, defense response to other organism, developmental growth, molecular_function, nucleus, plant epidermis development, regionalization, regulation of multicellular organismal process, response to bacterium, root morphogenesis"
"Chir05Ox-b01040.2",1.51569222070076e-28,0.547556615935459,0.288,0.172,2.97985090589769e-24,"AT2G02010",NA,NA,"GAD4","cellular response to organic substance, chloroplast, cytosol, defense response to bacterium, defense response to fungus, flower development, glutamate catabolic process, glutamate decarboxylase activity, glutamate metabolic process, mitochondrion, pyridoxal phosphate binding, sulfur compound metabolic process, tissue development, toxin metabolic process"
"Chir01Ox-b14360.2",2.53850436469656e-104,0.44908822932625,0.39,0.173,4.99069958099343e-100,"AT1G14340",NA,NA,"BPL3","cellular_component, response to inorganic substance, RNA binding, small molecule metabolic process"
"Chir04Ox-b20870.2",8.19600355476756e-106,0.382546079939224,0.387,0.173,1.6113342988673e-101,"AT2G38410",NA,NA,"AT2G38410.1","cytoplasm, early endosome, intracellular anatomical structure, nucleus, phosphatidylinositol binding, protein transport to vacuole involved in ubiquitin-dependent protein catabolic process via the multivesicular body sorting pathway, ubiquitin binding"
"Chir08Ox-b30020.2",1.16715484677952e-97,0.266474332150819,0.39,0.173,2.29462642876854e-93,"AT5G66560",NA,NA,"K1F13.23","anatomical structure arrangement, cell division, chloroplast, developmental growth, meristem development, molecular_function, nucleus, plant organ morphogenesis, regulation of developmental process, seed development, shoot system morphogenesis"
"Chir01Ox-b13250.2",2.0463023248244e-123,0.377065766311476,0.417,0.174,4.02303037060478e-119,"AT1G13280",NA,NA,"AT1G13280.1","allene-oxide cyclase activity, chloroplast, extracellular region, jasmonic acid biosynthetic process, mitochondrion, plasma membrane"
"Chir04Ox-b22270.2",4.48150950344735e-262,1.53335138578539,0.529,0.174,8.81064768377749e-258,"AT2G39700",NA,NA,"ATEXPA4","extracellular region, plant-type cell wall, plant-type cell wall loosening, plant-type cell wall organization, plasmodesma, syncytium formation, unidimensional cell growth"
"Chir05Ox-b14810.2",1.09347090245358e-67,0.250338335425881,0.346,0.175,2.14976379422374e-63,"AT3G49750",NA,NA,"AT3G49750.2","extracellular region, plasma membrane, signal transduction"
"Chir07Ox-b30500.2",2.9559987567452e-34,0.266226695518594,0.292,0.175,5.81149355576105e-30,"AT4G33160",NA,NA,"AT4G33160.2","nucleus, ubiquitin-dependent protein catabolic process"
"Chir04Ox-b25690.2",3.77582746494492e-66,0.295723351191876,0.346,0.177,7.42327679608172e-62,"AT2G42960",NA,NA,"F7D19.4","chloroplast, cytoplasm, cytosol, phosphorylation, phyllome development, protein phosphorylation, protein serine/threonine kinase activity"
"Chir05Ox-b20980.2",5.67008963248872e-98,0.314267070900902,0.383,0.177,1.11473962174728e-93,"AT3G55420",NA,NA,"T22E16.80","cell wall organization or biogenesis, cellular carbohydrate metabolic process, molecular_function, nucleus"
"Chir01Ox-b14350.2",2.74504513288609e-48,0.275382352890845,0.323,0.178,5.39675873125405e-44,"AT1G14330",NA,NA,"F14L17.10","aging, cellular response to hormone stimulus, cellular response to organic cyclic compound, cellular response to oxygen-containing compound, defense response to other organism, developmental growth, molecular_function, nucleus, regulation of signal transduction, response to abscisic acid, response to chitin, toxin metabolic process"
"Chir04Ox-b20460.2",9.73551042655129e-28,0.270007105812075,0.284,0.178,1.91400134985998e-23,"AT2G38000",NA,NA,"AT2G38000.1","cell wall biogenesis, cellular catabolic process, cellular localization, cytoplasm, defense response to other organism, endoplasmic reticulum, fatty acid metabolic process, hormone-mediated signaling pathway, macromolecule localization, organic substance catabolic process, regulation of defense response, response to abscisic acid, response to fungus, response to organonitrogen compound, response to salicylic acid, response to salt stress, response to water deprivation"
"Chir04Ox-b26940.2",8.52596924988219e-242,0.908453014920566,0.505,0.178,1.67620555452684e-237,"AT2G44130",NA,NA,"KFB39","cytoplasm, cytosol, protein binding, regulation of phenylpropanoid metabolic process"
"Chir04Ox-b15390.2",3.18365971646849e-300,0.800112544945063,0.541,0.179,6.25907500257705e-296,"AT2G33310",NA,NA,"AT2G33310.1","DNA-binding transcription factor activity, identical protein binding, nucleus, protein binding, regulation of DNA-templated transcription, response to auxin"
"Chir07Ox-b13590.2",2.94397475836136e-197,0.68924966619894,0.484,0.179,5.78785437493843e-193,"AT4G16780","Yes","HD-ZIP","ATHB-2","DNA-binding transcription factor activity, DNA-binding transcription factor activity, RNA polymerase II-specific, lateral root formation, negative regulation of DNA-templated transcription, nucleus, protein binding, protein homodimerization activity, red or far-red light signaling pathway, response to auxin, response to cytokinin, response to far red light, root development, secondary thickening, sequence-specific DNA binding, shade avoidance, shoot system morphogenesis, unidimensional cell growth"
"Chir08Ox-b23150.2",5.38065693566782e-231,0.547696536388153,0.505,0.179,1.05783715355229e-226,"AT5G60690","Yes","HD-ZIP","AVB1","cell differentiation, determination of bilateral symmetry, DNA-binding transcription factor activity, lipid binding, meristem initiation, nucleus, polarity specification of adaxial/abaxial axis, protein binding, radial pattern formation, transcription cis-regulatory region binding, xylem and phloem pattern formation, xylem development"
"Chir05Ox-b03140.2",4.52735533444297e-20,0.330153423349074,0.266,0.18,8.90078058751488e-16,"AT3G25870",NA,NA,"MPE11.2","molecular_function, nucleus, response to light stimulus, response to osmotic stress, response to water deprivation, sulfur compound metabolic process"
"Chir04Ox-b24540.2",1.03103659791566e-165,0.373340747794711,0.469,0.181,2.0270179515022e-161,"AT2G41740",NA,NA,"ATVLN2","actin filament binding, actin filament bundle assembly, actin filament severing, cytoplasm, cytosol, mRNA binding, protein binding"
"Chir07Ox-b27640.2",2.78126197062522e-117,0.467243192822741,0.411,0.181,5.46796103424918e-113,"AT4G30370",NA,NA,"IDF1","cellular response to hypoxia"
"Chir02Ox-b01200.2",1.10501179454126e-74,0.270851944971637,0.363,0.182,2.17245318806812e-70,"AT1G63800",NA,NA,"UBC5","cytoplasm, nucleus, ubiquitin conjugating enzyme activity, ubiquitin-dependent protein catabolic process, ubiquitin-protein transferase activity"
"Chir08Ox-b18270.2",1.32412025968365e-62,0.2581431217347,0.346,0.182,2.60322043053805e-58,"AT5G56270","Yes","WRKY","WRKY2","DNA-binding transcription factor activity, establishment of cell polarity, longitudinal axis specification, nucleus, pollen development, protein binding, regulation of DNA-templated transcription, transcription cis-regulatory region binding"
"Chir01Ox-b03800.2",2.75177073680505e-78,0.506909812734248,0.389,0.183,5.40998126855874e-74,"AT1G04680",NA,NA,"AT1G04680.1","cell differentiation, developmental growth, extracellular region, glucosinolate metabolic process, lyase activity, pectate lyase activity, pectin catabolic process, plant-type cell wall organization or biogenesis, secondary metabolite biosynthetic process, sulfur compound biosynthetic process"
"Chir05Ox-b27350.2",7.69232664925228e-74,0.28992057611884,0.357,0.183,1.512311419243e-69,"AT3G61670",NA,NA,"F15G16.60","meristem development, molecular_function, nucleus, plasma membrane, regulation of defense response to fungus"
"Chir06Ox-b31720.2",8.8838375547893e-38,0.540018768871314,0.314,0.183,1.74656246327158e-33,"AT5G07220",NA,NA,"ATBAG3","adenyl-nucleotide exchange factor activity, chaperone binding, cytoplasm, nucleus, protein stabilization"
"Chir07Ox-b17140.2",2.09095601523263e-32,0.334454150506502,0.305,0.183,4.11081952594735e-28,"AT4G20320",NA,NA,"CTPS4","'de novo' CTP biosynthetic process, CTP biosynthetic process, CTP synthase activity, cytoophidium, cytosol, identical protein binding, nucleus, pyrimidine nucleobase biosynthetic process"
"Chir04Ox-b13630.2",2.71243873228078e-32,0.54463723492939,0.297,0.185,5.33265454766401e-28,"AT2G31790",NA,NA,"AT2G31790.1","chloroplast, glucosinolate metabolic process, glycosyltransferase activity, organic acid biosynthetic process, peroxisome, quercetin 3-O-glucosyltransferase activity, quercetin 7-O-glucosyltransferase activity, regulation of secondary metabolic process, regulation of small molecule metabolic process, response to inorganic substance, signal transduction"
"Chir05Ox-b21600.2",1.38149325771512e-11,0.448522498391686,0.252,0.186,2.71601574466792e-07,"AT3G55970",NA,NA,"ATJRG21","cytoplasm, dioxygenase activity, jasmonic acid hydrolase, negative regulation of defense response to insect, regulation of defense response to fungus, regulation of jasmonic acid mediated signaling pathway"
"Chir03Ox-b06110.2",1.8999728273678e-122,0.5003758772088,0.422,0.188,3.7353465786051e-118,"AT3G06590","Yes","bHLH","RITF1","DNA-binding transcription factor activity, nucleus, protein binding, protein dimerization activity, regulation of DNA-templated transcription, response to hydrogen peroxide, response to oxidative stress, response to salt stress, sequence-specific DNA binding, transcription cis-regulatory region binding"
"Chir01Ox-b33890.2",7.66833346188688e-141,0.420821402318142,0.464,0.189,1.50759435860696e-136,"AT1G41830",NA,NA,"SKS6","apoplast, cell wall biogenesis, copper ion binding, extracellular region, glucosinolate metabolic process, oxidoreductase activity, plant-type cell wall, plant-type cell wall organization or biogenesis, plasmodesma, response to inorganic substance, secretory vesicle"
"Chir04Ox-b00170.2",1.86527359498365e-224,0.743871470959254,0.528,0.189,3.66712788773785e-220,NA,NA,NA,NA,NA
"Chir08Ox-b21280.2",1.16074352276338e-53,0.268329124678462,0.345,0.189,2.28202176575281e-49,"AT5G59020",NA,NA,"K19M22.16","cell differentiation, cytokinesis, hormone-mediated signaling pathway, meristem maintenance, mitochondrion, molecular_function, plant organ morphogenesis, plant-type secondary cell wall biogenesis, protein-containing complex assembly, regulation of biological quality, regulation of cellular component biogenesis, regulation of developmental process, regulation of multicellular organismal process, shoot system development"
"Chir08Ox-b23970.2",8.45588385122128e-66,0.457369430771564,0.363,0.189,1.6624267651501e-61,"AT5G61440",NA,NA,"ACHT5","cell redox homeostasis, chloroplast"
"Chir04Ox-b07420.2",5.86251752077287e-128,0.521448615594759,0.458,0.191,1.15257094458395e-123,"AT2G26580","Yes","YABBY","YAB5","abaxial cell fate specification, cell fate commitment, DNA-binding transcription factor activity, nucleus, polarity specification of adaxial/abaxial axis, protein binding, regulation of DNA-templated transcription, regulation of leaf development, regulation of shoot apical meristem development, transcription cis-regulatory region binding"
"Chir03Ox-b00380.2",3.19116235965226e-09,0.413704117102617,0.245,0.192,6.27382519907634e-05,"AT3G01710",NA,NA,"F4P13.26","biological_process, molecular_function, nucleus"
"Chir04Ox-b29570.2",1.12883326663766e-168,0.954432655306657,0.489,0.192,2.21928620220964e-164,"AT2G46650",NA,NA,"B5 #1","carboxylic acid metabolic process, cell wall organization or biogenesis, cellular catabolic process, cellular macromolecule localization, cytosol, defense response to bacterium, defense response to other organism, heme binding, hormone-mediated signaling pathway, intracellular membrane-bounded organelle, jasmonic acid mediated signaling pathway, membrane, monocarboxylic acid metabolic process, organic substance catabolic process, regulation of small molecule metabolic process, response to wounding, tryptophan metabolic process"
"Chir08Ox-b23950.2",2.10708959127829e-217,1.12310509683736,0.52,0.194,4.14253813645312e-213,"AT5G61420","Yes","MYB","HAG1","cellular response to sulfur starvation, defense response to fungus, DNA-binding transcription factor activity, induced systemic resistance, nucleus, regulation of DNA-templated transcription, regulation of glucosinolate biosynthetic process, response to bacterium, response to insect, transcription cis-regulatory region binding"
"Chir01Ox-b26840.2",6.82078995146712e-05,0.309348981440281,0.223,0.195,1,"AT1G28110",NA,NA,"SCPL45","chloroplast, plant-type cell wall, plasmodesma, serine-type carboxypeptidase activity"
"Chir03Ox-b10740.2",5.30210883509695e-07,0.28907763224619,0.234,0.195,0.0104239459698006,"AT3G11490",NA,NA,"ROPGAP4","chloroplast, molecular_function, plant-type cell wall organization, response to anoxia, signal transduction"
"Chir01Ox-b09840.2",0.000231206197942614,0.263802766042072,0.226,0.198,1,"AT1G10140",NA,NA,"F14N23.2","cellular response to hypoxia, cellular response to oxygen-containing compound, cellular_component, defense response to other organism, hormone-mediated signaling pathway, molecular_function, regulation of defense response, response to abscisic acid, response to fungus, response to hypoxia, response to oxidative stress, response to water deprivation, toxin metabolic process"
"Chir03Ox-b00490.2",1.12739660502201e-53,0.272215028385633,0.35,0.198,2.21646172547327e-49,"AT3G01590",NA,NA,"AT3G01590.1","carbohydrate metabolic process, cytoplasm, glucose-6-phosphate 1-epimerase activity, nucleus"
"Chir06Ox-b29860.2",7.38982914612755e-55,0.271662598444459,0.354,0.201,1.45284041012868e-50,"AT5G09460",NA,NA,"AT5G09460.1","DNA-binding transcription factor activity, nucleus, protein binding, protein dimerization activity, regulation of DNA-templated transcription"
"Chir02Ox-b14150.2",1.0287433386517e-288,0.727116172647247,0.582,0.202,2.02250940378924e-284,"AT1G67880",NA,NA,"T23K23.27","beta-1,4-mannosylglycoprotein 4-beta-N-acetylglucosaminyltransferase activity, defense response to bacterium, defense response to fungus, glycosyltransferase activity, Golgi apparatus, hormone-mediated signaling pathway, N-acetylglucosamine metabolic process, protein N-linked glycosylation, response to chitin, response to organic cyclic compound, response to osmotic stress, response to water deprivation, response to wounding, root morphogenesis"
"Chir04Ox-b12350.2",4.53470104930743e-108,0.428447411416546,0.422,0.202,8.9152222629384e-104,"AT2G30590","Yes","WRKY","WRKY21","calmodulin binding, DNA-binding transcription factor activity, glucosinolate metabolic process, nucleus, protein binding, regulation of DNA-templated transcription, transcription cis-regulatory region binding"
"Chir06Ox-b27080.2",9.61665825999755e-69,0.537071813829332,0.389,0.202,1.89063501391552e-64,"AT5G12050",NA,NA,"BG1","auxin transport, circadian rhythm, molecular_function, nucleus, plasma membrane, positive regulation of auxin mediated signaling pathway"
"Chir01Ox-b41810.2",7.384616246859e-128,0.758325687605811,0.459,0.203,1.45181555413248e-123,NA,NA,NA,NA,NA
"Chir01Ox-b44110.2",6.35963267487667e-89,0.322356933964534,0.417,0.203,1.25030378388075e-84,"AT1G55690",NA,NA,"F20N2.11","cell differentiation, cell division, developmental growth, embryo development ending in seed dormancy, floral organ development, Golgi apparatus, meristem maintenance, molecular_function, negative regulation of cellular biosynthetic process, phyllome development, plant organ morphogenesis, regulation of developmental process"
"Chir05Ox-b01290.2",1.40478824460039e-60,0.627420613904945,0.368,0.203,2.76181368888436e-56,"AT2G02230",NA,NA,"AtPP2-B1","carbohydrate binding, cellular catabolic process, cellular lipid metabolic process, monocarboxylic acid metabolic process, nucleus, protein binding"
"Chir01Ox-b16540.2",1.3692151344019e-143,0.720762992833706,0.473,0.204,2.69187695423413e-139,"AT1G16510",NA,NA,"SAUR41","auxin transport, cytoplasm, molecular_function, positive gravitropism, root radial pattern formation"
"Chir05Ox-b26530.2",3.34888149800648e-61,0.265951162805778,0.368,0.204,6.58390102508074e-57,"AT3G60680",NA,NA,"CHIQL9","cytoskeleton, defense response to other organism, molecular_function, negative gravitropism, peroxisome, response to red or far red light"
"Chir01Ox-b27260.2",4.78708338860307e-64,0.270731909662369,0.38,0.205,9.41140594199364e-60,"AT1G28520","Yes","VOZ","VOZ1","cold acclimation, defense response to bacterium, long-day photoperiodism, flowering, nucleus, positive regulation of DNA-templated transcription, positive regulation of long-day photoperiodism, flowering, protein binding, regulation of DNA-templated transcription, response to heat, response to salt stress, response to water deprivation, sequence-specific DNA binding"
"Chir03Ox-b35050.2",3.48691513432309e-13,0.274446233206735,0.273,0.205,6.8552751540792e-09,"AT2G20515",NA,NA,NA,"cell cycle, extracellular region, molecular_function"
"Chir06Ox-b31830.2",2.25936073638066e-85,0.930511448497094,0.408,0.205,4.44190320772438e-81,"AT5G07100","Yes","WRKY","WRKY26","cellular heat acclimation, cellular response to heat, DNA-binding transcription factor activity, nucleus, protein binding, regulation of DNA-templated transcription, sequence-specific DNA binding"
