"gene_ID","p_val","avg_log2FC","pct.1","pct.2","p_val_adj","AT_ID","TF","TF_family","Gene_code_name","Gene_functions"
"Chir04Ox-b18540.2",0.15945799896734,0.319424684434789,0.602,0.672,1,"AT2G36310",NA,NA,"URH1","adenosine nucleosidase activity, cytosol, identical protein binding, inosine nucleosidase activity, protein binding, protein heterodimerization activity, protein homodimerization activity, purine nucleosidase activity, purine nucleoside catabolic process, uridine catabolic process, uridine nucleosidase activity, xanthosine nucleotidase activity"
"Chir01Ox-b10190.2",9.69630205993874e-23,0.44040637482872,0.68,0.673,1.90629298498396e-18,"AT1G10470",NA,NA,"ARR4","circadian rhythm, cytokinin-activated signaling pathway, cytoplasm, embryo development ending in seed dormancy, nucleus, phosphorelay response regulator activity, protein autophosphorylation, protein binding, protein serine/threonine kinase activity, red or far-red light signaling pathway, regulation of circadian rhythm, regulation of DNA-templated transcription, response to cytokinin, response to red light"
"Chir01Ox-b10380.2",5.45533615596283e-57,0.357283329961015,0.748,0.674,1.07251908826229e-52,NA,NA,NA,NA,NA
"Chir01Ox-b20510.2",1.20062781804519e-28,0.406703856603217,0.725,0.675,2.36043429027685e-24,"AT1G20693",NA,NA,"HMG BETA 1","chromatin, chromatin binding, DNA binding, DNA-binding transcription factor activity, nucleus, structural constituent of chromatin"
"Chir02Ox-b28050.2",4.85938065928192e-121,0.583134935007441,0.795,0.675,9.55354237614826e-117,"AT1G79930",NA,NA,"HSP91","ATP binding, cytoplasm, cytosol, mitochondrion, nucleus, protein binding, protein folding, response to heat"
"Chir03Ox-b05280.2",5.49500270386937e-170,0.610993478696691,0.845,0.676,1.08031753158072e-165,"AT3G05840",NA,NA,"ATSK12","cell cortex, cytoplasm, meristem structural organization, nucleus, phosphorylation, protein autophosphorylation, protein binding, protein phosphorylation, protein serine/threonine kinase activity, signal transduction"
"Chir07Ox-b14330.2",6.3316426674034e-31,0.293186477172401,0.708,0.676,1.24480094841151e-26,"AT4G17510",NA,NA,"UCH3","cysteine-type deubiquitinase activity, cytoplasm, protein deubiquitination, ubiquitin-dependent protein catabolic process"
"Chir01Ox-b06760.2",1.39706729550102e-52,0.381333556812654,0.747,0.677,2.746634302955e-48,"AT1G07360",NA,NA,"MAC5A","defense response to bacterium, mRNA binding, nucleus, pre-mRNA binding, protein binding, Prp19 complex, U2-type catalytic step 1 spliceosome, U2-type catalytic step 2 spliceosome, U6 snRNA binding"
"Chir01Ox-b05760.2",2.91847704734538e-44,0.301738759927542,0.746,0.678,5.73772587508102e-40,"AT1G06410",NA,NA,"ATTPS7","cytoplasm, glycosyltransferase activity, trehalose biosynthetic process, trehalose metabolism in response to stress"
"Chir01Ox-b14970.2",2.70429568039686e-45,0.365225271945503,0.737,0.678,5.31664530766022e-41,"AT1G14830",NA,NA,"ADL1C","cell cortex, cell plate, clathrin-coated vesicle, cytoplasm, extracellular region, GTPase activity, membrane, microtubule, microtubule binding, mitochondrial fission, mitochondrion organization, plasma membrane, plasmodesma, pollen maturation"
"Chir04Ox-b16950.2",9.14617087485628e-53,0.336163465950919,0.745,0.678,1.79813719399675e-48,NA,NA,NA,NA,NA
"Chir08Ox-b10610.2",3.09517335035395e-51,0.36739513876943,0.753,0.678,6.08511080679586e-47,"AT5G49720",NA,NA,"ATGH9A1","cell plate, cellulase activity, cellulose biosynthetic process, cortical microtubule organization, early endosome, endosome, Golgi apparatus, hyperosmotic salinity response, plasma membrane, response to cytokinin, shoot system development, trans-Golgi network, unidimensional cell growth"
"Chir03Ox-b22020.2",1.43342894481443e-62,0.363446583919882,0.758,0.679,2.81812130550517e-58,"AT3G21865",NA,NA,"AT3G21865.1","mitochondrion, peroxisome organization, protein binding"
"Chir05Ox-b07570.2",1.24768008391125e-83,0.632931832846443,0.803,0.679,2.45293904496951e-79,"AT3G29360",NA,NA,"UGD2","carbohydrate metabolic process, cell wall pectin metabolic process, cytoplasm, cytosol, glycosaminoglycan biosynthetic process, NAD binding, nucleus, secretory vesicle, UDP-glucose 6-dehydrogenase activity, UDP-glucuronate biosynthetic process"
"Chir08Ox-b22910.2",3.54451813736532e-49,0.331890987204852,0.758,0.679,6.96852265806023e-45,"AT5G60460",NA,NA,"MUF9.9","chloroplast, Golgi apparatus, membrane, molecular_function, plastid, post-translational protein targeting to membrane, translocation, response to inorganic substance, response to light intensity, Sec61 translocon complex, seed maturation, SRP-dependent cotranslational protein targeting to membrane, translocation"
"Chir08Ox-b17480.2",4.76687800434598e-36,0.306337633384123,0.701,0.68,9.3716821565442e-32,"AT5G55530",NA,NA,"MTE17.25","carboxylic acid metabolic process, meristem development, molecular_function, nucleus, pattern specification process, response to jasmonic acid, response to organonitrogen compound"
"Chir03Ox-b35380.2",3.55232157861441e-39,0.305870948865341,0.741,0.681,6.98386422355592e-35,"AT2G20760",NA,NA,"CLC1","clathrin coat of coated pit, clathrin coat of trans-Golgi network vesicle, clathrin heavy chain binding, clathrin vesicle coat, clathrin-dependent endocytosis, cytosol, intracellular protein transport, mitochondrion, nucleus, plasma membrane, structural molecule activity"
"Chir07Ox-b33810.2",8.76272300982628e-65,0.551184233369633,0.766,0.682,1.72275134373185e-60,"AT4G36360",NA,NA,"BGAL3","beta-galactosidase activity, carbohydrate binding, carbohydrate metabolic process, cell division, cell wall, extracellular region, flavonoid metabolic process, meiotic cell cycle process, meristem structural organization, oxoacid metabolic process, plant-type cell wall, plant-type secondary cell wall biogenesis, plasma membrane, regulation of multicellular organismal process, vacuole"
"ChirMtOx-b00900.2",2.04683672437083e-24,0.283898881688695,0.723,0.682,4.02408100011306e-20,"ATMG00270",NA,NA,"NAD6","cellular respiration, mitochondrial respiratory chain complex I, mitochondrion, NADH dehydrogenase (ubiquinone) activity, NADH dehydrogenase activity"
"Chir02Ox-b28040.2",8.31726031153306e-86,0.517491650177127,0.774,0.683,1.6351733772474e-81,NA,NA,NA,NA,NA
"Chir05Ox-b13570.2",1.33121922668947e-56,0.362168377632642,0.752,0.684,2.6171769996715e-52,"AT3G48670",NA,NA,"RDM12","cytoplasm, DNA methylation, protein binding, regulation of double-strand break repair via homologous recombination, response to cadmium ion"
"Chir07Ox-b22020.2",2.32708984906065e-85,0.561069558570174,0.808,0.684,4.57505864325324e-81,"AT4G24990",NA,NA,"ATGP4","catabolic process, molecular_function, plasma membrane"
"ChirMtOx-b00200.2",1.23178417681935e-23,0.277863399687154,0.729,0.684,2.42168769162685e-19,NA,NA,NA,NA,NA
"ChirMtOx-b01290.2",2.54759626699893e-35,0.293358160767863,0.736,0.684,5.0085742609199e-31,"AT2G07675",NA,NA,"T17H1.4","chloroplast, molecular_function, response to heat, tissue development"
"Chir04Ox-b02750.2",1.11698860532467e-08,0.704489588505987,0.643,0.685,0.000219599959806831,"AT2G23320","Yes","WRKY","WRKY15","calmodulin binding, DNA-binding transcription factor activity, nucleus, regulation of DNA-templated transcription, sequence-specific DNA binding, transcription cis-regulatory region binding"
"Chir05Ox-b19180.2",6.1501349901998e-34,0.301753855833061,0.777,0.685,1.20911653907328e-29,"AT2G37470",NA,NA,"HTB5","DNA binding, endoplasmic reticulum, nucleosome assembly, nucleus, protein heterodimerization activity, structural constituent of chromatin"
"Chir07Ox-b21770.2",2.33396216481644e-48,0.306777280438871,0.755,0.685,4.58856961602911e-44,"AT4G24740",NA,NA,"AFC2","ATP binding, cytoplasm, mitochondrion, mRNA processing, nucleus, protein autophosphorylation, protein binding, protein kinase activity, protein phosphorylation, protein serine/threonine kinase activity, protein serine/threonine/tyrosine kinase activity"
"Chir07Ox-b32780.2",2.35940494294041e-87,0.412355052668887,0.792,0.685,4.63859011782085e-83,"AT4G35310",NA,NA,"CPK5","calcium ion binding, calcium-dependent protein serine/threonine kinase activity, calmodulin binding, calmodulin-dependent protein kinase activity, cytoplasm, cytosol, intracellular signal transduction, membrane, nucleus, peptidyl-serine phosphorylation, plasma membrane, protein autophosphorylation"
"Chir06Ox-b24770.2",9.52879351308501e-30,0.391848094998581,0.681,0.686,1.87336080467251e-25,"AT5G14640",NA,NA,"ATSK13","chloroplast, cytoplasm, hyperosmotic response, protein autophosphorylation, protein binding, protein serine/threonine kinase activity, response to salt stress, signal transduction"
"Chir02Ox-b04020.2",2.32645475376765e-53,0.317641323511533,0.756,0.687,4.57381004590721e-49,"AT1G61730","Yes","GeBP","T13M11.9","glucosinolate metabolic process, nucleolus, nucleus, protein binding, regulation of DNA-templated transcription, transcription cis-regulatory region binding"
"Chir06Ox-b28400.2",5.39033656165521e-34,0.26487663698308,0.743,0.687,1.05974016802141e-29,"AT5G10840",NA,NA,"TMN8","endosome, Golgi apparatus, Golgi medial cisterna, membrane, mitochondrion, plant-type cell wall, plant-type vacuole, trans-Golgi network"
"Chir04Ox-b22510.2",1.01433021502215e-73,0.396283006497437,0.783,0.688,1.99417320273355e-69,"AT2G39900",NA,NA,"WLIM2a","actin cytoskeleton, actin filament binding, actin filament bundle assembly, plasma membrane"
"Chir08Ox-b27470.2",6.62218041460911e-31,0.351131168255246,0.723,0.688,1.30192066951215e-26,"AT5G64850",NA,NA,"MXK3.7","cell differentiation, cellular response to light stimulus, defense response to other organism, developmental growth, molecular_function, nucleus, root morphogenesis, tissue development, unidimensional cell growth"
"ChirMtOx-b01410.2",3.2119553066618e-37,0.308759077313534,0.748,0.688,6.31470413289711e-33,"AT2G07687",NA,NA,"T17H1.13","biological_process, mitochondrion, molecular_function"
"Chir01Ox-b31460.2",6.94946080705805e-99,0.462696598317307,0.804,0.689,1.36626399466761e-94,"AT1G32790",NA,NA,"AT1G32790.2","blue light signaling pathway, cytoplasm, lipid metabolic process, mRNA binding, nucleus, response to inorganic substance, small molecule metabolic process"
"Chir01Ox-b06230.2",3.86426806556096e-41,0.308701390586448,0.754,0.69,7.59715101689284e-37,"AT1G06870",NA,NA,"Plsp2A","chloroplast thylakoid membrane, plasma membrane, serine-type endopeptidase activity, signal peptide processing, thylakoid membrane organization"
"Chir01Ox-b17450.2",8.30588831961118e-55,0.334749724432424,0.744,0.69,1.63293764363556e-50,"AT1G17370",NA,NA,"UBP1B","cell wall organization or biogenesis, mRNA binding, negative regulation of metabolic process, protein binding, response to wounding, RNA binding"
"Chir03Ox-b02300.2",2.01677492742172e-137,0.61996124082123,0.828,0.69,3.9649795073111e-133,"AT3G03160",NA,NA,"T17B22.15","endoplasmic reticulum membrane, endoplasmic reticulum to Golgi vesicle-mediated transport, mitochondrion, molecular_function"
"Chir04Ox-b08050.2",5.64775848582728e-24,0.320826516396866,0.686,0.69,1.11034931831364e-19,"AT2G27030",NA,NA,"CAM5","calcium ion binding, cytoplasm, cytosol, nucleus, peroxisome, plant-type vacuole, plasma membrane, protein binding"
"Chir03Ox-b04580.2",2.80333734246137e-58,0.501768324971904,0.751,0.691,5.51136121527906e-54,"AT3G05220",NA,NA,"AT3G05220.1","cellular response to lipid, cellular response to oxygen-containing compound, defense response to bacterium, extracellular region, hormone-mediated signaling pathway, negative regulation of metabolic process, plasmodesma, sulfur compound metabolic process"
"Chir06Ox-b32880.2",7.37494022476983e-147,0.773438501910583,0.831,0.691,1.44991324818975e-142,"AT5G06370",NA,NA,"PSE1","cellular response to lead ion, cytoplasm, lead ion transport, molecular_function, phytochelatin biosynthetic process, response to lead ion"
"Chir01Ox-b08140.2",2.38276345015742e-118,0.866072380243239,0.839,0.692,4.68451294300949e-114,"AT1G08570",NA,NA,"AT1G08570.3","cell redox homeostasis, chloroplast, chloroplast membrane, chloroplast stroma, hormone-mediated signaling pathway, nucleus, oxidoreductase activity, acting on a sulfur group of donors, disulfide as acceptor, response to light intensity, response to osmotic stress, response to red or far red light, response to temperature stimulus, response to water"
"Chir05Ox-b18530.2",1.89144456750277e-93,0.419721814387583,0.798,0.692,3.71858001971045e-89,"AT3G52990",NA,NA,"F8J2.160","chloroplast, cytoplasm, cytosol, glycolytic process, magnesium ion binding, mRNA binding, potassium ion binding, pyruvate kinase activity"
"Chir03Ox-b06980.2",4.9232327909471e-45,0.374932719992476,0.725,0.693,9.679075667002e-41,"AT3G07410",NA,NA,"AtRABA5b","cytosol, endomembrane system, GTPase activity, intracellular protein transport, plasma membrane"
"Chir05Ox-b18380.2",1.13270438123137e-40,0.338927859840399,0.755,0.693,2.22689681350088e-36,"AT3G52850",NA,NA,"VSR1","amino-terminal vacuolar sorting propeptide binding, calcium ion binding, cytosol, endoplasmic reticulum, endosome, extracellular region, Golgi apparatus, Golgi to vacuole transport, Golgi transport complex, intracellular anatomical structure, late endosome, membrane, plasma membrane, protein binding, protein targeting to vacuole, trans-Golgi network, ubiquitin protein ligase activity, ubiquitin-dependent protein catabolic process, vacuolar sorting signal binding, vacuolar transport"
"Chir05Ox-b25690.2",2.0466844207308e-23,0.258598513041862,0.713,0.694,4.02378157115675e-19,NA,NA,NA,NA,NA
"Chir02Ox-b14350.2",8.44049597747608e-40,0.294739931206735,0.741,0.695,1.6594015091718e-35,"AT1G68060",NA,NA,"ATMAP70-1","cortical microtubule, transverse to long axis, cytoplasm, cytoskeleton organization, microtubule binding, plant-type cell wall biogenesis, xylem and phloem pattern formation"
"Chir06Ox-b30920.2",9.89332681777479e-142,0.653511132119314,0.82,0.695,1.94502805237452e-137,NA,NA,NA,NA,NA
"Chir01Ox-b42820.2",6.16765773323817e-11,0.290923674175101,0.697,0.698,1.21256151035463e-06,"AT1G53910","Yes","ERF","RAP2.12","detection of hypoxia, DNA binding, DNA-binding transcription factor activity, ethylene-activated signaling pathway, nucleus, plasma membrane, protein binding, regulation of DNA-templated transcription, regulation of root development, response to hypoxia, transcription cis-regulatory region binding"
"Chir06Ox-b35940.2",6.78135059729008e-37,0.29360264912941,0.742,0.698,1.33321352742723e-32,"AT5G03040",NA,NA,"AT5G03040.1","carboxylic acid metabolic process, cell division, cell wall biogenesis, developmental growth, developmental growth involved in morphogenesis, microtubule, nucleus, plant epidermis development, plant-type cell wall organization or biogenesis, plasma membrane, response to light stimulus, shoot system development"
"Chir08Ox-b09410.2",4.7328915850426e-10,0.409448389492886,0.673,0.698,9.30486485619375e-06,"AT4G08950",NA,NA,"EXO","extracellular region, Golgi apparatus, molecular_function, plant-type cell wall, response to brassinosteroid"
"Chir03Ox-b34370.2",1.05683293187816e-32,0.262370446821306,0.73,0.699,2.07773354407246e-28,"AT2G19790",NA,NA,"AT2G19790.1","AP-4 adaptor complex, Golgi apparatus, intracellular membrane-bounded organelle, protein binding, trans-Golgi network, vesicle-mediated transport"
"Chir08Ox-b17060.2",1.48792033711275e-29,0.270883774900673,0.738,0.699,2.92525138276367e-25,"AT5G55070",NA,NA,"E2-OGDH2","cytosolic ribosome, dihydrolipoyllysine-residue succinyltransferase activity, L-lysine catabolic process to acetyl-CoA via saccharopine, mitochondrion, oxoglutarate dehydrogenase complex, plastid, salicylic acid binding, tricarboxylic acid cycle, zinc ion binding"
"Chir08Ox-b20260.2",5.23290350912024e-159,0.535973954222429,0.855,0.699,1.02878882989304e-154,"AT5G58060",NA,NA,"YKT61","cytoplasm, endoplasmic reticulum to Golgi vesicle-mediated transport, Golgi apparatus, plastid, protein binding, SNAP receptor activity, SNARE binding, SNARE complex, vesicle, vesicle fusion, vesicle-mediated transport"
"Chir01Ox-b21200.2",0.021532471155195,0.57867038769341,0.614,0.7,1,"AT1G21440",NA,NA,"F24J8.7","carboxylic acid biosynthetic process, catalytic activity, chloroplast, chloroplast stroma, glucosinolate metabolic process, regulation of small molecule metabolic process, response to inorganic substance"
"Chir08Ox-b26580.2",8.50388776974251e-36,0.253071589089481,0.756,0.7,1.67186433553138e-31,"AT5G64030",NA,NA,"AT5G64030.1","cytoplasm, endosome, extracellular region, Golgi apparatus, Golgi medial cisterna, plastid, trans-Golgi network"
"Chir01Ox-b24920.2",1.33768720434297e-32,0.273194689900752,0.739,0.702,2.62989304373828e-28,"AT1G26270",NA,NA,"F28B23.7","1-phosphatidylinositol 4-kinase activity, cellular response to hypoxia, cellular_component, defense response to bacterium, defense response to fungus, hormone-mediated signaling pathway, protein histidine kinase binding, regulation of defense response, regulation of reproductive process, response to hypoxia, response to lipid, response to temperature stimulus, response to wounding"
"Chir03Ox-b18840.2",1.55623243400242e-37,0.279554560889923,0.733,0.702,3.05955296524875e-33,"AT3G18990","Yes","B3","VRN1","DNA binding, nucleoplasm, regulation of flower development, transcription cis-regulatory region binding, vernalization response"
"Chir03Ox-b01640.2",2.27277409718113e-145,0.601046547825953,0.803,0.703,4.46827387505811e-141,"AT3G02520",NA,NA,"GRF7","chloroplast stroma, cytoplasm, cytosol, Golgi apparatus, nuclear envelope, plasma membrane, plasmodesma, protein binding, protein phosphorylated amino acid binding, signal transduction"
"Chir04Ox-b27150.2",1.85086567798075e-31,0.276228310617426,0.755,0.707,3.63880192291015e-27,"AT2G44350",NA,NA,"ATCS","ATP binding, carbohydrate metabolic process, chloroplast, citrate (Si)-synthase activity, citrate metabolic process, cytosol, mitochondrial matrix, mitochondrion, plant-type cell wall, tricarboxylic acid cycle, zinc ion binding"
"Chir05Ox-b04480.2",3.24024662516271e-31,0.305529573514937,0.76,0.707,6.3703248650699e-27,"AT3G27090",NA,NA,"NRP2","molecular_function, regulation of cell death, response to endoplasmic reticulum stress"
"Chir01Ox-b03870.2",1.00885386177507e-79,0.39598925246391,0.776,0.708,1.98340669224979e-75,"AT1G04750",NA,NA,"VAMP7B","cell plate, cell plate formation involved in plant-type cell wall biogenesis, endosome, plasma membrane, plasmodesma, protein binding, response to endoplasmic reticulum stress, vesicle-mediated transport"
"Chir07Ox-b26260.2",8.98115708813929e-40,0.263047978299513,0.752,0.708,1.76569548352818e-35,"AT4G29040",NA,NA,"AT4G29040.1","ATP hydrolysis activity, female gamete generation, innate immune response, lateral root formation, leaf morphogenesis, maintenance of root meristem identity, male gamete generation, meristem growth, meristem structural organization, N-terminal protein myristoylation, nucleus, phyllome development, plasma membrane, proteasome complex, proteasome regulatory particle, base subcomplex, proteasome-activating activity, proteasome-mediated ubiquitin-dependent protein catabolic process, response to heat, response to misfolded protein, root cap development, root development, root morphogenesis, seedling development, shoot system development, ubiquitin-dependent protein catabolic process"
"Chir07Ox-b26380.2",2.00562401638874e-225,0.866145739127848,0.894,0.708,3.94305681622027e-221,"AT4G29160",NA,NA,"SNF7.1","cytoplasm, cytoplasmic side of plasma membrane, endosome membrane, ESCRT III complex, intralumenal vesicle formation, late endosome to vacuole transport via multivesicular body sorting pathway, multivesicular body, plasma membrane, protein binding, vesicle budding from membrane, vesicle-mediated transport"
"Chir08Ox-b22130.2",6.37349226981581e-33,0.39797519276401,0.751,0.708,1.25302858024579e-28,"AT5G59730",NA,NA,"ATEXO70H7","cytosol, exocyst, exocytosis, nucleus, phosphatidylinositol-4,5-bisphosphate binding, protein binding"
"Chir06Ox-b19990.2",1.63723186578304e-105,0.90493856722461,0.844,0.709,3.21879784812946e-101,"AT5G19120",NA,NA,"T24G5.20","aspartic-type endopeptidase activity, cellular response to hypoxia, extracellular region, proteolysis"
"Chir06Ox-b23910.2",6.69345606752596e-81,0.604200158726245,0.811,0.71,1.3159334628756e-76,"AT5G15490",NA,NA,"UGD3","carbohydrate metabolic process, cell wall pectin metabolic process, cytoplasm, cytosol, glycosaminoglycan biosynthetic process, NAD binding, nucleus, plant-type cell wall, UDP-glucose 6-dehydrogenase activity, UDP-glucuronate biosynthetic process"
"Chir04Ox-b09370.2",4.99438479787281e-61,0.406116952553888,0.763,0.711,9.81896051261794e-57,NA,NA,NA,NA,NA
"Chir05Ox-b18010.2",1.05012913651303e-78,0.385569594348718,0.795,0.712,2.06455388238462e-74,"AT3G52560",NA,NA,"UEV1D-4","cellular response to DNA damage stimulus, cytosol, nucleus, positive regulation of protein polyubiquitination, postreplication repair, protein binding, UBC13-MMS2 complex"
"Chir03Ox-b15390.2",4.56515585386731e-134,1.05816352501772,0.867,0.713,8.97509640870313e-130,"AT3G15630",NA,NA,"MSJ11.3","molecular_function, nucleus, response to light intensity"
"Chir03Ox-b20260.2",1.73882692458901e-100,0.643758053880721,0.846,0.713,3.41853373374199e-96,"AT3G20310","Yes","ERF","ATERF-7","DNA binding, DNA-binding transcription factor activity, ethylene-activated signaling pathway, intracellular anatomical structure, negative regulation of DNA-templated transcription, nucleus, protein binding, regulation of DNA-templated transcription, response to abscisic acid, response to water deprivation, sequence-specific DNA binding, transcription cis-regulatory region binding"
"Chir04Ox-b15180.2",1.06593829774821e-140,0.727010039780838,0.863,0.713,2.09563469337298e-136,"AT2G33120",NA,NA,"SAR1","cell plate, cell plate formation involved in plant-type cell wall biogenesis, endoplasmic reticulum, endosome, plant-type vacuole, plasma membrane, plasmodesma, response to endoplasmic reticulum stress, vesicle-mediated transport"
"Chir06Ox-b20520.2",6.19508458703449e-40,0.382766996270076,0.764,0.713,1.21795362981098e-35,"AT5G18650",NA,NA,"MIEL1","cytoplasm, negative regulation of defense response to bacterium, nucleus, positive regulation of transcription factor catabolic process, protein binding, transcription factor binding, ubiquitin protein ligase activity, ubiquitin-dependent protein catabolic process, ubiquitin-protein transferase activity, zinc ion binding"
"Chir06Ox-b26300.2",7.00716006763992e-105,0.697153923165827,0.823,0.713,1.37760766929801e-100,"AT5G13190",NA,NA,"GILP","cellular response to hypoxia, negative regulation of plant-type hypersensitive response, plasma membrane, protein binding, zinc ion binding"
"Chir07Ox-b36420.2",1.78204576980034e-107,0.891587977096141,0.822,0.713,3.50350198342746e-103,"AT4G39260",NA,NA,"CCR1","alternative mRNA splicing, via spliceosome, cytosol, extracellular space, extracellular transport, Golgi apparatus, innate immune response, miRNA binding, miRNA transport, mitochondrion, mRNA 3'-UTR binding, mRNA binding, nucleolus, nucleus, peroxisome, plant-type cell wall, plasma membrane, plasmodesma, regulation of defense response to virus, response to cold, response to zinc ion, RNA binding, RNA transport, single-stranded RNA binding, siRNA binding"
"Chir08Ox-b26800.2",8.86656974372465e-58,0.423646986672598,0.816,0.713,1.74316761161627e-53,"AT5G64260",NA,NA,"EXL2","carboxylic acid metabolic process, cellular catabolic process, cellular response to hypoxia, cellular response to oxygen-containing compound, chloroplast, defense response to bacterium, defense response to fungus, Golgi apparatus, hormone-mediated signaling pathway, immune system process, molecular_function, organic substance catabolic process, plant-type cell wall, plasmodesma, plastid, positive regulation of cellular process, regulation of defense response, response to abscisic acid, response to chitin, response to hypoxia, response to inorganic substance, response to jasmonic acid, response to oxidative stress, response to salicylic acid, response to salt stress, response to temperature stimulus, response to wounding"
"Chir01Ox-b17380.2",2.66326787414513e-254,1.30469920320345,0.894,0.714,5.23598464056932e-250,"AT1G17290",NA,NA,"AlaAT1","ATP binding, biosynthetic process, cellular response to hypoxia, L-alanine catabolic process, by transamination, L-alanine:2-oxoglutarate aminotransferase activity, mitochondrion, nucleus, pyridoxal phosphate binding, response to cadmium ion, response to hypoxia"
"Chir01Ox-b43750.2",2.37123887265515e-62,0.665283970869694,0.795,0.714,4.66185562364002e-58,NA,NA,NA,NA,NA
"Chir06Ox-b02140.2",5.86084919177765e-36,0.280663246861807,0.748,0.714,1.15224295110349e-31,"AT5G46070",NA,NA,"GBPL3","cell division, chromatin binding, cytosol, GTP binding, GTPase activity, nucleolus, nucleus, plastid, regulation of developmental process, regulation of reproductive process, response to salicylic acid, seed development, shoot system development"
"Chir07Ox-b16220.2",5.82704401958203e-43,0.280372188489458,0.742,0.714,1.14559685424983e-38,"AT4G19350",NA,NA,"EMB3006","cell division, chromosome segregation, embryo development ending in seed dormancy, gibberellic acid homeostasis, kinetochore, kinetochore binding, nucleolus organization, nucleus, outer kinetochore, polyamine metabolic process, protein binding"
"Chir01Ox-b40830.2",0.00014889927937681,0.377353027761952,0.647,0.715,1,"AT1G51950",NA,NA,"AT1G51950.1","DNA-binding transcription factor activity, nucleus, protein binding, regulation of DNA-templated transcription, response to auxin"
"Chir03Ox-b16970.2",7.02025494511828e-17,0.272626541570327,0.751,0.716,1.38018212221025e-12,"AT3G17160",NA,NA,"K14A17.24","biological_process, molecular_function, nucleus"
"Chir01Ox-b07330.2",1.54771560024299e-17,0.273261352752648,0.773,0.718,3.04280887007772e-13,NA,NA,NA,NA,NA
