"gene_ID","p_val","avg_log2FC","pct.1","pct.2","p_val_adj","AT_ID","TF","TF_family","Gene_code_name","Gene_functions"
"Chir01Ox-b06510.2",0,1.16903846378015,0.652,0.148,0,NA,NA,NA,NA,NA
"Chir06Ox-b34390.2",0,1.78069545035257,0.855,0.148,0,"AT5G04530",NA,NA,"KCS19","chloroplast, fatty acid biosynthetic process, response to cold, response to light stimulus, very-long-chain 3-ketoacyl-CoA synthase activity"
"Chir04Ox-b24280.2",0,1.07487943582653,0.618,0.151,0,"AT2G41475",NA,NA,"AT2G41475.1","defense response, extracellular region, fatty acid metabolic process, glucosinolate metabolic process, plasmodesma, protein binding, response to jasmonic acid, response to wounding, small molecule biosynthetic process"
"Chir06Ox-b14320.2",0,0.582940022830931,0.511,0.153,0,"AT5G25460",NA,NA,"DGR2","extracellular region, molecular_function, plant-type cell wall, plasmodesma, plastid, root morphogenesis"
"Chir03Ox-b13780.2",0,1.0589722183995,0.764,0.154,0,"AT3G14220",NA,NA,"AT3G14220.1","cell wall organization or biogenesis, extracellular region, hydrolase activity, acting on ester bonds, plant-type vacuole, response to light stimulus"
"Chir05Ox-b17300.2",0,0.696602635152503,0.536,0.158,0,"AT3G51920",NA,NA,"CAM9","calcium ion binding, calcium-mediated signaling, cytosol, detection of calcium ion, nucleus, protein binding, response to abscisic acid, response to salt stress, response to water deprivation"
"Chir01Ox-b24700.2",0,0.407833557128389,0.464,0.159,0,"AT1G26570",NA,NA,"UGD1","cytoplasm, cytosol, glycosaminoglycan biosynthetic process, NAD binding, nucleus, UDP-glucose 6-dehydrogenase activity, UDP-glucuronate biosynthetic process"
"Chir03Ox-b35230.2",0,0.963775700929864,0.614,0.161,0,NA,NA,NA,NA,NA
"Chir08Ox-b00530.2",0,0.879760455200606,0.725,0.162,0,"AT4G00400",NA,NA,"GPAT8","CDP-diacylglycerol biosynthetic process, cutin biosynthetic process, endoplasmic reticulum, glycerol-3-phosphate 2-O-acyltransferase activity, glycerol-3-phosphate O-acyltransferase activity, membrane, phosphatase activity, sn-1-glycerol-3-phosphate C16:0-DCA-CoA acyl transferase activity"
"Chir08Ox-b22020.2",0,1.48905906658941,0.81,0.164,0,"AT5G59670",NA,NA,"MTH12.12","cellular response to oxygen-containing compound, chloroplast, defense response to other organism, kinase activity, phosphorylation, protein serine/threonine kinase activity, regulation of defense response, response to bacterium, response to fungus, response to salicylic acid, transmembrane receptor protein tyrosine kinase activity"
"Chir01Ox-b08040.2",0,0.716328682440057,0.596,0.166,0,"AT1G08470",NA,NA,"SSL3","biosynthetic process, chloroplast, endoplasmic reticulum, plant-type vacuole"
"Chir01Ox-b11160.2",0,0.585090877116354,0.566,0.166,0,"AT1G11330",NA,NA,"RDA2","calmodulin binding, extracellular region, immune response, plasma membrane, protein kinase activity, protein phosphorylation, protein serine/threonine kinase activity, recognition of pollen"
"Chir07Ox-b29110.2",0,0.414007536311524,0.48,0.166,0,"AT4G31820",NA,NA,"NPY1","apical protein localization, auxin transport, basipetal auxin transport, cotyledon development, flower development, inflorescence development, late endosome, nucleus, phyllome development, plant organ development, plasma membrane, positive regulation of flower development"
"Chir01Ox-b26660.2",0,2.40280655617828,0.947,0.167,0,"AT1G27950",NA,NA,"LTPG1","cuticle development, defense response to fungus, endoplasmic reticulum, lipid binding, lipid transport, membrane, nucleus, plant-type cell wall, plasma membrane, secretory vesicle"
"Chir03Ox-b00230.2",0,1.10309554210292,0.786,0.167,0,"AT3G01860",NA,NA,"F28J7.19","molecular_function, nucleus"
"Chir01Ox-b14480.2",0,0.907225405237917,0.696,0.169,0,"AT1G14440","Yes","ZF-HD","AtHB31","DNA-binding transcription factor activity, long-day photoperiodism, flowering, nucleus, protein binding, protein homodimerization activity, regulation of DNA-templated transcription, transcription cis-regulatory region binding"
"Chir02Ox-b19670.2",0,1.39742830095235,0.818,0.169,0,"AT1G72970",NA,NA,"EDA17","cell-cell signaling, embryo sac development, extracellular region, fatty acid omega-oxidation, flavin adenine dinucleotide binding, mandelonitrile lyase activity, oxidoreductase activity, acting on CH-OH group of donors"
"Chir02Ox-b18930.2",0,2.58842224651635,0.703,0.17,0,NA,NA,NA,NA,NA
"Chir02Ox-b26330.2",0,0.768081063659951,0.503,0.172,0,"AT1G79160",NA,NA,"YUP8H12R.23","cellular_component, defense response, molecular_function, response to light stimulus"
"Chir05Ox-b17820.2",0,0.516658624800245,0.554,0.172,0,"AT3G52370",NA,NA,"AT3G52370.1","cell wall biogenesis, extracellular region, flavonoid biosynthetic process, flavonoid metabolic process, oxoacid metabolic process, response to inorganic substance"
"Chir08Ox-b27680.2",0,0.801546509868268,0.647,0.174,0,"AT5G65020",NA,NA,"ANNAT2","calcium ion binding, cell surface, chloroplast, cytoplasm, cytosol, phloem sucrose unloading, plastid, polysaccharide transport, primary root development, response to cold, response to heat, response to salt stress, response to water deprivation, thylakoid"
"Chir03Ox-b25430.2",0,0.956376404344193,0.633,0.175,0,NA,NA,NA,NA,NA
"Chir05Ox-b22640.2",0,1.34315986435167,0.791,0.175,0,NA,NA,NA,NA,NA
"Chir01Ox-b25660.2",0,1.07296333346151,0.536,0.18,0,NA,NA,NA,NA,NA
"Chir07Ox-b11960.2",0,1.28842280857005,0.792,0.187,0,"AT3G43800",NA,NA,"ATGSTU27","cytoplasm, glutathione metabolic process, glutathione transferase activity, toxin catabolic process"
"Chir07Ox-b26230.2",0,2.93964458583965,0.733,0.187,0,"AT4G29030",NA,NA,"F19B15.60","molecular_function, response to cold, tissue development"
"Chir04Ox-b01480.2",0,1.17416888563696,0.602,0.189,0,"AT2G22170",NA,NA,"AT2G22170.1","carboxylic acid metabolic process, cell division, defense response to other organism, developmental growth, extracellular region, plant epidermis development, plant-type cell wall biogenesis, response to lipid, response to organic cyclic compound, response to oxidative stress, response to wounding, root morphogenesis, secretory vesicle, thylakoid, vacuole"
"Chir04Ox-b14650.2",0,0.847423956678629,0.718,0.189,0,"AT2G32720",NA,NA,"AT2G32720.2","alkane biosynthetic process, chloroplast, endoplasmic reticulum, heme binding, intracellular membrane-bounded organelle, membrane, protein binding, very long-chain fatty acid biosynthetic process"
"Chir08Ox-b13370.2",0,1.34627833837088,0.832,0.191,0,"AT5G51750",NA,NA,"ATSBT1.3","apoplast, cell cycle, cell division, embryo development, extracellular region, seed development, serine-type endopeptidase activity, small molecule metabolic process"
"Chir02Ox-b21730.2",0,0.724689860456819,0.55,0.192,0,"AT1G74790",NA,NA,"AT1G74790.1","cellular catabolic process, defense response to fungus, membrane, mitochondrion, plasma membrane, regulation of defense response, response to alcohol, response to bacterium, response to inorganic substance, response to oxidative stress, response to wounding, signal transduction, small molecule metabolic process"
"Chir07Ox-b26220.2",0,3.35667115619591,0.907,0.192,0,"AT4G29020",NA,NA,"F19B15.50","molecular_function, response to lipid"
"Chir01Ox-b22080.2",0,0.732548908770769,0.64,0.196,0,"AT1G22360",NA,NA,"AtUGT85A2","carboxylic acid metabolic process, glucuronosyltransferase activity, glycosyltransferase activity, nucleus, quercetin 3-O-glucosyltransferase activity, quercetin 7-O-glucosyltransferase activity, response to wounding, UDP-glycosyltransferase activity"
"Chir04Ox-b18080.2",0,0.655448184682342,0.644,0.196,0,"AT2G35860",NA,NA,"AT2G35860.1","carboxylic acid metabolic process, extracellular region, plant-type cell wall biogenesis, positive regulation of cellular biosynthetic process, positive regulation of gene expression, positive regulation of nucleobase-containing compound metabolic process"
"Chir01Ox-b00620.2",0,0.876874637464171,0.712,0.197,0,"AT1G01630",NA,NA,"T1N6.1","fatty acid metabolic process, molecular_function, nucleus, plant epidermis development, plant organ morphogenesis"
"Chir02Ox-b25270.2",0,0.686725853930929,0.647,0.199,0,"AT1G78260",NA,NA,"F3F9.20","cell differentiation, developmental growth, mitochondrion, mRNA 3'-UTR binding, mRNA binding, nucleus, plant epidermis development, response to red light, RNA binding, root morphogenesis"
"Chir04Ox-b30590.2",0,1.91843284391259,0.904,0.199,0,NA,NA,NA,NA,NA
"Chir01Ox-b36180.2",0,4.26925565313508,0.922,0.2,0,"AT5G36910",NA,NA,"AT5G36910.1","defense response, extracellular region, toxin activity"
"Chir03Ox-b23990.2",0,0.568895850307625,0.56,0.2,0,"AT3G23805",NA,NA,"RALFL24","apoplast, calcium-mediated signaling, cell-cell signaling, extracellular region, hormone activity"
"Chir05Ox-b12120.2",0,0.969057637885453,0.677,0.201,0,"AT3G47295",NA,NA,NA,"chlorophyll metabolic process, mitochondrion, molecular_function, response to red or far red light"
"Chir01Ox-b21490.2",0,0.435961869265147,0.502,0.202,0,"AT1G21730",NA,NA,"Kin7.1","ATP hydrolysis activity, kinesin complex, microtubule, microtubule binding, microtubule motor activity, microtubule-based movement, mitochondrion"
"Chir07Ox-b04470.2",0,0.878098195225038,0.748,0.203,0,"AT5G38530",NA,NA,"TSBtype2","chloroplast, cytosol, L-serine hydro-lyase (adding indole, L-tryptophan-forming) activity, protein homodimerization activity, pyridoxal phosphate binding, tryptophan biosynthetic process, tryptophan synthase activity"
"Chir05Ox-b13730.2",0,1.6113076171832,0.848,0.208,0,NA,NA,NA,NA,NA
"Chir01Ox-b41920.2",0,1.70999930605527,0.731,0.21,0,"AT1G53060",NA,NA,"AT1G53060.1","nucleus, response to inorganic substance, root development, tetrapyrrole metabolic process"
"Chir01Ox-b14950.2",0,1.11831480622792,0.799,0.212,0,NA,NA,NA,NA,NA
"Chir01Ox-b12240.2",0,0.419638176997729,0.516,0.215,0,"AT1G12330",NA,NA,"F5O11.6","chloroplast, molecular_function, negative regulation of metabolic process, response to light stimulus"
"Chir06Ox-b16810.2",0,0.701459575552343,0.658,0.216,0,"AT5G22940",NA,NA,"AT5G22940.1","glucuronoxylan biosynthetic process, Golgi apparatus, nucleus, protein glycosylation"
"Chir01Ox-b13420.2",0,1.37357139328801,0.766,0.218,0,"AT1G13470",NA,NA,"T6J4.20","extracellular region, molecular_function, signal transduction"
"Chir05Ox-b28860.2",0,0.528167026773316,0.545,0.219,0,"AT3G63200",NA,NA,"PLP9","anatomical structure formation involved in morphogenesis, cellular polysaccharide metabolic process, meiotic cell cycle, plant-type cell wall organization or biogenesis"
"Chir03Ox-b18740.2",0,0.474140081599298,0.537,0.221,0,"AT3G18850",NA,NA,"LPAT5","'de novo' IMP biosynthetic process, 1-acylglycerol-3-phosphate O-acyltransferase activity, acyltransferase activity, CDP-diacylglycerol biosynthetic process, endomembrane system, mitochondrion, nucleus, oxidative phosphorylation, seed development"
"Chir05Ox-b04290.2",0,0.555146478767425,0.572,0.222,0,"AT3G26932",NA,NA,"DRB3","chloroplast, DNA metabolic process, double-stranded RNA binding, nucleus, protein binding, response to light intensity, tropism"
"Chir04Ox-b25580.2",0,3.24461890214348,0.953,0.223,0,"AT2G42840",NA,NA,"AT2G42840.1","extracellular region, leaf development, nucleus"
"Chir06Ox-b33690.2",0,0.577374542163398,0.567,0.225,0,"AT5G05270",NA,NA,"AtCHIL","chalcone isomerase activity, chloroplast, flavonoid biosynthetic process"
"Chir03Ox-b23070.2",0,0.79522419280911,0.608,0.226,0,"AT3G23030",NA,NA,"AT3G23030.1","DNA-binding transcription factor activity, identical protein binding, nucleus, protein binding, regulation of DNA-templated transcription, response to auxin, transcription cis-regulatory region binding"
"Chir08Ox-b10690.2",0,0.494051802986626,0.576,0.237,0,"AT5G49760",NA,NA,"CARD1","detection of chemical stimulus, hydrogen peroxide mediated signaling pathway involved in stomatal movement, kinase activity, plant-type vacuole, plasma membrane, plastid, protein autophosphorylation, protein phosphorylation, regulation of stomatal closure, transmembrane receptor protein serine/threonine kinase activity"
"Chir01Ox-b23680.2",0,4.19301749549455,0.934,0.238,0,"AT1G24020",NA,NA,"MLP423","abscisic acid binding, abscisic acid-activated signaling pathway, chloroplast, cytosol, defense response, nucleus, protein phosphatase inhibitor activity, signaling receptor activity"
"Chir04Ox-b04650.2",0,0.780091463495853,0.698,0.238,0,"AT2G25737",NA,NA,NA,"chloroplast, Cul4A-RING E3 ubiquitin ligase complex, molecular_function, oxoacid metabolic process, response to inorganic substance"
"Chir07Ox-b19250.2",0,0.591187300576582,0.609,0.238,0,"AT4G22560",NA,NA,"F7K2.140","cell differentiation, cell wall organization or biogenesis, developmental growth, molecular_function, nucleus, response to auxin, response to light intensity"
"Chir07Ox-b05320.2",0,0.599428806130773,0.636,0.25,0,"AT5G37740",NA,NA,"K12B20.22","GTPase activator activity, lipid binding, nucleus, phospholipid binding, plasma membrane, positive regulation of abscisic acid-activated signaling pathway, positive regulation of GTPase activity, protein binding, protein homodimerization activity, protein self-association"
"Chir02Ox-b06850.2",0,1.0946657267416,0.674,0.253,0,"AT1G59590",NA,NA,"AT1G59590.1","cellular response to organic cyclic compound, defense response to bacterium, defense response to fungus, hormone-mediated signaling pathway, mitochondrion, regulation of defense response, regulation of immune system process, response to abscisic acid, response to chitin, response to molecule of bacterial origin, response to osmotic stress, response to oxidative stress, response to salicylic acid, response to water deprivation, response to wounding"
"Chir07Ox-b33930.2",0,2.19721939721807,0.868,0.256,0,"AT4G36500",NA,NA,"AP22.75","cellular response to salicylic acid stimulus, defense response to bacterium, defense response to fungus, jasmonic acid mediated signaling pathway, mitochondrion, molecular_function, negative regulation of cellular process, regulation of defense response, regulation of immune system process, response to abscisic acid, response to chitin, response to osmotic stress, response to oxidative stress, response to temperature stimulus, response to water deprivation, response to wounding"
"Chir02Ox-b25560.2",0,0.696205280782742,0.658,0.257,0,"AT1G78490",NA,NA,"CYP708A3","brassinosteroid biosynthetic process, brassinosteroid homeostasis, chloroplast, heme binding, iron ion binding, monooxygenase activity, multicellular organism development, oxidoreductase activity, oxidoreductase activity, acting on paired donors, with incorporation or reduction of molecular oxygen, sterol metabolic process"
"Chir02Ox-b18170.2",0,1.71338865013912,0.885,0.258,0,"AT1G71695",NA,NA,"F14O23.6","extracellular region, heme binding, mitochondrion, peroxidase activity, plant-type cell wall, plant-type vacuole, plasmodesma, response to oxidative stress, response to stress"
"Chir01Ox-b33620.2",0,0.681867873057141,0.567,0.26,0,"AT1G35720",NA,NA,"ANNAT1","apoplast, ATP binding, calcium ion binding, calcium ion transmembrane transport, chloroplast, chloroplast stroma, copper ion binding, cytoplasm, cytosol, membrane, mitochondrion, nucleus, peroxidase activity, phloem sucrose unloading, plant-type cell wall, plant-type vacuole, plasma membrane, plasmodesma, potassium ion export across plasma membrane, primary root development, protein homodimerization activity, response to abscisic acid, response to cold, response to heat, response to osmotic stress, response to oxidative stress, response to salt stress, response to water deprivation, root hair tip, thylakoid, zinc ion binding"
"Chir01Ox-b10080.2",0,1.95438028459497,0.867,0.261,0,"AT1G10370",NA,NA,"GST30","chloroplast, cytoplasm, de-etiolation, glutathione metabolic process, glutathione transferase activity, lateral root development, negative regulation of response to water deprivation, response to growth hormone, response to salt stress, toxin catabolic process"
"Chir02Ox-b08430.2",0,3.37527227509031,0.946,0.261,0,"AT1G56580",NA,NA,"AT1G56580.1","cytoplasm, response to abscisic acid, trichome morphogenesis"
"Chir08Ox-b29460.2",0,0.951064329642324,0.801,0.266,0,"AT5G66920",NA,NA,"sks17","copper ion binding, extracellular region, oxidoreductase activity, plant-type cell wall"
"Chir01Ox-b43080.2",0,2.53196609708234,0.761,0.27,0,"AT1G54010",NA,NA,"AT1G54010.1","cell wall biogenesis, defense response to other organism, extracellular region, hydrolase activity, acting on ester bonds, nucleus, plant-type vacuole, plasmodesma, response to jasmonic acid, response to organic cyclic compound, response to oxidative stress, response to wounding, tryptophan metabolic process, vacuole"
"Chir01Ox-b25320.2",0,1.16013012165863,0.683,0.271,0,"AT3G20370",NA,NA,"AT3G20370.1","amino acid metabolic process, cellular component biogenesis, defense response to other organism, extracellular region, plant epidermis development, plasma membrane, plasmodesma, response to jasmonic acid, response to organic cyclic compound, response to oxidative stress, response to wounding"
"Chir04Ox-b13730.2",0,1.52710931217342,0.804,0.271,0,"AT2G31880",NA,NA,"SOBIR1","kinase activity, negative regulation of floral organ abscission, peroxisome, plasma membrane, positive regulation of cell death, positive regulation of defense response, protein binding, protein serine/threonine kinase activity, protein tyrosine kinase activity, transmembrane receptor protein tyrosine kinase activity"
"Chir05Ox-b21070.2",0,0.68519541465232,0.724,0.272,0,NA,NA,NA,NA,NA
"Chir07Ox-b30520.2",0,0.826420611923089,0.736,0.272,0,"AT4G33180",NA,NA,"F4I10.110","biological_process, chloroplast, mitochondrion, molecular_function"
"Chir05Ox-b26960.2",0,0.668132698394743,0.619,0.285,0,"AT3G61250","Yes","MYB","AtMYB17","DNA-binding transcription factor activity, nucleus, protein binding, regulation of flower development"
"Chir03Ox-b05520.2",0,1.08820543965305,0.802,0.286,0,"AT3G06035",NA,NA,NA,"carbohydrate derivative metabolic process, carboxylic acid metabolic process, cytosol, flavonoid biosynthetic process, membrane, molecular_function, regulation of secondary cell wall biogenesis, response to inorganic substance, response to wounding"
"Chir04Ox-b11410.2",0,0.471903405023987,0.593,0.287,0,"AT2G29730",NA,NA,"UGT71D1","cell differentiation, daphnetin 3-O-glucosyltransferase activity, developmental growth, flavonol 3-O-glucosyltransferase activity, glycosyltransferase activity, myricetin 3-O-glucosyltransferase activity, quercetin 3-O-glucosyltransferase activity, root morphogenesis, tissue development"
"Chir08Ox-b14560.2",0,0.776755304229639,0.665,0.289,0,"AT5G52870",NA,NA,"MAKR5","cytosol, membrane, molecular_function, nucleus, plasma membrane, regulation of cell differentiation, regulation of root development"
"Chir02Ox-b03800.2",0,0.495209950699486,0.623,0.291,0,"AT1G61900",NA,NA,"F8K4.10","developmental growth involved in morphogenesis, membrane, mitochondrion, molecular_function, negative regulation of gene expression, nucleus, plasma membrane, plasmodesma, regulation of multicellular organismal development"
"Chir05Ox-b14200.2",0,0.793218076620251,0.689,0.294,0,"AT3G49220",NA,NA,"PME34","cell wall modification, chloroplast, enzyme inhibitor activity, pectin catabolic process, pectinesterase activity, pectinesterase inhibitor activity, plant-type cell wall, plasma membrane, regulation of stomatal movement"
"Chir04Ox-b29110.2",0,0.696737128052868,0.709,0.3,0,"AT2G46225",NA,NA,"AT2G46225.1","actin nucleation, cytoplasm, protein binding, SCAR complex, trichome morphogenesis"
"Chir06Ox-b17060.2",0,0.878815881023357,0.762,0.306,0,"AT5G22740",NA,NA,"ATCSLA02","glucomannan 4-beta-mannosyltransferase activity, glycosyltransferase activity, Golgi apparatus, Golgi medial cisterna, mannan synthase activity, mucilage biosynthetic process, mucilage metabolic process involved in seed coat development"
"Chir01Ox-b43850.2",0,0.769603817458723,0.665,0.307,0,"AT1G55450",NA,NA,"T5A14.14","cellular response to oxygen-containing compound, defense response to bacterium, defense response to fungus, hormone-mediated signaling pathway, macromolecule localization, negative regulation of cellular process, nucleus, regulation of defense response, regulation of immune system process, response to chitin, response to molecule of bacterial origin, response to salicylic acid, response to water deprivation, response to wounding"
"Chir04Ox-b12910.2",0,0.801587964883083,0.717,0.328,0,"AT2G31090",NA,NA,"TAX1","extracellular space, fruit morphogenesis, molecular_function, organ boundary specification between lateral organs and the meristem, plasma membrane, response to light stimulus"
"Chir01Ox-b17210.2",0,0.728168925070701,0.749,0.33,0,"AT1G17140",NA,NA,"RIP1","nucleus, plasma membrane, pollen tube tip, regulation of auxin polar transport"
"Chir04Ox-b13260.2",0,0.715114288167152,0.683,0.338,0,"AT2G31390",NA,NA,"FRK2","chloroplast, cytosol, fructokinase activity, fructose metabolic process, peroxisome, plasma membrane, starch biosynthetic process"
"Chir08Ox-b03810.2",0,0.659711512072797,0.706,0.344,0,"AT4G03560",NA,NA,"ATTPC1","calcium channel activity, calcium ion binding, calcium ion transport, calcium-mediated signaling, cytosol, Golgi apparatus, identical protein binding, plant-type vacuole, plasma membrane, regulation of jasmonic acid biosynthetic process, regulation of stomatal movement, seed germination, vacuolar membrane, vacuole, voltage-gated calcium channel activity"
"Chir03Ox-b18320.2",0,0.821155998905881,0.753,0.348,0,"AT3G18490",NA,NA,"AT3G18490.1","aspartic-type peptidase activity, endoplasmic reticulum, extracellular region, response to abscisic acid, response to water deprivation, systemic acquired resistance"
"Chir04Ox-b07840.2",0,0.776518431042818,0.757,0.349,0,"AT2G26910",NA,NA,"PDR4","ABC-type transporter activity, ATPase-coupled transmembrane transporter activity, cutin transport, peroxisome, plasma membrane"
"Chir01Ox-b43100.2",0,1.2271496151649,0.85,0.352,0,"AT1G54030",NA,NA,"NUC","chloroplast, endoplasmic reticulum, endoplasmic reticulum organization, ER body, hydrolase activity, acting on ester bonds, intracellular anatomical structure, intracellular protein transport, plant-type vacuole, plant-type vacuole membrane, plasmodesma, protein exit from endoplasmic reticulum, vacuole"
"Chir02Ox-b20480.2",0,1.21320173560091,0.823,0.367,0,NA,NA,NA,NA,NA
"Chir07Ox-b18200.2",0,0.980164604647619,0.775,0.37,0,"AT4G21570",NA,NA,"F17L22.30","chloroplast, endoplasmic reticulum, transport, transporter activity"
"Chir06Ox-b18310.2",0,1.41961871433017,0.842,0.375,0,"AT5G20740",NA,NA,"T1M15.140","chloroplast, enzyme inhibitor activity, negative regulation of catalytic activity, regulation of shoot apical meristem development"
"Chir03Ox-b16580.2",0,0.858882656818978,0.8,0.381,0,"AT3G16770","Yes","ERF","RAP2.3","cell death, cytoplasm, DNA binding, DNA-binding transcription factor activity, ethylene-activated signaling pathway, heat acclimation, nucleus, plasma membrane, positive regulation of DNA-templated transcription, protein binding, regulation of DNA-templated transcription, response to cytokinin, response to ethylene, response to jasmonic acid, response to other organism, transcription cis-regulatory region binding"
"Chir04Ox-b01380.2",0,0.809066068891711,0.783,0.384,0,"AT2G22080",NA,NA,"T16B14.7","molecular_function, nucleus, response to oxidative stress"
"Chir02Ox-b23220.2",0,1.39425708676358,0.93,0.411,0,"AT1G76160",NA,NA,"sks5","anatomical structure formation involved in morphogenesis, apoplast, cell wall organization or biogenesis, cellular polysaccharide metabolic process, copper ion binding, defense response to other organism, extracellular region, oxidoreductase activity, plant-type cell wall, plant-type cell wall organization or biogenesis, plasmodesma, regulation of cellular component organization, response to inorganic substance, response to oxidative stress, response to wounding, secretory vesicle, signal transduction, small molecule metabolic process"
"Chir04Ox-b12610.2",0,1.03307025336393,0.8,0.42,0,"AT2G30870",NA,NA,"ATGSTF10","apoplast, chloroplast, copper ion binding, cytoplasm, cytosol, glutathione binding, glutathione transferase activity, peroxisome, plant-type cell wall, plant-type vacuole, plasma membrane, response to water deprivation, toxin catabolic process"
"Chir01Ox-b32170.2",0,0.652766243088957,0.745,0.422,0,"AT1G33590",NA,NA,"AT1G33590.1","nucleus, plant-type cell wall, plasma membrane, signal transduction"
"Chir03Ox-b01220.2",0,1.32973558613927,0.885,0.428,0,"AT3G02110",NA,NA,"scpl25","adaxial/abaxial axis specification, extracellular region, growth, serine-type carboxypeptidase activity, specification of axis polarity"
"Chir06Ox-b07690.2",0,0.489514764444822,0.75,0.432,0,"AT5G42570",NA,NA,"K16E1.4","chloroplast, endoplasmic reticulum, endoplasmic reticulum membrane, endoplasmic reticulum to Golgi vesicle-mediated transport, molecular_function, plant-type vacuole, plasmodesma, plastid"
"Chir03Ox-b24800.2",0,1.07867608401879,0.806,0.448,0,"AT3G24503",NA,NA,"ALDH2C4","aldehyde dehydrogenase (NAD+) activity, coniferyl-aldehyde dehydrogenase activity, cytoplasm, cytosol, glyceraldehyde-3-phosphate dehydrogenase (NAD+) (non-phosphorylating) activity, phenylpropanoid biosynthetic process"
"Chir04Ox-b21040.2",0,4.1956777245624,0.968,0.449,0,"AT2G38530",NA,NA,"LP2","chloroplast, cuticle development, endosome, extracellular region, Golgi apparatus, phospholipid transfer to membrane, plant epidermal cell differentiation, plant-type cell wall, plasma membrane, programmed cell death, regulation of cutin biosynthetic process, response to water deprivation, trans-Golgi network"
"Chir07Ox-b25050.2",0,0.909511951590881,0.833,0.452,0,"AT4G27870",NA,NA,"T27E11.110","cellular manganese ion homeostasis, ER body, intracellular sequestering of iron ion, iron ion transmembrane transporter activity, manganese ion transmembrane transporter activity, membrane, nucleus, plasma membrane"
