"gene_ID","p_val","avg_log2FC","pct.1","pct.2","p_val_adj","AT_ID","TF","TF_family","Gene_code_name","Gene_functions"
"Chir03Ox-b04520.2",0,1.58691375889373,0.745,0.085,0,"AT3G05165",NA,NA,"AT3G05165.6","membrane, mitochondrion, sugar transmembrane transporter activity, transmembrane transport, transmembrane transporter activity"
"Chir01Ox-b22090.2",0,0.446063697872951,0.306,0.086,0,NA,NA,NA,NA,NA
"Chir04Ox-b23380.2",4.0678982383635e-292,0.295425296215892,0.262,0.086,7.99748793662265e-288,"AT2G40610",NA,NA,"ATEXPA8","extracellular region, plant-type cell wall loosening, plant-type cell wall organization, response to herbicide, syncytium formation, unidimensional cell growth"
"Chir06Ox-b00480.2",0,0.60588231313149,0.56,0.086,0,"AT5G47380",NA,NA,"MQL5.24","cell wall biogenesis, molecular_function, negative regulation of metabolic process, nucleus, plant-type cell wall organization or biogenesis, response to light stimulus"
"Chir03Ox-b32920.2",0,0.29131501429212,0.302,0.087,0,"AT2G18300","Yes","bHLH","HBI1","bHLH transcription factor binding, chromatin DNA binding, DNA-binding transcription factor activity, mRNA transcription, negative regulation of innate immune response, nucleus, protein binding, protein dimerization activity, regulation of DNA-templated transcription, regulation of pattern recognition receptor signaling pathway, response to cytokinin, response to hormone, transcription cis-regulatory region binding, unidimensional cell growth"
"Chir05Ox-b06840.2",0,1.40549808664711,0.774,0.087,0,"AT3G28910","Yes","MYB","ATMYB30","DNA-binding transcription factor activity, negative regulation of photomorphogenesis, nucleus, plant-type hypersensitive response, protein binding, response to auxin, response to bacterium, response to high light intensity, response to hypoxia, sequence-specific double-stranded DNA binding, transcription cis-regulatory region binding, very long-chain fatty acid biosynthetic process"
"Chir07Ox-b00280.2",0,0.922274174285562,0.687,0.087,0,"AT5G41900",NA,NA,"K16L22.19","cellular lipid metabolic process, cytoplasm, molecular_function, monocarboxylic acid metabolic process, organic hydroxy compound biosynthetic process, response to inorganic substance, response to light stimulus, response to nutrient levels"
"Chir07Ox-b02260.2",0,0.456888440957805,0.341,0.087,0,"AT5G40390",NA,NA,"RS5","chloroplast, cytoplasm, galactinol-sucrose galactosyltransferase activity, mannitol biosynthetic process, raffinose family oligosaccharide biosynthetic process, response to oxidative stress, response to water deprivation, sucrose biosynthetic process"
"Chir08Ox-b11240.2",0,0.377042535223758,0.419,0.087,0,"AT5G50150",NA,NA,"LOTR1","embryo development ending in seed dormancy, extracellular region, meristem development, molecular_function, plant-type cell wall biogenesis, protein-containing complex assembly, regulation of biological quality, regulation of cellular component biogenesis"
"Chir08Ox-b23780.2",0,0.372416992600458,0.321,0.087,0,"AT5G61270","Yes","bHLH","PIF7","de-etiolation, DNA-binding transcription factor activity, double-stranded DNA binding, nuclear speck, nucleus, protein binding, protein dimerization activity, regulation of DNA-templated transcription, response to light stimulus"
"Chir01Ox-b04350.2",0,1.29675097822377,0.772,0.088,0,NA,NA,NA,NA,NA
"Chir01Ox-b36120.2",0,1.0168052828508,0.782,0.088,0,"AT1G47480",NA,NA,"AT1G47480.1","aromatic amino acid metabolic process, cellular biogenic amine metabolic process, methyl indole-3-acetate esterase activity, nucleus, organic acid biosynthetic process"
"Chir05Ox-b07000.2",0,1.11013692273696,0.544,0.088,0,"AT3G29030",NA,NA,"ATEXPA5","extracellular region, plant-type cell wall loosening, plant-type cell wall organization, primary root development, unidimensional cell growth"
"Chir05Ox-b27250.2",0,0.64450503772273,0.543,0.088,0,"AT3G61550",NA,NA,"ATL68","cell division, cellular_component, meiotic cell cycle process, molecular_function, tropism"
"Chir04Ox-b17970.2",0,0.614092338030921,0.493,0.089,0,"AT2G35760",NA,NA,"CASPL2B2","4 iron, 4 sulfur cluster binding, carboxylic acid metabolic process, plasma membrane"
"Chir01Ox-b05720.2",0,2.0102020032008,0.754,0.09,0,"AT1G06360",NA,NA,"AT1G06360.1","16:0 monogalactosyldiacylglycerol desaturase activity, acyl-CoA desaturase activity, endoplasmic reticulum, endoplasmic reticulum membrane, mitochondrion, oxidoreductase activity, acting on paired donors, with oxidation of a pair of donors resulting in the reduction of molecular oxygen to two molecules of water, unsaturated fatty acid biosynthetic process, wax biosynthetic process"
"Chir06Ox-b03000.2",0,0.702229463168043,0.276,0.09,0,"AT5G45340",NA,NA,"CYP707A3","(+)-abscisic acid 8'-hydroxylase activity, abscisic acid catabolic process, abscisic acid metabolic process, cellular response to hypoxia, chloroplast, extracellular region, heme binding, iron ion binding, monooxygenase activity, oxidoreductase activity, oxidoreductase activity, acting on paired donors, with incorporation or reduction of molecular oxygen, NAD(P)H as one donor, and incorporation of one atom of oxygen, response to red or far red light, response to water deprivation, sterol metabolic process"
"Chir06Ox-b26800.2",2.93680583499234e-23,0.519913685361106,0.135,0.09,5.77376027159494e-19,"AT5G12340",NA,NA,NA,"mitochondrion, molecular_function, response to fungus"
"Chir01Ox-b04460.2",0,1.00837959183328,0.781,0.092,0,"AT1G05230","Yes","HD-ZIP","AT1G05230.1","DNA-binding transcription factor activity, DNA-binding transcription factor activity, RNA polymerase II-specific, lipid binding, maintenance of floral organ identity, mucilage biosynthetic process involved in seed coat development, nucleus, plant-type cell wall cellulose metabolic process, positive regulation of DNA-templated transcription initiation, protein binding, seed coat development, transcription cis-regulatory region binding, trichome morphogenesis"
"Chir03Ox-b13230.2",0,0.71312037229367,0.34,0.092,0,"AT3G13790",NA,NA,"ATCWINV1","beta-fructofuranosidase activity, carbohydrate metabolic process, defense response to fungus, extracellular region, hydrolase activity, hydrolyzing O-glycosyl compounds, plant-type cell wall, plasma membrane, protein binding, response to wounding"
"Chir03Ox-b24710.2",0,2.24076641803794,0.668,0.092,0,"AT3G24420",NA,NA,"AT3G24420.1","catabolic process, cytoplasm, lipid metabolic process, nucleus, response to abscisic acid, response to hypoxia, response to jasmonic acid, response to light stimulus, secondary metabolic process"
"Chir04Ox-b17390.2",0,0.670827674680392,0.355,0.092,0,NA,NA,NA,NA,NA
"Chir05Ox-b26930.2",0,0.538371496898256,0.47,0.092,0,"AT3G61220",NA,NA,"AT3G61220.1","(-)-menthol dehydrogenase activity, (+)-neomenthol dehydrogenase activity, alcohol dehydrogenase (NADP+) activity, cytoplasm, cytosol, defense response, oxidoreductase activity, acting on the CH-OH group of donors, NAD or NADP as acceptor, plasma membrane"
"Chir06Ox-b30740.2",2.63962052521221e-205,0.269939029318383,0.239,0.092,5.18949395256721e-201,"AT5G08260",NA,NA,"scpl35","anatomical structure formation involved in morphogenesis, extracellular region, flavonoid metabolic process, meristem development, serine-type carboxypeptidase activity, shoot system morphogenesis"
"Chir08Ox-b00500.2",0,0.578530150944533,0.424,0.092,0,"AT4G00360",NA,NA,"CYP86A2","alkane 1-monooxygenase activity, aromatase activity, extracellular region, fatty acid metabolic process, heme binding, iron ion binding, protein binding"
"Chir01Ox-b31820.2",0,0.409111799767753,0.405,0.093,0,"AT1G33260",NA,NA,"T16O9.6","carbohydrate biosynthetic process, kinase activity, nucleus, phosphorylation, plasma membrane, protein phosphorylation, protein serine/threonine kinase activity, response to light stimulus, response to wounding, transmembrane receptor protein tyrosine kinase activity"
"Chir03Ox-b27150.2",0,2.57977518550798,0.349,0.093,0,"AT2G05530",NA,NA,"T20G20.12","biological_process, extracellular region, mitochondrion, molecular_function"
"Chir04Ox-b28250.2",8.87059218540173e-292,0.454970331501577,0.273,0.093,1.74395842364998e-287,"AT2G45450",NA,NA,"AT2G45450.1","adaxial/abaxial axis specification, leaf shaping, mitochondrion, protein binding"
"Chir03Ox-b16150.2",0,2.47589207382651,0.891,0.094,0,"AT3G16370",NA,NA,"AT3G16370.1","apoplast, chloroplast, hydrolase activity, acting on ester bonds"
"Chir07Ox-b27600.2",0,0.547281274728341,0.53,0.095,0,"AT4G30340",NA,NA,"ATDGK7","diacylglycerol kinase activity, leaf development, nucleus, protein kinase C-activating G protein-coupled receptor signaling pathway, root development"
"Chir01Ox-b00700.2",1.47285855363951e-243,0.258314208609818,0.273,0.097,2.89563991645527e-239,"AT1G01560",NA,NA,"ATMPK11","cytoplasm, cytosol, intracellular signal transduction, MAP kinase activity, nucleus, plasma membrane, protein binding, protein phosphorylation, protein serine/threonine kinase activity, response to abscisic acid, signal transduction"
"Chir08Ox-b04440.2",0,1.19074904589752,0.827,0.097,0,"AT4G04890","Yes","HD-ZIP","AT4G04890.1","cell differentiation, cotyledon development, DNA binding, DNA-binding transcription factor activity, DNA-binding transcription factor activity, RNA polymerase II-specific, epidermal cell differentiation, lipid binding, maintenance of floral organ identity, nucleus, protein binding, regulation of seed dormancy process, regulation of seed germination, seed germination, transcription cis-regulatory region binding"
"Chir07Ox-b30550.2",0,1.87378578765207,0.874,0.098,0,"AT4G33220",NA,NA,"ATPME44","cell wall modification, defense response to Gram-negative bacterium, extracellular region, pectin catabolic process, pectinesterase activity, pectinesterase inhibitor activity"
"Chir01Ox-b25150.2",0,0.4061690261386,0.316,0.099,0,"AT2G41730",NA,NA,"HRG1","anaerobic respiration, cytoplasm, molecular_function, nucleus, response to hydrogen peroxide"
"Chir04Ox-b21770.2",0,0.404781058214381,0.341,0.099,0,NA,NA,NA,NA,NA
"Chir07Ox-b12070.2",0,1.75355928162931,0.847,0.099,0,"AT4G15620",NA,NA,"AT4G15620.1","4 iron, 4 sulfur cluster binding, mitochondrion, plasma membrane, regulation of cellular component organization, regulation of cellular component size"
"Chir01Ox-b09800.2",1.03184840751806e-216,0.279905265072017,0.257,0.1,2.0286139691805e-212,"AT1G10090",NA,NA,"T27I1.11","calcium activated cation channel activity, cellular catabolic process, cellular response to oxygen-containing compound, cellular response to red or far red light, defense response to fungus, extracellular region, hormone-mediated signaling pathway, organic substance catabolic process, oxoacid metabolic process, plasma membrane, regulation of defense response, response to osmotic stress, response to oxidative stress, response to water deprivation, response to wounding"
"Chir01Ox-b17920.2",0,0.752076764077761,0.659,0.1,0,"AT1G17840",NA,NA,"WBC11","ABC-type transporter activity, ATPase-coupled transmembrane transporter activity, cotyledon vascular tissue pattern formation, cuticle development, cutin transport, efflux transmembrane transporter activity, external side of plasma membrane, fatty acid transmembrane transporter activity, fatty acid transport, nucleus, plasma membrane, protein binding, protein homodimerization activity, response to abscisic acid, response to salt stress, response to wounding, stem vascular tissue pattern formation, suberin biosynthetic process, transmembrane transport"
"Chir02Ox-b25630.2",0,1.35383388362533,0.741,0.1,0,"AT1G78570",NA,NA,"RHM1","auxin export across the plasma membrane, cell differentiation, chloroplast, dTDP-glucose 4,6-dehydratase activity, flavonol biosynthetic process, mitochondrion, plasmodesma, regulation of cell population proliferation, UDP-glucose 4,6-dehydratase activity, UDP-L-rhamnose synthase activity, UDP-rhamnose biosynthetic process"
"Chir03Ox-b19010.2",0,0.271967888977653,0.351,0.1,0,"AT3G19184","Yes","B3","REM1","meristem development, molecular_function, nucleus"
"Chir05Ox-b20520.2",0,0.371695599206153,0.318,0.1,0,"AT3G54990","Yes","AP2","AT3G54990.1","chloroplast organization, DNA binding, DNA-binding transcription factor activity, nucleus, regulation of DNA-templated transcription, transcription cis-regulatory region binding"
"Chir05Ox-b25270.2",0,0.347555153830616,0.41,0.1,0,"AT3G59420",NA,NA,"ACR4","cell surface, embryo development ending in seed dormancy, endocytic vesicle, kinase activity, lateral root formation, plasma membrane, protein binding, protein homodimerization activity, protein serine/threonine kinase activity, regulation of asymmetric cell division, root cap development, root development, transmembrane receptor protein kinase activity"
"Chir04Ox-b27290.2",0,1.4595987812285,0.789,0.102,0,"AT2G44490",NA,NA,"BGLU26","beta-glucosidase activity, carbohydrate metabolic process, chloroplast envelope, defense response by callose deposition in cell wall, defense response to bacterium, glucosinolate catabolic process, glucosinolate metabolic process, indole glucosinolate catabolic process, induced systemic resistance, membrane, mitochondrion, peroxisome, response to bacterium, response to salt stress, scopolin beta-glucosidase activity, thioglucosidase activity"
"Chir05Ox-b01690.2",0,2.33309802755589,0.885,0.102,0,"AT2G02850",NA,NA,"AT2G02850.1","anther development, apoplast, electron transfer activity, extracellular matrix, extracellular region, pollination, secretory vesicle"
"Chir05Ox-b22010.2",0,1.33644702172935,0.658,0.102,0,"AT3G56400","Yes","WRKY","WRKY70","camalexin biosynthetic process, cellular response to hypoxia, defense response to bacterium, defense response to fungus, defense response to oomycetes, DNA-binding transcription factor activity, floral organ senescence, indole glucosinolate biosynthetic process, induced systemic resistance, induced systemic resistance, jasmonic acid mediated signaling pathway, leaf senescence, negative regulation of DNA-templated transcription, negative regulation of leaf senescence, nucleus, positive regulation of salicylic acid mediated signaling pathway, protein binding, regulation of brassinosteroid mediated signaling pathway, regulation of defense response, regulation of DNA-templated transcription, regulation of ethylene-activated signaling pathway, regulation of jasmonic acid mediated signaling pathway, regulation of response to osmotic stress, regulation of response to water deprivation, regulation of salicylic acid mediated signaling pathway, regulation of stomatal closure, response to bacterium, response to insect, response to jasmonic acid, response to osmotic stress, response to reactive oxygen species, response to salicylic acid, sequence-specific DNA binding, systemic acquired resistance, salicylic acid mediated signaling pathway, transcription cis-regulatory region binding"
"Chir07Ox-b18410.2",0,1.48116142230605,0.885,0.102,0,"AT4G21750","Yes","HD-ZIP","AT4G21750.1","cell differentiation, cotyledon development, DNA binding, DNA-binding transcription factor activity, DNA-binding transcription factor activity, RNA polymerase II-specific, epidermal cell differentiation, lipid binding, nucleus, plant epidermal cell differentiation, protein binding, regulation of DNA-templated transcription, regulation of seed dormancy process, regulation of seed germination, seed germination, sequence-specific DNA binding"
"Chir01Ox-b38370.2",0,1.67294923597763,0.891,0.104,0,"AT1G49430",NA,NA,"LACS2","chloroplast, cutin biosynthetic process, defense response to fungus, endoplasmic reticulum, fatty acid biosynthetic process, fatty acid metabolic process, lateral root formation, long-chain fatty acid-CoA ligase activity, membrane, plasmodesma, very long-chain fatty acid-CoA ligase activity, wax biosynthetic process"
"Chir03Ox-b16140.2",0,2.23589757310544,0.901,0.105,0,NA,NA,NA,NA,NA
"Chir05Ox-b14960.2",0,0.375439027340568,0.451,0.106,0,"AT3G49900",NA,NA,"AT3G49900.1","nucleus, phyllome development, plant organ formation, tissue development"
"Chir06Ox-b02270.2",0,1.9982235703726,0.873,0.106,0,"AT5G45950",NA,NA,"AT5G45950.1","extracellular region, hydrolase activity, acting on ester bonds"
"Chir07Ox-b18260.2",0,0.987145291524867,0.704,0.106,0,"AT4G21620",NA,NA,"F17L22.80","biological_process, extracellular region, molecular_function"
"Chir02Ox-b21380.2",0,0.490494038328494,0.467,0.108,0,"AT1G74440",NA,NA,"MHL","cellular response to oxygen-containing compound, chloroplast, endoplasmic reticulum, fatty acid alpha-oxygenase activity, hormone-mediated signaling pathway, response to alcohol, response to inorganic substance, response to lipid, sphingoid catabolic process"
"Chir02Ox-b22640.2",0,1.06975378307044,0.715,0.108,0,"AT1G75710","Yes","C2H2","AT1G75710.1","cell division, cellular response to brassinosteroid stimulus, DNA-binding transcription factor activity, nucleus, primary root development, regulation of DNA-templated transcription, transcription cis-regulatory region binding"
"Chir05Ox-b07480.2",0,1.80673316632404,0.889,0.109,0,"AT3G43720",NA,NA,"AT3G43720.1","cuticle development, defense response to fungus, lipid binding, lipid transport, membrane, plasma membrane"
"Chir03Ox-b20330.2",0,2.89603113812336,0.805,0.11,0,NA,NA,NA,NA,NA
"Chir01Ox-b17290.2",0,1.83775590665929,0.904,0.111,0,"AT1G17200",NA,NA,"CASPL2A1","4 iron, 4 sulfur cluster binding, biological_process, plasma membrane, protein binding"
"Chir03Ox-b09670.2",0,0.784318729682438,0.503,0.112,0,"AT3G10450",NA,NA,"SCPL7","acyltransferase activity, transferring groups other than amino-acyl groups, extracellular region, proteolysis, secondary metabolic process, serine-type carboxypeptidase activity"
"Chir06Ox-b36720.2",0,0.793727636921388,0.472,0.112,0,"AT5G02230",NA,NA,"AT5G02230.3","cellular response to oxygen-containing compound, chemical homeostasis, defense response to bacterium, extracellular region, hormone-mediated signaling pathway, oxoacid metabolic process, response to jasmonic acid, response to organic cyclic compound, response to oxidative stress, response to red or far red light, response to water deprivation, response to wounding"
"Chir01Ox-b11470.2",0,2.22142085486333,0.878,0.114,0,"AT1G11600",NA,NA,"CYP77B1","fatty acid biosynthetic process, flower development, heme binding, iron ion binding, linoleic acid epoxygenase activity, membrane, organelle organization, oxidoreductase activity, acting on paired donors, with incorporation or reduction of molecular oxygen, NAD(P)H as one donor, and incorporation of one atom of oxygen, plant organ morphogenesis, plasma membrane, regulation of gene expression by genomic imprinting, tissue development"
"Chir07Ox-b27740.2",0,0.772667865871279,0.583,0.114,0,"AT4G30470",NA,NA,"AT4G30470.1","defense response to fungus, nucleus, oxidoreductase activity, acting on the CH-OH group of donors, NAD or NADP as acceptor, regulation of defense response, response to alcohol, response to inorganic substance, response to light stimulus, response to nitrogen compound"
"Chir05Ox-b15880.2",0,0.674207303711344,0.508,0.117,0,"AT3G50560",NA,NA,"T20E23.160","cellular_component, developmental growth, response to light stimulus"
"Chir06Ox-b15830.2",0,2.04392117500801,0.862,0.12,0,"AT5G23940",NA,NA,"EMB3009","cutin biosynthetic process, cytoplasm, embryo development ending in seed dormancy, localization, plant epidermis morphogenesis, trichome morphogenesis"
"Chir04Ox-b28870.2",0,0.496330890506997,0.521,0.121,0,"AT2G45970",NA,NA,"CYP86A8","alkane 1-monooxygenase activity, aromatase activity, extracellular region, fatty acid metabolic process, heme binding, iron ion binding, lipid biosynthetic process, seed coat development"
"Chir03Ox-b25510.2",0,0.499914511292582,0.516,0.122,0,NA,NA,NA,NA,NA
"Chir03Ox-b10500.2",0,1.04563354182379,0.763,0.123,0,"AT3G11210",NA,NA,"GGL17","anthocyanin-containing compound metabolic process, cell wall biogenesis, cytoplasm, lipid metabolic process, molecular_function, organic hydroxy compound metabolic process, oxoacid metabolic process, protein-containing complex assembly"
"Chir02Ox-b00120.2",0,1.86507741748427,0.872,0.124,0,"AT1G64710",NA,NA,"F13O11.3","alcohol dehydrogenase activity, zinc-dependent, cytoplasm, cytosol, formaldehyde catabolic process, S-(hydroxymethyl)glutathione dehydrogenase activity, zinc ion binding"
"Chir01Ox-b17280.2",0,1.88369317103602,0.885,0.126,0,"AT1G17190",NA,NA,"ATGSTU26","cytoplasm, glutathione metabolic process, glutathione transferase activity, response to cold, response to herbicide, toxin catabolic process"
"Chir03Ox-b15700.2",0,2.41168834546545,0.504,0.129,0,"AT3G15950",NA,NA,"AT3G15950.3","chloroplast, ER body, ER body organization, nucleus, peroxisome, plasmodesma, protein binding, secretory vesicle"
"Chir01Ox-b24010.2",0,1.09772333414282,0.646,0.13,0,"AT1G27130",NA,NA,"ATGSTU13","cytoplasm, cytosol, defense response by callose deposition, defense response to fungus, glutathione metabolic process, glutathione transferase activity, indole glucosinolate catabolic process, innate immune response, nucleus, toxin catabolic process"
"Chir03Ox-b20320.2",0,2.94908415445238,0.849,0.13,0,NA,NA,NA,NA,NA
"Chir02Ox-b04740.2",0,0.817582481596622,0.44,0.131,0,"AT1G61255",NA,NA,NA,"extracellular region, molecular_function, organic acid metabolic process, response to inorganic substance, response to jasmonic acid"
"Chir04Ox-b08700.2",0,3.05626447810945,0.924,0.131,0,"AT2G27385",NA,NA,NA,"biological_process, chloroplast, molecular_function"
"Chir04Ox-b18250.2",0,0.638883287106549,0.49,0.131,0,"AT2G36026",NA,NA,"AT2G36026.1","cell cycle, nucleus, protein binding"
"Chir04Ox-b23920.2",0,0.67444370292485,0.601,0.131,0,"AT2G41170",NA,NA,"T3K9.6","chloroplast, developmental growth, fatty acid metabolic process, molecular_function, response to auxin"
"Chir07Ox-b37050.2",0,0.434591216421979,0.452,0.131,0,"AT4G38620","Yes","MYB","ATMYB4","DNA binding, DNA-binding transcription factor activity, negative regulation of DNA-templated transcription, negative regulation of sinapate ester biosynthetic process, nucleus, protein binding, regulation of phenylpropanoid metabolic process, response to UV-B, transcription cis-regulatory region binding"
"Chir07Ox-b36360.2",0,2.4159909660505,0.912,0.132,0,"AT4G39330",NA,NA,"ATCAD9","apoplast, cinnamyl-alcohol dehydrogenase activity, cytoplasm, cytosol, lignin biosynthetic process, oxidoreductase activity, acting on the CH-OH group of donors, NAD or NADP as acceptor, plasma membrane, sinapyl alcohol dehydrogenase activity, zinc ion binding"
"Chir08Ox-b25940.2",0,0.643918685511658,0.595,0.132,0,"AT5G63410",NA,NA,"MLE2.4","ATP binding, plant-type secondary cell wall biogenesis, plasma membrane, protein kinase activity, transmembrane receptor protein tyrosine kinase activity"
"Chir08Ox-b28630.2",0,0.931244302416514,0.579,0.132,0,"AT5G65925",NA,NA,NA,"biological_process, molecular_function"
"Chir04Ox-b04250.2",0,2.60327960745774,0.942,0.134,0,"AT2G26250",NA,NA,"FDH","cuticle development, cytoplasm, endoplasmic reticulum, epidermal cell differentiation, fatty acid biosynthetic process, lipid biosynthetic process, peroxisome, response to cold, response to light stimulus, very long-chain fatty acid metabolic process, very-long-chain 3-ketoacyl-CoA synthase activity"
"Chir07Ox-b33330.2",0,0.972764957288675,0.748,0.137,0,"AT4G35840",NA,NA,"ATL26","oxoacid metabolic process, tetrapyrrole metabolic process, tissue development"
"Chir06Ox-b02610.2",0,2.31560987973246,0.942,0.139,0,"AT5G45670",NA,NA,"AT5G45670.1","anatomical structure maturation, extracellular region, hydrolase activity, acting on ester bonds"
"Chir07Ox-b27850.2",0,0.643615892457448,0.588,0.139,0,"AT4G30610",NA,NA,"BRS1","brassinosteroid mediated signaling pathway, extracellular region, extracellular space, serine-type carboxypeptidase activity"
"Chir07Ox-b19260.2",0,0.787598490811222,0.695,0.141,0,"AT4G22570",NA,NA,"APT3","adenine phosphoribosyltransferase activity, adenine salvage, AMP salvage, cytoplasm, cytosol"
"Chir01Ox-b15360.2",0,0.793261853655547,0.628,0.143,0,"AT1G15260",NA,NA,"F9L1.20","biological_process"
"Chir01Ox-b28220.2",0,3.30800165084625,0.949,0.144,0,"AT1G29670",NA,NA,"GGL6","apoplast, chloroplast thylakoid, extracellular region, hydrolase activity, acting on ester bonds, nucleus, plant-type cell wall, response to cold, response to light intensity, response to water deprivation"
"Chir01Ox-b14090.2",0,1.08767060189713,0.618,0.146,0,NA,NA,NA,NA,NA
"Chir04Ox-b30180.2",0,2.73188924194322,0.942,0.146,0,"AT2G47240",NA,NA,"CER8","cutin biosynthetic process, endoplasmic reticulum, fatty acid metabolic process, long-chain fatty acid-CoA ligase activity, membrane, nucleus, very long-chain fatty acid-CoA ligase activity, wax biosynthetic process"
"Chir06Ox-b05390.2",0,0.865156078644492,0.562,0.146,0,"AT5G43870",NA,NA,"AT5G43870.1","auxin-activated signaling pathway, leaf vascular tissue pattern formation, nucleus, phloem or xylem histogenesis, phosphatidylinositol binding, post-Golgi vesicle-mediated transport, response to light stimulus, signal transduction, trans-Golgi network"
"Chir01Ox-b33890.2",0,0.460982287084111,0.486,0.147,0,"AT1G41830",NA,NA,"SKS6","apoplast, cell wall biogenesis, copper ion binding, extracellular region, glucosinolate metabolic process, oxidoreductase activity, plant-type cell wall, plant-type cell wall organization or biogenesis, plasmodesma, response to inorganic substance, secretory vesicle"
"Chir02Ox-b01440.2",0,0.382147652729202,0.464,0.147,0,"AT1G63650","Yes","bHLH","EGL1","DNA-binding transcription factor activity, epidermal cell fate specification, jasmonic acid mediated signaling pathway, nucleus, protein binding, protein dimerization activity, regulation of DNA-templated transcription, trichome differentiation"
"Chir06Ox-b05540.2",0,1.54269108664709,0.873,0.147,0,"AT5G43760",NA,NA,"AT5G43760.1","cytoplasm, fatty acid biosynthetic process, fatty acid elongase activity, response to cold, response to light stimulus, very-long-chain 3-ketoacyl-CoA synthase activity"
