"gene_ID","p_val","avg_log2FC","pct.1","pct.2","p_val_adj","AT_ID","TF","TF_family","Gene_code_name","Gene_functions"
"Chir01Ox-b11000.2",0,0.257816584062058,0.113,0.001,0,NA,NA,NA,NA,NA
"Chir04Ox-b00760.2",0,0.360684505128035,0.108,0.001,0,"AT2G21560",NA,NA,"F2G1.17","molecular_function, nucleus, response to light stimulus, response to red or far red light"
"Chir05Ox-b19300.2",0,0.254440926998327,0.125,0.001,0,"AT3G57010",NA,NA,"F24I3.90","biosynthetic process, cell differentiation, chloroplast, endoplasmic reticulum, plant epidermis development, response to abscisic acid, response to lipid, response to osmotic stress, response to water deprivation, root morphogenesis"
"Chir06Ox-b13350.2",0,0.335736631283055,0.198,0.001,0,NA,NA,NA,NA,NA
"Chir07Ox-b20360.2",0,0.300799357799433,0.176,0.001,0,"AT4G23410",NA,NA,"AT4G23410.1","auxin-activated signaling pathway, extracellular region, organ growth, plasmodesma"
"Chir01Ox-b30110.2",0,0.256848454427901,0.139,0.002,0,"AT1G31580",NA,NA,"ECS1","defense response, mitochondrion, molecular_function, plant-type cell wall, response to bacterium, response to light stimulus"
"Chir01Ox-b44730.2",0,0.347734963899899,0.119,0.002,0,"AT1G54330","Yes","NAC","ANAC020","DNA-binding transcription factor activity, nucleus, pattern specification process, regulation of DNA-templated transcription, tissue development, transcription cis-regulatory region binding"
"Chir02Ox-b18880.2",0,0.563355754058909,0.139,0.002,0,"AT1G72230",NA,NA,"T9N14.17","electron transfer activity, membrane"
"Chir03Ox-b13010.2",0,0.402673376857342,0.136,0.002,0,"AT3G13662",NA,NA,"MMM17.6","extracellular region, hormone-mediated signaling pathway, molecular_function"
"Chir03Ox-b14400.2",0,1.04836297113322,0.116,0.002,0,"AT3G14780",NA,NA,"AT3G14780.1","biological_process, glucosyltransferase activity, nucleus, plasma membrane"
"Chir05Ox-b18600.2",0,0.952590653687266,0.216,0.002,0,"AT3G53100",NA,NA,"T4D2.30","hydrolase activity, acting on ester bonds"
"Chir07Ox-b15200.2",0,0.597041088195238,0.122,0.002,0,"AT4G18340",NA,NA,"AT4G18340.2","carbohydrate metabolic process, chloroplast, defense response to other organism, extracellular region, glucan endo-1,3-beta-D-glucosidase activity, regulation of defense response, response to chitin, signal transduction"
"Chir07Ox-b25650.2",0,0.347703819498095,0.137,0.002,0,"AT4G28410",NA,NA,"RSA1","amino acid metabolic process, biosynthetic process, cytoplasm, cytosol, L-tyrosine:2-oxoglutarate aminotransferase activity, pyridoxal phosphate binding, transaminase activity, tyrosine catabolic process"
"Chir08Ox-b02170.2",0,0.669187446682527,0.189,0.002,0,NA,NA,NA,NA,NA
"Chir01Ox-b24800.2",0,1.19698973359238,0.103,0.003,0,"AT1G26450",NA,NA,"T1K7.18","biological_process, extracellular region, membrane, molecular_function, nucleus"
"Chir01Ox-b34720.2",0,0.462964745674702,0.238,0.003,0,"AT1G43650",NA,NA,"UMAMIT22","chloroplast, indole-containing compound metabolic process, plant-type secondary cell wall biogenesis, plasma membrane, response to water deprivation, response to wounding, transmembrane transporter activity"
"Chir02Ox-b01840.2",0,0.381976178538911,0.13,0.003,0,"AT1G63300",NA,NA,"F9N12.8","extracellular region, lipid biosynthetic process, molecular_function, monocarboxylic acid biosynthetic process, negative regulation of metabolic process, secondary metabolic process, terpenoid metabolic process"
"Chir03Ox-b11140.2",0,0.834771044262116,0.222,0.003,0,NA,NA,NA,NA,NA
"Chir03Ox-b24310.2",0,0.363239026857618,0.224,0.003,0,"AT3G24110",NA,NA,"MUJ8.1","biological_process, calcium ion binding, nucleus"
"Chir04Ox-b19900.2",0,0.303145633210385,0.129,0.003,0,"AT2G37590","Yes","Dof","ATDOF2.4","DNA-binding transcription factor activity, nucleus, plasmodesmata-mediated intercellular transport, regulation of DNA-templated transcription, root radial pattern formation, transcription cis-regulatory region binding"
"Chir05Ox-b22210.2",0,0.493952397393477,0.147,0.003,0,"AT3G56620",NA,NA,"UMAMIT10","abscisic acid-activated signaling pathway, plasma membrane, response to osmotic stress, response to water deprivation, response to wounding, transmembrane transporter activity"
"Chir07Ox-b05400.2",0,0.496948305156389,0.281,0.003,0,"AT5G37660",NA,NA,"AT5G37660.2","extracellular region, plasmodesma"
"Chir07Ox-b21220.2",0,0.258766501430424,0.161,0.003,0,"AT4G24180",NA,NA,"TLP1","defense response, extracellular region, induced systemic resistance, molecular_function, response to bacterium, response to ethylene"
"Chir08Ox-b18660.2",0,0.379862501264467,0.202,0.003,0,"AT5G56540",NA,NA,"ATAGP14","membrane, plasma membrane, protein binding, root hair elongation"
"Chir02Ox-b16600.2",0,0.485617556336031,0.108,0.004,0,"AT1G70130",NA,NA,"LecRK-V.2","defense response to bacterium, defense response to oomycetes, extracellular region, kinase activity, plasma membrane, protein phosphorylation, transmembrane receptor protein serine/threonine kinase activity"
"Chir03Ox-b13020.2",0,0.396390375995568,0.109,0.004,0,NA,NA,NA,NA,NA
"Chir03Ox-b20670.2",0,0.597357471541104,0.259,0.004,0,"AT3G20640","Yes","bHLH","PFA6","DNA-binding transcription factor activity, DNA-binding transcription factor activity, RNA polymerase II-specific, nucleus, protein binding, protein dimerization activity, regulation of transcription by RNA polymerase II, RNA polymerase II cis-regulatory region sequence-specific DNA binding"
"Chir04Ox-b10460.2",0,0.351530011677446,0.234,0.004,0,NA,NA,NA,NA,NA
"Chir06Ox-b10030.2",0,0.289295978452885,0.228,0.004,0,"AT5G48800",NA,NA,"K24G6.13","maintenance of meristem identity, meristem initiation, seed development, shoot system morphogenesis"
"Chir06Ox-b15170.2",0,0.414988894890141,0.193,0.004,0,"AT5G24580",NA,NA,"AtHMP47","carbohydrate derivative metabolic process, cell differentiation, developmental growth, metal ion binding, nucleus, response to light stimulus, root morphogenesis, small molecule metabolic process, sulfur compound metabolic process, tissue development"
"Chir07Ox-b09160.2",0,0.268739532508569,0.149,0.004,0,"AT4G13600",NA,NA,"T6G15.150","cellular_component, molecular_function, radial pattern formation, tissue development"
"Chir07Ox-b36520.2",0,0.337314555467924,0.226,0.004,0,"AT4G39190",NA,NA,"T22F8.90","cellular_component, defense response to bacterium, defense response to fungus, embryo development ending in seed dormancy, molecular_function, response to jasmonic acid, response to nitrogen compound, response to oxidative stress, response to wounding, tissue development"
"Chir08Ox-b00580.2",0,0.290966644423206,0.139,0.004,0,"AT4G00460",NA,NA,"ATROPGEF3","cell morphogenesis involved in differentiation, cell tip growth, developmental cell growth, nucleus, organelle organization, pollen tube development"
"Chir01Ox-b40900.2",0,0.427712445327761,0.157,0.005,0,NA,NA,NA,NA,NA
"Chir02Ox-b14750.2",0,0.260650451943251,0.192,0.005,0,"AT1G68430",NA,NA,"T2E12.2","mitochondrion, molecular_function, tissue development"
"Chir04Ox-b09070.2",0,0.343003388948673,0.179,0.005,0,NA,NA,NA,NA,NA
"Chir05Ox-b25480.2",0,0.280962290281431,0.259,0.005,0,"AT3G59680",NA,NA,"AT3G59680.1","mitochondrion, tissue development"
"Chir06Ox-b16360.2",0,0.903097998252729,0.227,0.005,0,"AT5G23370",NA,NA,"MKD15.23","cell differentiation, cell wall organization or biogenesis, chloroplast, molecular_function, tissue development"
"Chir07Ox-b16330.2",0,0.443487228019972,0.121,0.005,0,"AT4G19460",NA,NA,"AT4G19460.1","chloroplast, defense response to fungus, glycosyltransferase activity, root development, signal transduction, toxin metabolic process"
"Chir01Ox-b07120.2",0,0.893444938905694,0.391,0.006,0,"AT1G07640","Yes","Dof","OBP2","DNA-binding transcription factor activity, nucleus, regionalization, regulation of DNA-templated transcription, regulation of glucosinolate biosynthetic process, regulation of root development, response to insect, response to jasmonic acid, response to wounding, root radial pattern formation, transcription cis-regulatory region binding"
"Chir01Ox-b40990.2",0,0.408196369298769,0.281,0.006,0,"AT1G52140",NA,NA,"F5F19.20","biological_process, cellular_component, molecular_function"
"Chir02Ox-b27480.2",0,0.566900851089151,0.131,0.006,0,"AT1G80520",NA,NA,"T21F11.15","cell division, cellular_component, growth, molecular_function"
"Chir03Ox-b26790.2",0,0.354861120934821,0.211,0.006,0,"AT2G04795",NA,NA,NA,"molecular_function, response to oxidative stress"
"Chir03Ox-b33030.2",0,0.478618260334049,0.191,0.006,0,"AT2G18380","Yes","GATA","HANL1","DNA-binding transcription factor activity, flower development, nucleus, phloem or xylem histogenesis, regulation of DNA-templated transcription, shoot system development, transcription cis-regulatory region binding, zinc ion binding"
"Chir04Ox-b27610.2",0,0.412680304712765,0.132,0.006,0,"AT2G44790",NA,NA,"AT2G44790.1","alpha-amino acid metabolic process, cellular catabolic process, cellular lipid metabolic process, defense response to bacterium, defense response to fungus, electron transfer activity, extracellular region, indole-containing compound biosynthetic process, membrane, plasma membrane, plasmodesma, regulation of defense response, response to light intensity, response to organic cyclic compound, response to oxidative stress, response to water deprivation, response to wounding, root morphogenesis, toxin metabolic process"
"Chir05Ox-b18430.2",0,0.479686581309862,0.239,0.006,0,"AT3G52900",NA,NA,"F8J2.70","biological_process, cytoplasm, molecular_function"
"Chir06Ox-b36510.2",0,0.282869259652078,0.153,0.006,0,"AT5G02460","Yes","Dof","AT5G02460.1","DNA-binding transcription factor activity, nucleus, plasmodesmata-mediated intercellular transport, polarity specification of adaxial/abaxial axis, regulation of DNA-templated transcription, root radial pattern formation"
"Chir07Ox-b27210.2",0,0.552812728381172,0.306,0.006,0,"AT4G29920",NA,NA,"AtHSPR","carbohydrate homeostasis, cellular response to water deprivation, cytoplasm, nucleus, phloem transport, response to salt stress"
"Chir02Ox-b20640.2",0,0.505777189219434,0.323,0.007,0,"AT1G73850",NA,NA,"F2P9.28","cell differentiation, cellular response to hormone stimulus, cellular_component, molecular_function, response to abscisic acid, signal transduction, tissue development"
"Chir02Ox-b22230.2",3.52730354803222e-251,0.599826965253565,0.111,0.007,6.93467877543134e-247,"AT1G75280",NA,NA,"AT1G75280.1","cytoplasm, cytosol, mitochondrion, plasma membrane, response to oxidative stress"
"Chir03Ox-b04690.2",0,0.281644142430669,0.165,0.007,0,"AT3G05327",NA,NA,NA,"cytoplasm, molecular_function, positive regulation of biosynthetic process, response to light stimulus, tissue development"
"Chir04Ox-b16290.2",0,0.706300470573177,0.201,0.007,0,"AT2G34140","Yes","Dof","AT2G34140.1","DNA-binding transcription factor activity, negative regulation of DNA-templated transcription, negative regulation of stem cell population maintenance, nucleus, transcription cis-regulatory region binding"
"Chir05Ox-b04070.2",0,1.34018832953576,0.511,0.007,0,"AT3G26760",NA,NA,"MDJ14.5","mitochondrion, root development, tissue development, zinc ion binding"
"Chir05Ox-b29100.2",0,0.46536611363753,0.23,0.007,0,"AT3G63440",NA,NA,"ATCKX6","cytokinin dehydrogenase activity, cytokinin metabolic process, extracellular region, FAD binding, oxidoreductase activity, stomatal complex morphogenesis"
"Chir06Ox-b16370.2",0,0.837006545177392,0.232,0.007,0,"AT5G23360",NA,NA,"MKD15.22","biological_process, chloroplast, molecular_function"
"Chir06Ox-b19550.2",0,2.04204485071609,0.252,0.007,0,"AT5G19530",NA,NA,"AT5G19530.1","auxin polar transport, cytoplasm, nucleus, phloem or xylem histogenesis, polyamine biosynthetic process, spermine synthase activity, thermospermine synthase activity, unidimensional cell growth, xylem vessel member cell differentiation"
"Chir01Ox-b26430.2",0,0.544819836563005,0.359,0.008,0,"AT1G27660","Yes","bHLH","PFA5","DNA-binding transcription factor activity, DNA-binding transcription factor activity, RNA polymerase II-specific, nucleus, protein dimerization activity, regulation of DNA-templated transcription, regulation of transcription by RNA polymerase II, RNA polymerase II cis-regulatory region sequence-specific DNA binding"
"Chir02Ox-b27890.2",4.94886650247988e-187,0.253805364317102,0.1,0.008,9.72947154387545e-183,"AT1G80100",NA,NA,"AHP6","cytokinin-activated signaling pathway, cytoplasm, mitochondrion, nucleus, phosphorelay signal transduction system, phosphorylation, protein histidine kinase binding, response to cytokinin, xylem development"
"Chir03Ox-b10170.2",0,0.383163841445423,0.183,0.008,0,"AT3G10870",NA,NA,"MES17","cellular_component, hydrolase activity, acting on ester bonds, indoleacetic acid conjugate metabolic process, jasmonic acid metabolic process, methyl indole-3-acetate esterase activity, methyl jasmonate esterase activity, methyl salicylate esterase activity, protein binding, salicylic acid metabolic process, shoot system development"
"Chir06Ox-b08200.2",0,0.903777061887782,0.458,0.008,0,"AT5G42200",NA,NA,"ATL23","cellular response to hypoxia, cellular_component, ubiquitin-protein transferase activity"
"Chir06Ox-b14280.2",0,1.26903928458523,0.332,0.008,0,"AT5G25490",NA,NA,"T14C9.30","cell differentiation, cellular component biogenesis, cytoplasm, mRNA binding, nucleus, porphyrin-containing compound metabolic process, regionalization, regulation of biological quality, response to light stimulus, RNA binding"
"Chir06Ox-b15150.2",0,0.25425628124374,0.155,0.008,0,"AT5G24600",NA,NA,"K18P6.13","defense response to fungus, glucosinolate metabolic process, mitochondrion, molecular_function, regulation of multicellular organismal development, response to hypoxia, response to light stimulus, response to water deprivation"
"Chir01Ox-b00670.2",0,0.572572729657617,0.158,0.009,0,"AT1G01580",NA,NA,"FRO2","ferric-chelate reductase activity, iron ion homeostasis, nucleus, oxidoreductase activity, plasma membrane, response to bacterium, siderophore-dependent iron import into cell"
"Chir01Ox-b40160.2",0,0.381652300003188,0.301,0.009,0,"AT1G51355",NA,NA,"SMR9","mitochondrion, molecular_function, negative regulation of mitotic nuclear division, nucleus, regulation of DNA endoreduplication, tissue development"
"Chir02Ox-b24180.2",0,0.341938258966589,0.179,0.009,0,"AT1G77110",NA,NA,"PIN6","auxin efflux transmembrane transporter activity, auxin export across the plasma membrane, auxin homeostasis, auxin polar transport, basipetal auxin transport, endoplasmic reticulum, negative regulation of ethylene-activated signaling pathway, negative regulation of lateral root development, plasma membrane, root hair elongation, transmembrane transport"
"Chir02Ox-b24930.2",0,0.341440222670931,0.139,0.009,0,"AT1G77885",NA,NA,NA,"biological_process, cellular_component, molecular_function"
"Chir05Ox-b16370.2",0,0.612323421605711,0.219,0.009,0,"AT3G51030",NA,NA,"ATTRX1","cytoplasm, cytosol, enzyme activator activity, oxidoreductase activity, acting on a sulfur group of donors, disulfide as acceptor, positive regulation of catalytic activity, protein binding, protein-disulfide reductase activity"
"Chir08Ox-b05500.2",3.04412505569333e-190,0.303660122844339,0.106,0.009,5.98474985949309e-186,"AT4G12430",NA,NA,"TPPF","cytoplasm, trehalose biosynthetic process, trehalose-phosphatase activity"
"Chir04Ox-b07640.2",0,0.414350011912077,0.34,0.01,0,"AT2G26700",NA,NA,"PID2","chloroplast, cotyledon development, cytoplasm, kinase activity, nucleus, plasma membrane, protein binding, protein phosphorylation, protein serine/threonine kinase activity"
"Chir06Ox-b14960.2",0,2.03726768238835,0.366,0.01,0,"AT5G24800","Yes","bZIP","ATBZIP9","cellular response to glucose stimulus, DNA-binding transcription factor activity, nucleus, protein binding, protein heterodimerization activity, protein homodimerization activity, regulation of DNA-templated transcription, transcription cis-regulatory region binding"
"Chir02Ox-b25130.2",0,0.758423118882665,0.379,0.011,0,"AT1G78110",NA,NA,"T11I11.5","biological_process, molecular_function, nucleus"
"Chir03Ox-b18390.2",0,0.689762443183131,0.272,0.011,0,"AT3G18560",NA,NA,"K24M9.5","cellular response to abscisic acid stimulus, cellular_component, defense response to other organism, hormone-mediated signaling pathway, inorganic ion homeostasis, molecular_function, regulation of defense response, response to organonitrogen compound, response to salt stress, response to water deprivation, response to wounding, secondary metabolic process"
"Chir03Ox-b34660.2",0,0.398282982161754,0.335,0.011,0,"AT2G20100",NA,NA,"UKTF1","DNA-binding transcription factor activity, RNA polymerase II-specific, nucleus, protein binding, protein dimerization activity, regulation of transcription by RNA polymerase II, RNA polymerase II cis-regulatory region sequence-specific DNA binding"
"Chir05Ox-b00970.2",0,0.308242635837708,0.231,0.011,0,"AT2G01950",NA,NA,"VH1","auxin-activated signaling pathway, brassinosteroid mediated signaling pathway, hormone-mediated signaling pathway, leaf vascular tissue pattern formation, phloem transport, plasma membrane, protein binding, protein phosphorylation, transmembrane receptor protein serine/threonine kinase activity, xylem and phloem pattern formation"
"Chir07Ox-b36270.2",0,0.540653353407913,0.173,0.011,0,"AT4G39410","Yes","WRKY","WRKY13","DNA-binding transcription factor activity, nucleus, positive regulation of DNA-templated transcription, positive regulation of sclerenchyma cell differentiation, protein binding, regulation of lignin biosynthetic process, RNA polymerase II cis-regulatory region sequence-specific DNA binding, stress response to cadmium ion, transcription cis-regulatory region binding"
"Chir08Ox-b06530.2",0,0.273370575409504,0.217,0.011,0,NA,NA,NA,NA,NA
"Chir01Ox-b04520.2",0,0.929320594274032,0.506,0.012,0,"AT4G34880",NA,NA,"F11I11.120","amidase activity, chloroplast, indoleacetamide hydrolase activity"
"Chir03Ox-b28030.2",0,2.26878513344581,0.537,0.012,0,"AT2G13820",NA,NA,"AtXYP2","extracellular region, lipid binding, lipid transport, plasma membrane, xylem development"
"Chir04Ox-b29520.2",0,0.52354012182147,0.37,0.012,0,"AT2G46590","Yes","Dof","AT2G46590.1","cellular response to red light, cellular response to water stimulus, DNA-binding transcription factor activity, nucleus, positive regulation of gibberellin biosynthetic process, positive regulation of seed germination, red light signaling pathway, regulation of DNA-templated transcription, response to cold, response to light stimulus, seed germination"
"Chir05Ox-b09640.2",0,0.45751880057296,0.162,0.012,0,"AT3G44960",NA,NA,"F14D17.30","chromosome, centromeric region, maintenance of meiotic sister chromatid cohesion, molecular_function, nucleus, stomatal complex development"
"Chir05Ox-b20920.2",0,0.86724968386961,0.476,0.012,0,"AT3G55370","Yes","Dof","OBP3","DNA binding, DNA-binding transcription factor activity, nucleus, photomorphogenesis, positive regulation of DNA-templated transcription, regulation of DNA-templated transcription, transcription cis-regulatory region binding"
"Chir06Ox-b36310.2",0,0.697841153544899,0.193,0.012,0,"AT5G02640",NA,NA,"T22P11.230","cell wall biogenesis, molecular_function, nucleus, plant-type cell wall organization or biogenesis, positive regulation of cellular process, regulation of cellular component biogenesis, response to abscisic acid, response to water deprivation, tissue development"
"Chir07Ox-b32000.2",0,0.270735299884785,0.172,0.012,0,"AT4G34560",NA,NA,"T4L20.140","cellular carbohydrate metabolic process, chloroplast, molecular_function"
"Chir01Ox-b41180.2",1.53654843781122e-231,0.723402275795924,0.136,0.013,3.02085422873685e-227,"AT1G52342",NA,NA,NA,"cellular catabolic process, molecular_function, nucleus, response to inorganic substance, response to red or far red light"
"Chir04Ox-b21350.2",0,0.695716882713603,0.461,0.013,0,"AT2G38800",NA,NA,"F13I13.3","calmodulin binding, cellular catabolic process, cellular response to abscisic acid stimulus, hormone-mediated signaling pathway, nucleus, response to light intensity, response to salt stress, response to water deprivation"
"Chir05Ox-b10420.2",0,0.814058726889984,0.351,0.013,0,"AT3G45610","Yes","Dof","AT3G45610.1","DNA-binding transcription factor activity, nucleus, regulation of DNA-templated transcription, root radial pattern formation, transcription cis-regulatory region binding"
"Chir08Ox-b19860.2",3.29173404879261e-142,0.269675532341499,0.108,0.013,6.47154913992628e-138,"AT5G57685",NA,NA,"ATGDU3","modulation by virus of host process, nucleus, protein binding, regulation of amino acid export, response to virus, secretion by cell"
"Chir04Ox-b13790.2",0,0.376905041288623,0.205,0.014,0,"AT2G31940",NA,NA,"F20M17.26","mitochondrion, molecular_function, response to inorganic substance, small molecule metabolic process"
"Chir08Ox-b02120.2",1.10050420303064e-247,0.299678728988638,0.146,0.014,2.16359126315823e-243,NA,NA,NA,NA,NA
"Chir01Ox-b01970.2",4.85728486415649e-206,0.380180750994246,0.137,0.015,9.54942204293165e-202,"AT1G02860",NA,NA,"BAH1","cytoplasm, defense response to bacterium, mitochondrion, nucleus, plant-type hypersensitive response, plasma membrane, protein binding, regulation of salicylic acid metabolic process, response to benzoic acid, response to nitrate, response to salicylic acid, salicylic acid biosynthetic process, systemic acquired resistance, ubiquitin-protein transferase activity"
"Chir01Ox-b14700.2",0,0.400066366792708,0.204,0.015,0,"AT1G14630",NA,NA,"T5E21.19","defense response to other organism, embryo development ending in seed dormancy, female meiotic nuclear division, male meiotic nuclear division, meiotic cell cycle process, meristem development, molecular_function, nucleus, xylem and phloem pattern formation"
"Chir02Ox-b00830.2",0,0.760148844071498,0.373,0.015,0,"AT1G64060",NA,NA,"ATRBOH F","abscisic acid-activated signaling pathway, calcium ion binding, carbohydrate homeostasis, defense response, defense response by callose deposition, ethylene-activated signaling pathway, ferric-chelate reductase activity, hydrogen peroxide biosynthetic process, NAD(P)H oxidase H2O2-forming activity, negative regulation of programmed cell death, osmosensory signaling pathway, plasma membrane, protein binding, reactive oxygen species metabolic process, regulation of stomatal movement, respiratory burst involved in defense response, response to ethylene"
"Chir04Ox-b12930.2",5.94554646499566e-237,0.313793161319914,0.15,0.015,1.16889443501815e-232,"AT2G31110",NA,NA,"AT2G31110.3","extracellular region, Golgi apparatus, O-acetyltransferase activity"
"Chir05Ox-b04970.2",3.42037178390536e-180,0.325175296697166,0.13,0.015,6.72445092715794e-176,"AT3G27400",NA,NA,"AT3G27400.1","cytosol, extracellular region, pectate lyase activity, pectin catabolic process, response to nematode"
"Chir07Ox-b08280.2",3.51373031673444e-130,0.291104409651594,0.11,0.015,6.9079938026999e-126,"AT4G12910",NA,NA,"scpl20","acyltransferase activity, transferring groups other than amino-acyl groups, extracellular region, peroxisome, plant-type vacuole, secondary metabolic process, serine-type carboxypeptidase activity"
"Chir07Ox-b17100.2",0,0.832471109957773,0.426,0.015,0,"AT4G20270",NA,NA,"BAM3","endoplasmic reticulum membrane, floral organ development, hormone-mediated signaling pathway, identical protein binding, maintenance of root meristem identity, peptide binding, peptide receptor activity, phloem development, plasma membrane, protein binding, protein phosphorylation, protein serine/threonine kinase activity, regulation of cell differentiation, regulation of meristem growth"
"Chir04Ox-b02290.2",1.29368840978919e-147,0.70465567988822,0.118,0.016,2.54339141364554e-143,NA,NA,NA,NA,NA
"Chir06Ox-b31640.2",3.37617087839877e-125,0.900903214454227,0.111,0.016,6.63755194693199e-121,"AT5G07310","Yes","ERF","AT5G07310.1","callus formation, DNA-binding transcription factor activity, nucleus, protein binding, regulation of DNA-templated transcription, response to light stimulus"
"Chir02Ox-b04110.2",0,0.960546068409439,0.389,0.017,0,"AT1G61660","Yes","bHLH","AtbHLH112","cellular response to abscisic acid stimulus, cellular response to salt stress, cellular response to water deprivation, DNA-binding transcription factor activity, DNA-binding transcription factor activity, RNA polymerase II-specific, nucleus, positive regulation of DNA-templated transcription, protein binding, protein dimerization activity, regulation of proline metabolic process, regulation of reactive oxygen species metabolic process, regulation of transcription by RNA polymerase II, RNA polymerase II cis-regulatory region sequence-specific DNA binding, sequence-specific DNA binding"
"Chir02Ox-b26340.2",0,0.669582734290695,0.24,0.017,0,"AT1G79180","Yes","MYB","ATMYB63","DNA-binding transcription factor activity, lignin biosynthetic process, nucleus, positive regulation of DNA-templated transcription, protein binding, regulation of secondary cell wall biogenesis, response to UV, transcription cis-regulatory region binding"
"Chir01Ox-b22850.2",3.11799014698853e-259,0.428528821119506,0.17,0.018,6.12996862897945e-255,"AT1G23090",NA,NA,"AST91","chloroplast, porphyrin-containing compound metabolic process, response to light stimulus, secondary active sulfate transmembrane transporter activity, sulfate transmembrane transporter activity, transmembrane transport"
"Chir03Ox-b09550.2",3.02387002100532e-121,0.328921711185261,0.114,0.018,5.94492846129646e-117,"AT3G10340",NA,NA,"AT3G10340.1","ammonia-lyase activity, cell differentiation, cinnamic acid biosynthetic process, cytoplasm, defense response, defense response to bacterium, organelle organization, phenylalanine ammonia-lyase activity, protein binding, regulation of multicellular organismal process, regulation of reproductive process, regulation of unidimensional cell growth, response to light stimulus, response to lipid, response to osmotic stress, response to water deprivation, signal transduction"
