"gene_ID","p_val","avg_log2FC","pct.1","pct.2","p_val_adj","AT_ID","TF","TF_family","Gene_code_name","Gene_functions"
"Chir02Ox-b16020.2",1.20649715077437e-99,0.499043157740648,0.241,0.077,2.37197339842241e-95,"AT1G69570","Yes","Dof","CDF5","DNA binding, DNA-binding transcription factor activity, negative regulation of long-day photoperiodism, flowering, negative regulation of short-day photoperiodism, flowering, nucleus, regulation of DNA-templated transcription"
"Chir03Ox-b20920.2",5.02663791688649e-212,0.498256347488033,0.324,0.077,9.88237014459884e-208,"AT3G20860",NA,NA,"ATNEK5","cortical microtubule organization, lateral root formation, negative regulation of ethylene biosynthetic process, nucleus, protein phosphorylation, protein serine/threonine kinase activity"
"Chir04Ox-b10040.2",0,1.17619943839971,0.57,0.078,0,"AT2G28510","Yes","Dof","AT2G28510.1","DNA-binding transcription factor activity, nucleolus, nucleus, regulation of DNA-templated transcription, transcription cis-regulatory region binding, zinc ion binding"
"Chir07Ox-b17440.2",2.49512510531736e-136,0.278673027133056,0.273,0.078,4.90541595705393e-132,"AT4G20880",NA,NA,"T13K14.40","cell differentiation, defense response to other organism, developmental growth, immune system process, nucleus, regulation of developmental process, response to bacterium, response to chitin, response to water deprivation"
"Chir02Ox-b27870.2",6.10086285951302e-141,0.355898954913395,0.284,0.079,1.19942963818026e-136,"AT1G80120",NA,NA,"F18B13.20","anatomical structure maturation, carboxylic acid biosynthetic process, cell differentiation, cell wall organization or biogenesis, cellular_component, defense response, flavonoid metabolic process, glycosyl compound metabolic process, molecular_function, oxoacid metabolic process, response to abscisic acid, response to inorganic substance, response to jasmonic acid, response to wounding, root morphogenesis, tissue development"
"Chir08Ox-b27800.2",1.34564231134274e-50,0.550417141821679,0.194,0.079,2.64553278409983e-46,"AT5G65140",NA,NA,"TPPJ","chloroplast, nucleolus, nucleus, response to cadmium ion, trehalose biosynthetic process, trehalose-phosphatase activity"
"Chir05Ox-b09690.2",4.91928982906486e-67,0.267780452053433,0.215,0.08,9.67132380394152e-63,"AT3G45010",NA,NA,"scpl48","cellular developmental process, defense response to other organism, extracellular region, oxoacid metabolic process, plant-type secondary cell wall biogenesis, response to inorganic substance, serine-type carboxypeptidase activity, vacuole, xylan metabolic process"
"Chir06Ox-b20470.2",0,0.509255160863878,0.43,0.08,0,"AT5G18690",NA,NA,"AGP25","biological_process, membrane, molecular_function, plasma membrane"
"Chir01Ox-b04640.2",2.29260714573774e-89,0.250606861476684,0.239,0.081,4.5072656485204e-85,"AT1G05370",NA,NA,"YUP8H12.1","anatomical structure formation involved in morphogenesis, meiotic cell cycle process, meristem maintenance, molecular_function, nucleus, organelle organization"
"Chir01Ox-b27710.2",1.25815339558024e-230,0.659514779870211,0.338,0.081,2.47352957571074e-226,"AT1G29160","Yes","Dof","COG1","DNA binding, DNA-binding transcription factor activity, nucleus, protein binding, regulation of DNA-templated transcription, seed coat development, transcription cis-regulatory region binding"
"Chir02Ox-b13940.2",0,0.418635761574878,0.394,0.081,0,"AT1G67720",NA,NA,"F12A21.30","cell differentiation, developmental growth, kinase activity, meristem development, phloem or xylem histogenesis, phosphorylation, protein binding, protein phosphorylation, protein serine/threonine kinase activity"
"Chir03Ox-b19180.2",1.06646930707367e-147,0.333714927062482,0.288,0.081,2.09667865770683e-143,"AT3G19370",NA,NA,"MLD14.10","biological_process, cellular_component, cytoplasm, molecular_function"
"Chir05Ox-b14840.2",8.09555744579647e-20,1.32455808454042,0.152,0.082,1.59158659384359e-15,"AT3G49780",NA,NA,"ATPSK4","cell differentiation, cell population proliferation, cellular catabolic process, cellular response to hypoxia, defense response to bacterium, defense response to fungus, extracellular matrix, extracellular region, Golgi apparatus, immune system process, plant organ morphogenesis, response to chitin, response to inorganic substance, response to salicylic acid, response to wounding, signal transduction"
"Chir08Ox-b26520.2",5.90783827115052e-122,0.2846396315138,0.27,0.082,1.16148100410819e-117,"AT5G63970",NA,NA,"RGLG3","cytoplasm, defense response to bacterium, jasmonic acid mediated signaling pathway, nucleus, protein binding, response to wounding, ubiquitin protein ligase activity, ubiquitin-protein transferase activity"
"Chir01Ox-b12020.2",1.07704743014898e-149,0.363406739371824,0.289,0.083,2.11747524767289e-145,"AT1G12060",NA,NA,"ATBAG5","chaperone binding, heat acclimation, hormone-mediated signaling pathway, nucleus, protein folding, response to heat"
"Chir07Ox-b31310.2",1.47576661386449e-231,0.408736444022202,0.346,0.083,2.90135716285758e-227,"AT4G33960",NA,NA,"F17I5.150","mitochondrion, molecular_function, oxoacid metabolic process, response to chitin"
"Chir01Ox-b43310.2",9.3719526955318e-182,0.326178676147719,0.313,0.084,1.84252589994155e-177,"AT1G54200",NA,NA,"AT1G54200.1","auxin transport, meristem development, nucleus, phloem or xylem histogenesis, plasma membrane, positive regulation of auxin mediated signaling pathway, protein binding, response to auxin, seed development, shoot system morphogenesis, tissue development"
"Chir08Ox-b25990.2",6.60446591075546e-59,1.03624888986583,0.21,0.084,1.29843799805452e-54,"AT5G63450",NA,NA,"CYP94B1","chloroplast, heme binding, iron ion binding, jasmonic acid metabolic process, jasmonoyl-isoleucine-12-hydroxylase activity, monooxygenase activity, oxidoreductase activity, acting on paired donors, with incorporation or reduction of molecular oxygen, protein binding, response to wounding"
"Chir02Ox-b01960.2",1.42268115462714e-64,0.412763791176926,0.219,0.085,2.79699114999695e-60,"AT1G63220",NA,NA,"AT1G63220.1","cytoplasm, developmental growth, root morphogenesis, tissue development"
"Chir02Ox-b18540.2",1.94030846628418e-181,0.370300912788229,0.317,0.085,3.81464644471471e-177,"AT1G71960",NA,NA,"ABCG25","ABC-type transporter activity, abscisic acid transport, abscisic acid-activated signaling pathway, ATPase-coupled transmembrane transporter activity, efflux transmembrane transporter activity, export from cell, intercellular transport, membrane, negative regulation of post-embryonic development, plasma membrane, response to abscisic acid, response to cold, response to heat, transmembrane transport"
"Chir08Ox-b20000.2",4.31854533977572e-89,0.30359451448823,0.244,0.085,8.49026013799906e-85,"AT5G57830",NA,NA,"MyoB12","cell wall biogenesis, developmental growth, molecular_function, nucleus, plant epidermis development, plant-type cell wall organization or biogenesis, response to water deprivation"
"Chir08Ox-b28820.2",7.75485837390268e-163,0.327672513365278,0.303,0.085,1.52460515630927e-158,"AT5G67460",NA,NA,"AT5G67460.1","carbohydrate metabolic process, cell division, extracellular region, glucan endo-1,3-beta-D-glucosidase activity, meiotic cell cycle process, negative regulation of macromolecule metabolic process"
"Chir01Ox-b42810.2",8.51178320078538e-29,0.372293552357433,0.172,0.086,1.67341657727441e-24,"AT1G53903",NA,NA,NA,"hormone-mediated signaling pathway, mitochondrion, molecular_function, response to light intensity, response to wounding"
"Chir02Ox-b20450.2",4.6772439139696e-78,0.265897893159582,0.234,0.086,9.19546153486424e-74,"AT1G73680",NA,NA,"alpha-DOX2","dioxygenase activity, extracellular region, fatty acid metabolic process, heme binding, leaf senescence, long-chain fatty acid metabolic process, oxidoreductase activity, acting on single donors with incorporation of molecular oxygen, incorporation of two atoms of oxygen, peroxidase activity, response to oxidative stress"
"Chir02Ox-b22440.2",0,2.15482399557693,0.599,0.086,0,"AT1G75500",NA,NA,"UMAMIT5","auxin export across the plasma membrane, mitochondrion, plant-type secondary cell wall biogenesis, plant-type vacuole, plant-type vacuole membrane, plasma membrane, positive regulation of auxin metabolic process, positive regulation of tryptophan metabolic process, transmembrane transporter activity, unidimensional cell growth"
"Chir06Ox-b17670.2",1.30740421583371e-53,0.351135026477881,0.205,0.086,2.57035668832908e-49,"AT5G22090",NA,NA,"EAR1","cytoplasm, endoplasmic reticulum, negative regulation of abscisic acid-activated signaling pathway, negative regulation of phosphorylation, nucleus, phosphatase binding, positive regulation of phosphatase activity, protein binding, protein N-terminus binding"
"Chir07Ox-b29220.2",0,0.474090255417187,0.426,0.086,0,"AT4G31920","Yes","ARR-B","ARR10","callus formation, cellular response to cytokinin stimulus, chloroplast, cytokinin-activated signaling pathway, DNA-binding transcription factor activity, maintenance of shoot apical meristem identity, nucleus, phosphorelay response regulator activity, primary root development, protein binding, regulation of anthocyanin metabolic process, regulation of chlorophyll biosynthetic process, regulation of cytokinin-activated signaling pathway, regulation of root meristem growth, regulation of seed growth, response to cytokinin, response to water deprivation, root development, shoot system development"
"Chir03Ox-b22810.2",3.8769957819448e-174,0.312648134425959,0.317,0.087,7.62217370730347e-170,"AT3G22810",NA,NA,"AT3G22810.1","auxin-activated signaling pathway, chloroplast, leaf vascular tissue pattern formation, nucleus, phloem or xylem histogenesis, phosphatidylinositol binding, protein binding, signal transduction, trans-Golgi network"
"Chir03Ox-b34040.2",9.37114390909863e-218,0.652413551905697,0.35,0.087,1.84236689252879e-213,"AT2G19460",NA,NA,"F27F23.23","carbohydrate derivative metabolic process, cellular catabolic process, molecular_function, nucleus, response to lipid, small molecule metabolic process"
"Chir08Ox-b03450.2",1.91861573366015e-114,0.251807697289091,0.277,0.089,3.77199853237585e-110,"AT4G03190",NA,NA,"GRH1","auxin binding, auxin-activated signaling pathway, carbon catabolite repression of transcription by glucose, cytoplasm, developmental growth, inositol hexakisphosphate binding, nuclear SCF ubiquitin ligase complex, nucleus, pollen maturation, protein binding, response to auxin, SCF ubiquitin ligase complex, SCF-dependent proteasomal ubiquitin-dependent protein catabolic process, stamen development, ubiquitin-dependent protein catabolic process, ubiquitin-protein transferase activity"
"Chir03Ox-b00140.2",2.89792922076231e-101,0.696625122860515,0.263,0.09,5.69732884801869e-97,"AT3G01970","Yes","WRKY","WRKY45","DNA-binding transcription factor activity, nucleus, phosphate ion transport, protein binding, regulation of DNA-templated transcription, transcription cis-regulatory region binding, transcription factor binding"
"Chir06Ox-b21550.2",5.15122272224188e-119,0.773667933830663,0.274,0.09,1.01273038719275e-114,"AT5G17760",NA,NA,"MVA3.110","cellular catabolic process, cytoplasm, defense response to bacterium, defense response to fungus, molecular_function, plasma membrane, protein catabolic process, response to abscisic acid, response to heat, response to inorganic substance, response to jasmonic acid, response to molecule of bacterial origin, response to salicylic acid"
"Chir08Ox-b05520.2",2.80151008625563e-59,0.28916277866399,0.221,0.09,5.50776882957857e-55,"AT4G12410",NA,NA,"SAUR35","defense response to other organism, developmental growth, mitochondrion, molecular_function, monocarboxylic acid metabolic process, response to auxin, response to lipid, response to water deprivation, response to wounding"
"Chir08Ox-b17430.2",0,0.578726615125946,0.469,0.091,0,"AT5G55480",NA,NA,"SVL1","glycerophosphodiester phosphodiesterase activity, guard cell morphogenesis, lipid metabolic process, membrane, plant-type cell wall cellulose metabolic process, plasma membrane, plasmodesma, plastid, secretory vesicle, trichome differentiation"
"Chir02Ox-b16950.2",1.0265442376886e-111,0.280212428757325,0.285,0.092,2.01818597129579e-107,NA,NA,NA,NA,NA
"Chir04Ox-b10130.2",8.47745788287168e-40,0.302612534183413,0.201,0.092,1.66666821977257e-35,"AT2G28570",NA,NA,"T17D12.13","defense response to bacterium, molecular_function, response to ethylene, response to hypoxia, response to inorganic substance, signal transduction"
"Chir05Ox-b04080.2",7.13014874981185e-303,0.46469698855531,0.409,0.092,1.40178724421301e-298,"AT3G26770",NA,NA,"MDJ14.1","cellular_component, organic acid metabolic process, secondary metabolic process, seed maturation"
"Chir07Ox-b29750.2",1.02760311887309e-109,0.768326679033829,0.279,0.092,2.0202677317045e-105,"AT4G32480",NA,NA,"F8B4.180","cellular response to hypoxia, molecular_function, nucleus, response to nutrient levels"
"Chir07Ox-b09330.2",8.20264588545745e-94,0.390750215530057,0.259,0.093,1.61264018108094e-89,"AT4G13710",NA,NA,"AT4G13710.1","cell division, extracellular region, fatty acid biosynthetic process, lyase activity, pectate lyase activity, pectin catabolic process, response to inorganic substance, root morphogenesis"
"Chir02Ox-b17080.2",3.25621884043155e-173,0.372091796698516,0.335,0.094,6.40172624028843e-169,"AT1G70550",NA,NA,"F24J13.12","cell division, cell wall biogenesis, mitochondrion, molecular_function, plant-type cell wall organization or biogenesis, regionalization, response to inorganic substance, small molecule metabolic process"
"Chir02Ox-b20320.2",1.02669637082502e-307,0.541787304678364,0.416,0.094,2.01848506504198e-303,"AT1G73590",NA,NA,"PIN1","apical part of cell, auxin efflux transmembrane transporter activity, auxin export across the plasma membrane, auxin homeostasis, auxin polar transport, basal plasma membrane, cotyledon development, cotyledon morphogenesis, cytoplasm, embryo development ending in seed dormancy, endoplasmic reticulum, flower development, gravitropism, inflorescence development, leaf formation, leaf shaping, phosphorylation, photomorphogenesis, plant-type cell wall, plasma membrane, plasmodesma, protein binding, root development, shoot system development, xylem and phloem pattern formation"
"Chir06Ox-b37330.2",0,1.40748935766854,0.487,0.094,0,"AT5G01370",NA,NA,"TRM29","fruit dehiscence, nucleus, protein binding"
"Chir06Ox-b17980.2",0,1.56068126104553,0.71,0.095,0,"AT5G21105",NA,NA,NA,"alpha-amino acid metabolic process, carboxylic acid biosynthetic process, copper ion binding, extracellular region, L-ascorbate oxidase activity, oxidoreductase activity, plant-type cell wall, plasmodesma, response to jasmonic acid, response to water deprivation, response to wounding"
"Chir08Ox-b01370.2",0,0.575234156382723,0.516,0.095,0,"AT4G00900",NA,NA,"ECA2","ATP hydrolysis activity, calcium ion transmembrane transport, calcium ion transport, cellular calcium ion homeostasis, endoplasmic reticulum, ion transmembrane transport, P-type calcium transporter activity, P-type ion transporter activity"
"Chir05Ox-b01670.2",2.10063992116663e-172,0.359010483441538,0.328,0.096,4.1298580850136e-168,"AT2G02820","Yes","MYB","MYB88","DNA-binding transcription factor activity, DNA-binding transcription factor activity, RNA polymerase II-specific, embryo sac development, guard cell differentiation, guard mother cell cytokinesis, guard mother cell differentiation, lateral root development, megasporogenesis, multicellular organismal water homeostasis, nucleus, positive regulation of lateral root development, positive regulation of response to salt stress, positive regulation of response to water deprivation, protein binding, regulation of cell cycle G1/S phase transition, regulation of DNA endoreduplication, regulation of DNA-templated transcription, regulation of stomatal complex patterning, response to abscisic acid, response to gravity, RNA polymerase II cis-regulatory region sequence-specific DNA binding, sequence-specific DNA binding, stomatal complex formation"
"Chir06Ox-b27160.2",2.62806507763166e-257,0.477477412588882,0.386,0.096,5.16677594262385e-253,"AT5G11970",NA,NA,"F14F18.140","cellular response to organic cyclic compound, cellular response to oxygen-containing compound, cellular_component, defense response to bacterium, defense response to fungus, molecular_function, regulation of defense response, response to abscisic acid, response to salicylic acid"
"Chir07Ox-b28210.2",0,0.775556646564412,0.554,0.096,0,"AT4G30980","Yes","bHLH","LRL2","DNA-binding transcription factor activity, DNA-binding transcription factor activity, RNA polymerase II-specific, microgametogenesis, nucleus, pollen sperm cell differentiation, protein dimerization activity, regulation of DNA-templated transcription, regulation of transcription by RNA polymerase II, RNA polymerase II cis-regulatory region sequence-specific DNA binding, root hair cell development, root hair cell differentiation, root hair elongation"
"Chir08Ox-b20850.2",1.86766684078304e-247,0.51620112985999,0.377,0.096,3.67183300897946e-243,"AT5G58630",NA,NA,"TRM31","chloroplast, hormone-mediated signaling pathway, meristem development, molecular_function, shoot system development"
"Chir05Ox-b15940.2",8.6398502256886e-142,0.279013395788048,0.308,0.097,1.69859455437038e-137,NA,NA,NA,NA,NA
"Chir06Ox-b22720.2",0,1.34388437128651,0.551,0.097,0,"AT5G16600","Yes","MYB","MYB43","cell differentiation, DNA-binding transcription factor activity, L-phenylalanine biosynthetic process, nucleus, positive regulation of DNA-templated transcription, regulation of lignin biosynthetic process, regulation of phenylpropanoid metabolic process, regulation of secondary cell wall biogenesis, transcription cis-regulatory region binding"
"Chir01Ox-b18710.2",4.03537133646365e-260,0.442687220285115,0.392,0.098,7.93354004748754e-256,"AT1G18670",NA,NA,"IBS1","cyclin-dependent protein kinase holoenzyme complex, cyclin-dependent protein serine/threonine kinase activity, defense response to bacterium, defense response to oomycetes, nucleus, phosphorylation of RNA polymerase II C-terminal domain, plasma membrane, positive regulation of defense response to bacterium, positive regulation of defense response to oomycetes, positive regulation of transcription elongation by RNA polymerase II, protein kinase activity, protein phosphorylation, regulation of salicylic acid mediated signaling pathway, RNA polymerase II CTD heptapeptide repeat kinase activity"
"Chir02Ox-b11050.2",5.36620149339348e-22,0.604168272100139,0.177,0.098,1.05499521360116e-17,"AT1G65486",NA,NA,"STMP4","extracellular region, mitochondrion, molecular_function, nucleus, response to water deprivation"
"Chir06Ox-b17160.2",5.86213771693151e-20,1.11664236050522,0.174,0.098,1.15249627514874e-15,"AT5G22580",NA,NA,"AT5G22580.1","chloroplast, cytosol, defense response to other organism, plastid, regulation of hormone levels, tissue development"
"Chir05Ox-b09870.2",2.71426150501131e-12,0.44559854265145,0.156,0.1,5.33623811885224e-08,NA,NA,NA,NA,NA
"Chir06Ox-b10970.2",0,1.01568495288181,0.47,0.1,0,"AT5G49280",NA,NA,"K21P3.16","amino acid metabolic process, carboxylic acid biosynthetic process, defense response to other organism, membrane, molecular_function, response to chitin, response to inorganic substance, response to wounding"
"Chir07Ox-b26310.2",0,1.34980679343842,0.789,0.1,0,"AT4G29100","Yes","bHLH","BHLH68","DNA-binding transcription factor activity, DNA-binding transcription factor activity, RNA polymerase II-specific, nucleus, protein binding, protein dimerization activity, regulation of DNA-templated transcription, regulation of transcription by RNA polymerase II, response to abscisic acid, RNA polymerase II cis-regulatory region sequence-specific DNA binding"
"Chir07Ox-b00590.2",0,0.569296143999489,0.467,0.101,0,"AT5G41620",NA,NA,"MBK23.17","carboxylic acid metabolic process, chloroplast, cytoplasm, molecular_function, response to jasmonic acid, response to light stimulus, response to wounding"
"Chir07Ox-b36080.2",0,0.866990290424789,0.527,0.103,0,"AT4G39640",NA,NA,"AT4G39640.1","apoplast, extracellular region, glutathione catabolic process, glutathione gamma-glutamylcysteinyltransferase activity, glutathione hydrolase activity, hypoglycin A gamma-glutamyl transpeptidase activity, leukotriene C4 gamma-glutamyl transferase activity, plasma membrane, plasmodesma, response to oxidative stress"
"Chir01Ox-b41000.2",0,0.610012699374761,0.44,0.109,0,"AT1G52150","Yes","HD-ZIP","ATHB-15","determination of bilateral symmetry, determination of dorsal identity, DNA-binding transcription factor activity, integument development, leaf morphogenesis, lipid binding, meristem initiation, meristem maintenance, nucleus, phloem or xylem histogenesis, plant organ morphogenesis, regulation of meristem growth, transcription cis-regulatory region binding"
"Chir04Ox-b02280.2",0,1.22574162355549,0.498,0.109,0,"AT2G22850","Yes","bZIP","AtbZIP6","DNA-binding transcription factor activity, nucleus, positive regulation of DNA-templated transcription, protein binding, transcription cis-regulatory region binding"
"Chir06Ox-b19160.2",0,0.923658419296802,0.524,0.11,0,"AT5G19875",NA,NA,NA,"mitochondrion, molecular_function, response to oxidative stress"
"Chir04Ox-b20580.2",2.53245490516137e-276,0.520225434867332,0.428,0.111,4.97880634354725e-272,"AT2G38120",NA,NA,"AUX1","amino acid transmembrane transport, amino acid transmembrane transporter activity, auxin binding, auxin influx transmembrane transporter activity, auxin polar transport, cell surface, endosome, establishment of planar polarity, Golgi apparatus, lateral root formation, membrane, plasma membrane, positive gravitropism, protein binding, response to auxin, response to ethylene, response to nematode, root cap development, root hair cell differentiation"
"Chir05Ox-b19510.2",7.57929495971318e-261,0.782581898786517,0.426,0.111,1.49008938907961e-256,"AT3G54030",NA,NA,"BSK6","brassinosteroid mediated signaling pathway, chloroplast, plasma membrane, protein binding, protein phosphorylation, protein serine/threonine kinase activity"
"Chir08Ox-b11240.2",0,0.769422919895604,0.629,0.118,0,"AT5G50150",NA,NA,"LOTR1","embryo development ending in seed dormancy, extracellular region, meristem development, molecular_function, plant-type cell wall biogenesis, protein-containing complex assembly, regulation of biological quality, regulation of cellular component biogenesis"
"Chir05Ox-b19890.2",1.10615087333773e-291,0.563636655335303,0.449,0.12,2.17469261698197e-287,"AT3G54430","Yes","SRS","SRS6","DNA binding, DNA-binding transcription factor activity, meiotic cell cycle process, nucleus, positive regulation of DNA-templated transcription, protein binding"
"Chir06Ox-b18510.2",1.86562434645525e-307,0.58535873554068,0.461,0.12,3.66781746513103e-303,"AT5G20540",NA,NA,"ATBRXL4","maintenance of meristem identity, meiotic cell cycle process, molecular_function, nucleus, phloem development, plant organ formation, plant-type secondary cell wall biogenesis, regionalization, root development, seed development, shoot system morphogenesis, tissue development"
"Chir01Ox-b04720.2",1.45994072165609e-247,0.570836329135495,0.426,0.123,2.87024345877587e-243,"AT1G05470",NA,NA,"CVP2","cotyledon vascular tissue pattern formation, cytoplasm, inositol phosphate dephosphorylation, inositol phosphate-mediated signaling, inositol trisphosphate metabolic process, inositol trisphosphate phosphatase activity, inositol-polyphosphate 5-phosphatase activity, leaf vascular tissue pattern formation, phosphatidylinositol dephosphorylation, phosphatidylinositol-3,4,5-trisphosphate 5-phosphatase activity, phosphatidylinositol-4,5-bisphosphate 5-phosphatase activity, procambium histogenesis, protein binding, response to abscisic acid, xylem and phloem pattern formation"
"Chir03Ox-b18100.2",0,3.37493433090859,0.75,0.125,0,"AT3G18280",NA,NA,"AtTED4","extracellular region, lipid transport, mitochondrion"
"Chir05Ox-b01200.2",0,4.40242165800763,0.847,0.128,0,"AT2G02130",NA,NA,"PDF2.3","cellular lipid metabolic process, defense response, extracellular region, lipid biosynthetic process, mitochondrion, plant-type cell wall, plasmodesma"
"Chir02Ox-b27050.2",1.20774670150487e-285,0.5159174575002,0.462,0.131,2.37443001515857e-281,"AT1G80870",NA,NA,"F23A5.23","chloroplast, meristem initiation, plasma membrane, protein phosphorylation, protein serine/threonine kinase activity, seed development"
"Chir01Ox-b15200.2",0,0.623556482581234,0.507,0.138,0,"AT1G15080",NA,NA,"ATPAP2","abscisic acid-activated signaling pathway, acid phosphatase activity, cytoplasm, phosphatidate phosphatase activity, phospholipid metabolic process"
"Chir02Ox-b23660.2",2.88199737603988e-263,0.543583308051567,0.47,0.143,5.6660068412944e-259,"AT1G76550",NA,NA,"F14G6.15","ATP binding, cytoplasm, diphosphate-fructose-6-phosphate 1-phosphotransferase activity, mitochondrion, phosphofructokinase activity, photosynthesis, pyrophosphate-dependent phosphofructokinase complex, alpha-subunit complex, response to glucose"
"Chir08Ox-b28950.2",0,0.749713629470165,0.534,0.144,0,"AT5G67350",NA,NA,"K8K14.7","cellular response to organic substance, cellular response to oxygen-containing compound, cellular response to salicylic acid stimulus, defense response to bacterium, defense response to fungus, molecular_function, nucleus, regulation of defense response, regulation of immune system process, response to inorganic substance, response to nitrogen compound, signal transduction, tissue development"
