"gene_ID","p_val","avg_log2FC","pct.1","pct.2","p_val_adj","AT_ID","TF","TF_family","Gene_code_name","Gene_functions"
"Chir06Ox-b22590.2",0,0.41088986310597,0.389,0.044,0,"AT5G16720",NA,NA,"AT5G16720.1","cytoplasm, myosin binding, myosin XI tail binding, plant-type secondary cell wall biogenesis, tissue development"
"Chir08Ox-b00560.2",0,0.64337999129546,0.404,0.044,0,"AT4G00440",NA,NA,"TRM15","cell differentiation, developmental growth, meristem development, molecular_function, nucleus, regulation of biological quality, regulation of developmental process, shoot system morphogenesis"
"Chir06Ox-b06600.2",9.50641801364825e-130,0.465420357148374,0.195,0.045,1.86896178148325e-125,"AT5G43170","Yes","C2H2","AZF3","DNA binding, DNA-binding transcription factor activity, hyperosmotic salinity response, negative regulation of DNA-templated transcription, nucleus, protein binding, response to cold, sequence-specific DNA binding, transcription cis-regulatory region binding"
"Chir07Ox-b34150.2",5.31736448493035e-302,0.609574764616843,0.28,0.045,1.04539385773731e-297,"AT4G36710","Yes","GRAS","HAM4","cell differentiation, DNA-binding transcription factor activity, nucleus, protein binding, regulation of DNA-templated transcription, regulation of shoot system development, sequence-specific DNA binding"
"Chir03Ox-b20890.2",2.05259652232664e-267,0.298106731570285,0.27,0.046,4.03540476289418e-263,"AT3G20830",NA,NA,"UCNL","cytoplasm, kinase activity, nucleus, phosphorylation, plasma membrane, protein phosphorylation, protein serine/threonine kinase activity"
"Chir04Ox-b25860.2",5.90709062638637e-134,1.57402267707012,0.198,0.046,1.16133401714756e-129,"AT2G43120",NA,NA,"AT2G43120.1","cytosol, defense response to bacterium, nucleus, peptidase inhibitor activity, protein binding"
"Chir03Ox-b12560.2",0,0.743740775088417,0.403,0.047,0,"AT3G13275",NA,NA,NA,"carboxylic acid metabolic process, cellular response to organic substance, developmental growth, extracellular region, glucosinolate metabolic process, molecular_function, response to abscisic acid, response to inorganic substance, response to jasmonic acid, signal transduction"
"Chir04Ox-b05930.2",5.20125405190408e-206,0.408898240980122,0.245,0.047,1.02256654660434e-201,"AT2G24762",NA,NA,"AtGDU4","chloroplast, molecular_function, regulation of amino acid export"
"Chir04Ox-b23870.2",0,1.08880076342306,0.445,0.047,0,"AT2G41130","Yes","bHLH","STC8","chloroplast envelope, DNA-binding transcription factor activity, hyperosmotic salinity response, nucleus, protein dimerization activity, regulation of DNA-templated transcription"
"Chir06Ox-b21260.2",3.47277310909695e-232,0.364545785984202,0.258,0.047,6.8274719324846e-228,"AT5G17980",NA,NA,"MCTP16","biological_process, endoplasmic reticulum, molecular_function, nucleus, plasmodesma"
"Chir08Ox-b25200.2",1.21416000795255e-182,0.625842801998221,0.23,0.047,2.38703857563471e-178,"AT5G62680",NA,NA,"GTR2","glucosinolate transport, glucosinolate:proton symporter activity, phloem glucosinolate loading, plasma membrane, plasmodesma"
"Chir04Ox-b17740.2",8.68709428482795e-247,0.28923178121259,0.267,0.048,1.70788273639717e-242,"AT2G35600",NA,NA,"ATBRXL1","molecular_function, nucleus, phloem development, response to auxin, tissue development"
"Chir04Ox-b18820.2",0,0.992687679390746,0.625,0.048,0,"AT2G36570",NA,NA,"PXC1","kinase activity, plant-type secondary cell wall biogenesis, plasma membrane, protein kinase activity, protein phosphorylation"
"Chir08Ox-b27840.2",1.0555333939602e-68,0.270524139324187,0.158,0.048,2.07517865252575e-64,"AT5G65170",NA,NA,"MQN23.11","floral organ development, molecular_function, nucleus, response to inorganic substance"
"Chir01Ox-b08360.2",2.58554135157962e-166,0.408469264142025,0.225,0.049,5.08317429720553e-162,"AT1G08800",NA,NA,"AT1G08800.1","cytoplasm, myosin binding, myosin XI tail binding, response to abscisic acid, transport vesicle"
"Chir01Ox-b41110.2",0,0.261216116611752,0.319,0.049,0,"AT1G52290",NA,NA,"PERK15","cellular carbohydrate metabolic process, chloroplast, defense response to other organism, polysaccharide metabolic process, protein kinase activity, protein phosphorylation, protein serine/threonine kinase activity, response to organic cyclic compound"
"Chir04Ox-b25840.2",3.88996944227192e-41,0.281273452906226,0.132,0.049,7.6476799235066e-37,"AT2G43100",NA,NA,"IPMI2","3-isopropylmalate dehydratase activity, chloroplast, chloroplast stroma, glucosinolate biosynthetic process, leucine biosynthetic process, plastid"
"Chir06Ox-b33620.2",0,0.514782320731572,0.302,0.05,0,"AT5G05350",NA,NA,"AT5G05350.1","cyclase activity, glycosyl compound metabolic process, nucleus, sesquiterpene biosynthetic process"
"Chir08Ox-b16470.2",0,1.1062543186024,0.449,0.051,0,"AT5G54510",NA,NA,"GH3.6","acid-amino acid ligase activity, auxin homeostasis, auxin-activated signaling pathway, cytoplasm, indole-3-acetic acid amido synthetase activity, nucleus, response to auxin, unidimensional cell growth"
"Chir08Ox-b25320.2",0,0.501650824795562,0.32,0.051,0,"AT5G62820",NA,NA,"AT5G62820.1","4 iron, 4 sulfur cluster binding, biological_process, nucleus"
"Chir01Ox-b39450.2",4.70389208455359e-24,0.346180923280502,0.116,0.052,9.24785183823235e-20,"AT1G50590",NA,NA,"AT1G50590.1","cellular response to hormone stimulus, defense response to fungus, nucleus, oxoacid metabolic process, regulation of defense response, response to abscisic acid, response to bacterium, response to chitin, response to osmotic stress, response to water deprivation, response to wounding, signal transduction"
"Chir07Ox-b28990.2",0,0.650001426453142,0.342,0.052,0,"AT4G31730",NA,NA,"AT4G31730.1","glutamine secretion, membrane, nucleus, protein binding, regulation of amino acid export"
"Chir01Ox-b20860.2",8.0020196995624e-275,0.489882080851716,0.297,0.053,1.57319707293397e-270,"AT1G21050",NA,NA,"T22I11.13","defense response to fungus, hydrotropism, molecular_function, nucleus, protein-containing complex assembly, regulation of post-embryonic development, response to bacterium, response to inorganic substance, response to organic cyclic compound, response to red or far red light, response to wounding"
"Chir04Ox-b11700.2",8.47719774588462e-178,0.349138267760735,0.244,0.053,1.66661707684092e-173,"AT2G30080",NA,NA,"ZIP6","membrane, metal ion transmembrane transporter activity, plasma membrane, response to nematode, zinc ion transmembrane transport, zinc ion transmembrane transporter activity"
"Chir04Ox-b21900.2",6.01551917872891e-179,0.859101878397391,0.248,0.053,1.1826510705381e-174,NA,NA,NA,NA,NA
"Chir05Ox-b15790.2",3.34869915929735e-21,0.345740172722719,0.113,0.053,6.5835425471786e-17,"AT3G50440",NA,NA,"ATMES10","cellular response to hypoxia, cytosol, hydrolase activity, acting on ester bonds, jasmonic acid metabolic process, methyl indole-3-acetate esterase activity, methyl jasmonate esterase activity, methyl salicylate esterase activity, oxylipin biosynthetic process, salicylic acid metabolic process"
"Chir06Ox-b25690.2",1.39656856636876e-270,0.283792901197825,0.292,0.053,2.74565380148099e-266,"AT5G13790","Yes","MIKC_MADS","AGL15","cellular response to auxin stimulus, cytoplasm, DNA binding, DNA-binding transcription factor activity, DNA-binding transcription factor activity, RNA polymerase II-specific, embryo development ending in seed dormancy, floral organ abscission, fruit abscission, fruit dehiscence, gibberellin catabolic process, negative regulation of DNA-templated transcription, negative regulation of floral organ abscission, negative regulation of flower development, negative regulation of gene expression, negative regulation of seed maturation, negative regulation of short-day photoperiodism, flowering, nucleus, positive regulation of DNA-templated transcription, positive regulation of transcription by RNA polymerase II, protein binding, protein homodimerization activity, regulation of transcription by RNA polymerase II, RNA polymerase II cis-regulatory region sequence-specific DNA binding, sequence-specific DNA binding, somatic embryogenesis, transcription regulator activity"
"Chir01Ox-b09790.2",2.50632756092723e-85,0.356092673319087,0.185,0.054,4.92743998478294e-81,"AT1G10070",NA,NA,"ATBCAT-2","branched-chain-amino-acid transaminase activity, chloroplast, cytoplasm, isoleucine biosynthetic process, L-isoleucine transaminase activity, L-leucine transaminase activity, L-valine transaminase activity, leucine biosynthetic process, plant-type cell wall organization or biogenesis, valine biosynthetic process"
"Chir02Ox-b08950.2",1.37122401821768e-35,0.434780652072325,0.136,0.054,2.69582641981596e-31,"AT1G56250",NA,NA,"AtPP2-B14","camalexin biosynthetic process, carbohydrate binding, cellular response to organic substance, cellular response to oxygen-containing compound, chloroplast, cytoplasm, defense response to bacterium, defense response to fungus, immune system process, nucleus, phyllome development, protein binding, regulation of defense response, response to abscisic acid, response to chitin, response to inorganic substance, response to salicylic acid, response to wounding"
"Chir08Ox-b08540.2",0,1.06455677298386,0.449,0.054,0,"AT4G09890",NA,NA,"T5L19.20","defense response to bacterium, molecular_function, nucleus, plant-type cell wall organization or biogenesis, response to auxin, response to organic cyclic compound"
"Chir05Ox-b22400.2",0,1.14214866522386,0.607,0.055,0,"AT3G56810",NA,NA,"T8M16.140","cell wall organization or biogenesis, meristem maintenance, mitochondrion, molecular_function, regionalization"
"Chir07Ox-b25260.2",6.39900091040527e-52,0.724552679805483,0.154,0.055,1.25804357898568e-47,"AT4G28085",NA,NA,NA,"aging, cellular response to oxygen-containing compound, defense response to other organism, hormone-mediated signaling pathway, indole-containing compound metabolic process, membrane, mitochondrion, molecular_function, monocarboxylic acid metabolic process, regulation of defense response, response to abscisic acid, response to chitin, response to jasmonic acid, response to organic cyclic compound, response to water deprivation, response to wounding, secondary metabolic process"
"Chir02Ox-b20860.2",3.02678138043215e-62,0.358433825576091,0.169,0.056,5.9506521939296e-58,"AT1G74020",NA,NA,"SS2","biosynthetic process, cellular response to potassium ion starvation, chloroplast, Golgi apparatus, mitochondrion, plant-type vacuole, plasma membrane, plasmodesma, response to jasmonic acid, response to wounding"
"Chir03Ox-b14200.2",2.98483988770886e-189,0.554344437252002,0.253,0.056,5.86819521923562e-185,"AT3G14570",NA,NA,"ATGSL04","(1->3)-beta-D-glucan biosynthetic process, 1,3-beta-D-glucan synthase activity, 1,3-beta-D-glucan synthase complex, glucosyltransferase activity, glycosyltransferase activity, plasma membrane"
"Chir04Ox-b27110.2",2.27393448170725e-96,0.887422591137625,0.192,0.056,4.47055519103645e-92,"AT2G44300",NA,NA,"LTPG14","cytosol, leaf senescence, lipid binding, lipid transport, membrane, response to herbivore, response to insect"
"Chir05Ox-b27800.2",0,1.63843198144594,0.507,0.056,0,"AT3G62100",NA,NA,"AT3G62100.1","DNA-binding transcription factor activity, gravitropism, nucleus, protein binding, regulation of DNA-templated transcription, response to auxin, root development, somatic embryogenesis, transcription cis-regulatory region binding"
"Chir08Ox-b02880.2",0,0.340796143203346,0.37,0.057,0,"AT4G02710",NA,NA,"AT4G02710.1","actin filament binding, cellular response to hormone stimulus, cytoplasm, epigenetic regulation of gene expression, plasma membrane, response to light stimulus"
"Chir01Ox-b05830.2",7.27507814893963e-149,0.352487195240685,0.238,0.058,1.43028036408153e-144,"AT1G06475",NA,NA,NA,"cellular_component, cytokinesis, molecular_function, response to chitin, tetrapyrrole metabolic process"
"Chir03Ox-b14600.2",0,1.41713697798965,0.342,0.058,0,"AT3G14990",NA,NA,"DJ1A","chloroplast, cytoplasm, cytosol, glyoxal metabolic process, glyoxalase III activity, nucleus, plant-type vacuole, plasma membrane, plasmodesma, positive regulation of cellular response to oxidative stress, protein binding"
"Chir07Ox-b01780.2",1.54539907282875e-86,0.280869689630819,0.194,0.058,3.03825457718133e-82,"AT5G40690",NA,NA,"AT5G40690.1","cell differentiation, cytoplasm, defense response to bacterium, defense response to fungus, developmental growth, immune system process, nucleus, phyllome development, pigment metabolic process, plant epidermis development, porphyrin-containing compound metabolic process, response to alcohol, response to inorganic substance, response to organonitrogen compound, response to salicylic acid, root morphogenesis, secondary metabolic process, signal transduction"
"Chir03Ox-b30730.2",0,1.10313952909585,0.572,0.059,0,"AT2G16700",NA,NA,"ADF5","actin cytoskeleton, actin filament binding, actin filament bundle assembly, actin filament depolymerization, cytoplasm, cytosol, pollen germination, pollen tube growth"
"Chir08Ox-b06940.2",0,2.01188308518385,0.621,0.059,0,NA,NA,NA,NA,NA
"Chir02Ox-b15670.2",9.89424636625989e-112,0.260249047729808,0.217,0.06,1.94520883560669e-107,"AT1G69260",NA,NA,"AFP1","abscisic acid-activated signaling pathway, negative regulation of DNA-templated transcription, nucleus, response to abscisic acid"
"Chir03Ox-b31670.2",2.99743417518774e-137,0.66998654152162,0.238,0.06,5.89295558841911e-133,"AT4G04830",NA,NA,"ATMSRB5","chloroplast, cytosol, glucosinolate metabolic process, peptide-methionine (R)-S-oxide reductase activity, response to jasmonic acid, response to wounding"
"Chir06Ox-b07540.2",2.40399768722544e-128,0.281815451380084,0.227,0.06,4.72625945308521e-124,"AT5G42720",NA,NA,"AT5G42720.1","carbohydrate metabolic process, extracellular region, glucan endo-1,3-beta-D-glucosidase activity, membrane"
"Chir05Ox-b02870.2",1.65684610796994e-31,0.276348442510711,0.145,0.063,3.25735944826891e-27,"AT3G25597",NA,NA,NA,"carboxylic acid metabolic process, cell differentiation, cellular_component, defense response to bacterium, developmental growth, immune system process, molecular_function, response to fungus, response to organonitrogen compound"
"Chir05Ox-b18880.2",0,0.467849432043717,0.391,0.063,0,"AT3G53350",NA,NA,"RIP4","cortical microtubule organization, extracellular region, microtubule, nucleus, plant-type cell wall organization, protein binding"
"Chir08Ox-b28560.2",5.86108787781115e-220,1.15802046397907,0.292,0.063,1.15228987677767e-215,"AT5G65870",NA,NA,"ATPSK5","alpha-amino acid metabolic process, aromatic amino acid metabolic process, cell development, cell differentiation, cell growth, cell morphogenesis, cell population proliferation, cellular biogenic amine metabolic process, cellular response to oxygen-containing compound, defense response to fungus, developmental growth, extracellular matrix, extracellular region, gametophyte development, indole-containing compound metabolic process, plant organ morphogenesis, response to jasmonic acid, response to light stimulus, response to wounding"
"Chir01Ox-b15800.2",0,0.484646384587396,0.388,0.064,0,"AT1G15760",NA,NA,"F7H2.10","chloroplast, cytokinesis, meiotic cell cycle, molecular_function, organelle organization, response to light stimulus, seed development, tissue development"
"Chir07Ox-b35940.2",4.59400541603992e-61,0.69312362856676,0.18,0.064,9.03181464793448e-57,"AT4G39780","Yes","ERF","ERF60","defense response, DNA binding, DNA-binding transcription factor activity, nucleus, protein binding, regulation of DNA-templated transcription, response to light stimulus, sequence-specific DNA binding, transcription cis-regulatory region binding"
"Chir06Ox-b37830.2",4.35905819420217e-134,0.297593492584721,0.24,0.065,8.56990840980146e-130,"AT5G01890",NA,NA,"PXC2","cell differentiation, cell division, cytokinesis, kinase activity, meiotic cell cycle process, phloem development, plant organ morphogenesis, plasma membrane, positive regulation of cellular process, protein binding, protein kinase activity, protein phosphorylation, regionalization, regulation of biological quality"
"Chir07Ox-b21070.2",0,1.14794356329312,0.76,0.065,0,"AT4G24060","Yes","Dof","Dof4.6","DNA-binding transcription factor activity, nucleus, regulation of DNA-templated transcription"
"Chir07Ox-b25110.2",3.11024939546631e-95,0.292600777277033,0.214,0.065,6.11475031148676e-91,"AT4G27950","Yes","ERF","AT4G27950.1","DNA-binding transcription factor activity, leaf development, nucleus, protein binding, regulation of DNA-templated transcription"
"Chir02Ox-b18790.2",0,1.24461911272541,0.631,0.066,0,"AT1G72150",NA,NA,"AT1G72150.1","apoplast, Golgi apparatus, mitochondrion, nucleus, plasma membrane, plasmodesma, pollen tube growth, protease binding, salicylic acid binding, vacuole"
"Chir05Ox-b22660.2",4.43317642666664e-142,0.298143362611294,0.248,0.066,8.71562485482662e-138,"AT3G57040",NA,NA,"ARR9","circadian rhythm, cytokinin-activated signaling pathway, cytoplasm, nucleus, phosphorelay response regulator activity, phosphorelay signal transduction system, protein binding, regulation of DNA-templated transcription, response to cytokinin"
"Chir08Ox-b05540.2",0,1.45494396812773,0.618,0.066,0,"AT4G12390",NA,NA,"PME1","enzyme inhibitor activity, extracellular region, negative regulation of catalytic activity, plasmodesma"
"Chir07Ox-b27780.2",0,0.607250054781626,0.467,0.067,0,"AT4G30520",NA,NA,"SARK","anther development, coreceptor activity, extracellular region, homeostasis of number of meristem cells, identical protein binding, leaf senescence, plasma membrane, protein binding, protein phosphorylation, protein serine/threonine kinase activity, protein tyrosine kinase activity, transmembrane receptor protein tyrosine kinase activity"
"Chir08Ox-b13980.2",6.22897702407473e-21,0.259548759341154,0.134,0.067,1.22461688293309e-16,"AT5G52310",NA,NA,"COR78","circadian rhythm, cytoplasm, cytosol, hyperosmotic salinity response, leaf senescence, molecular_function, nucleus, plastid, regulation of root development, response to abscisic acid, response to cold, response to desiccation, response to mannitol, response to osmotic stress, response to reactive oxygen species, response to salt, response to salt stress, response to stress, response to symbiotic bacterium, response to water deprivation, response to wounding"
"Chir02Ox-b13140.2",5.94018160671484e-96,0.264921772388505,0.223,0.069,1.16783970388014e-91,"AT1G67050",NA,NA,"F1O19.11","cellular_component, developmental growth, molecular_function, response to auxin"
"Chir02Ox-b17320.2",2.18636531296751e-259,0.404826289038774,0.331,0.069,4.29839420529413e-255,"AT1G70750",NA,NA,"AT1G70750.1","cell growth, cytoplasm, defense response to other organism, growth, myosin binding, myosin XI tail binding, small molecule metabolic process, transport vesicle"
"Chir03Ox-b24290.2",3.1634497036388e-131,0.39381648265741,0.253,0.069,6.21934211735388e-127,"AT3G24130",NA,NA,"AT3G24130.1","carboxylic ester hydrolase activity, cell wall modification, extracellular region, pectin catabolic process, pectinesterase activity"
"Chir05Ox-b06930.2",3.98110924680923e-218,0.4366019796494,0.307,0.069,7.82686077922695e-214,"AT3G28950",NA,NA,"K5K13.15","biological_process, cellular_component, molecular_function"
"Chir02Ox-b03080.2",4.52562410994601e-165,1.39088585419964,0.274,0.07,8.89737700015386e-161,"AT1G62380",NA,NA,"ATACO2","1-aminocyclopropane-1-carboxylate oxidase activity, cellular response to fatty acid, cellular response to nitric oxide, copper ion binding, cytoplasm, cytosol, detection of ethylene stimulus, dioxygenase activity, endoplasmic reticulum, ethylene biosynthetic process, Golgi apparatus, nucleus, plant-type cell wall, plasma membrane, plasmodesma, positive regulation of seed germination"
"Chir04Ox-b23830.2",8.15763172667696e-135,0.254439128581915,0.255,0.07,1.60379039746469e-130,"AT2G41070","Yes","bZIP","EEL","abscisic acid-activated signaling pathway, DNA binding, DNA-binding transcription activator activity, DNA-binding transcription factor activity, nucleus, positive regulation of DNA-templated transcription, protein binding, regulation of abscisic acid biosynthetic process, response to water deprivation, sequence-specific DNA binding, stomatal closure, transcription cis-regulatory region binding"
"Chir06Ox-b36550.2",1.69146316226879e-269,0.403802348744665,0.333,0.07,3.32541657702044e-265,"AT5G02440",NA,NA,"T22P11.30","anatomical structure arrangement, meristem development, mitochondrion, molecular_function, secondary metabolic process, shoot system development"
"Chir07Ox-b09460.2",9.60968726614486e-46,0.303925255753918,0.176,0.07,1.88926451652408e-41,NA,NA,NA,NA,NA
"Chir05Ox-b27770.2",7.21855597752321e-149,0.292794959545563,0.277,0.073,1.41916810518106e-144,"AT3G62070",NA,NA,"T17J13.30","cellular_component, defense response to other organism, meristem initiation, molecular_function, response to jasmonic acid, response to red or far red light"
"Chir08Ox-b22680.2",0,0.93194866028598,0.538,0.073,0,"AT5G60200","Yes","Dof","DOF5.3","DNA-binding transcription factor activity, nucleus, phloem or xylem histogenesis, regulation of DNA-templated transcription, root development, root radial pattern formation, transcription cis-regulatory region binding"
"Chir04Ox-b20710.2",6.11219011578777e-188,0.555419677270084,0.298,0.074,1.20165657676388e-183,"AT2G38250","Yes","Trihelix","AT2G38250.1","DNA-binding transcription factor activity, mediator complex, nucleolus, nucleus, protein binding, regulation of DNA-templated transcription, sequence-specific DNA binding"
"Chir04Ox-b23600.2",0,0.384887826129526,0.379,0.074,0,"AT2G40820",NA,NA,"T20B5.2","actin binding, actin filament organization, ethylene-activated signaling pathway, mitochondrion, negative regulation of signal transduction, nucleus, regulation of stomatal movement, root development"
"Chir02Ox-b08990.2",1.7035416283109e-291,0.417400561556972,0.36,0.075,3.34916284125923e-287,"AT1G56210",NA,NA,"AtHMP10","carbohydrate derivative metabolic process, molecular_function, nucleus, shoot system development"
"Chir05Ox-b27260.2",0,1.16943303186935,0.65,0.075,0,NA,NA,NA,NA,NA
"Chir07Ox-b02980.2",1.33913595942315e-215,0.534545480951292,0.317,0.075,2.63274129622592e-211,"AT5G39785",NA,NA,"AT5G39780","cellular response to oxygen-containing compound, defense response to bacterium, defense response to fungus, hormone-mediated signaling pathway, immune system process, molecular_function, negative regulation of cellular biosynthetic process, negative regulation of macromolecule biosynthetic process, nucleus, regulation of defense response, response to lipid, response to organonitrogen compound, response to osmotic stress, response to salicylic acid, response to water deprivation"
"Chir07Ox-b11440.2",8.46225320328262e-68,0.894595468964129,0.206,0.075,1.66367897976536e-63,"AT4G15120",NA,NA,"DL3605W","carboxylic acid metabolic process, defense response to bacterium, molecular_function, nucleus, organic acid biosynthetic process, response to abscisic acid, secondary metabolic process"
"Chir03Ox-b28360.2",1.03984672175722e-202,0.292847758723983,0.315,0.076,2.04433865497469e-198,"AT2G12400",NA,NA,"F24C20.8","carbohydrate derivative metabolic process, cell division, cell growth, cell morphogenesis, cell wall organization or biogenesis, cellular lipid metabolic process, cellular response to organic substance, cellular response to oxygen-containing compound, defense response to other organism, developmental growth, developmental growth involved in morphogenesis, extracellular region, immune system process, molecular_function, negative regulation of cellular process, oxoacid metabolic process, plasmodesma, response to abscisic acid, response to bacterium, response to organonitrogen compound, response to salt stress, response to temperature stimulus, response to water deprivation, signal transduction, sulfur compound metabolic process"
"Chir06Ox-b04670.2",4.41611934109264e-81,0.293700613109411,0.219,0.076,8.68209062458813e-77,"AT5G44350",NA,NA,"K9L2.14","chloroplast, defense response to other organism, hormone-mediated signaling pathway, molecular_function, organic acid metabolic process, regulation of defense response, response to abscisic acid, response to chitin, response to inorganic substance, response to jasmonic acid, response to organic cyclic compound, response to wounding"
"Chir06Ox-b33460.2",1.1092002175186e-105,0.314677999949051,0.241,0.076,2.18068762764157e-101,"AT5G05530",NA,NA,"AT5G05530.1","nucleus, ubiquitin protein ligase activity, ubiquitin-dependent protein catabolic process"
"Chir07Ox-b14870.2",8.81740691582222e-117,0.322935668382914,0.256,0.076,1.73350219965065e-112,"AT4G18010",NA,NA,"IP5PII","cytoplasm, inositol phosphate dephosphorylation, inositol trisphosphate metabolic process, inositol-1,3,4,5-tetrakisphosphate 5-phosphatase activity, inositol-1,4,5-trisphosphate 5-phosphatase activity, inositol-polyphosphate 5-phosphatase activity, phosphatidylinositol dephosphorylation, phosphatidylinositol-3,4,5-trisphosphate 5-phosphatase activity, phosphatidylinositol-4,5-bisphosphate 5-phosphatase activity, protein binding, response to abscisic acid, seed germination, seedling development"
"Chir01Ox-b08970.2",2.66110018079638e-91,0.267149145270126,0.232,0.077,5.23172295544569e-87,"AT1G09390",NA,NA,"AT1G09390.1","carbohydrate metabolic process, cell wall macromolecule metabolic process, chloroplast stroma, extracellular region, hydrolase activity, acting on ester bonds, lipid metabolic process, organic hydroxy compound metabolic process, response to light intensity"
"Chir01Ox-b41350.2",2.27156796482397e-66,0.365695185338587,0.208,0.077,4.46590261884392e-62,"AT1G52565",NA,NA,NA,"aging, cellular response to blue light, chloroplast, defense response to bacterium, defense response to fungus, glycosyl compound metabolic process, immune system process, meristem development, molecular_function, response to auxin, response to oxidative stress, response to salicylic acid, response to salt stress, response to water, signal transduction"
