"gene_ID","p_val","avg_log2FC","pct.1","pct.2","p_val_adj","AT_ID","TF","TF_family","Gene_code_name","Gene_functions"
"Chir06Ox-b24500.2",1.60478039879948e-59,0.256579436954181,0.995,0.934,2.86966830913324e-55,"AT5G14910",NA,NA,"AT5G14910.1","chloroplast, chloroplast envelope, chloroplast stroma, chloroplast thylakoid membrane, embryo development ending in seed dormancy, metal ion binding, plastid, porphyrin-containing compound metabolic process, response to radiation, tetrapyrrole biosynthetic process, thylakoid"
"Chir03Ox-b22860.2",1.71121741909376e-190,0.380362593280678,0.995,0.936,3.05999898882346e-186,"AT3G43520",NA,NA,"T18D12.90","chloroplast, chloroplast envelope, cytosol, membrane, molecular_function, negative regulation of gene expression, negative regulation of metabolic process, plastid, response to inorganic substance"
"Chir04Ox-b13280.2",1.94188459071785e-126,0.328958328621161,0.992,0.936,3.47247802512166e-122,"AT2G31410",NA,NA,"T28P16.10","biological_process, molecular_function, nucleolus, nucleus"
"Chir07Ox-b24610.2",6.24086340093659e-97,0.402499543763988,0.994,0.937,1.11599119335548e-92,"AT4G27440",NA,NA,"AT4G27440.1","chlorophyll biosynthetic process, chloroplast, chloroplast envelope, chloroplast thylakoid, chloroplast thylakoid membrane, cytosol, mRNA binding, protein binding, protochlorophyllide reductase activity, response to ethylene"
"Chir08Ox-b29050.2",2.11563244201864e-249,0.508278148881276,0.993,0.937,3.78317393281773e-245,"AT5G67260",NA,NA,"CYCD3;2","cyclin-dependent protein kinase holoenzyme complex, cyclin-dependent protein serine/threonine kinase regulator activity, cytoplasm, guard mother cell differentiation, mitotic cell cycle phase transition, nucleus, protein binding, regulation of cell population proliferation, regulation of cyclin-dependent protein serine/threonine kinase activity, regulation of leaf morphogenesis, seed development"
"Chir06Ox-b18120.2",0,1.15496838483034,0.995,0.938,0,"AT5G20950",NA,NA,"AT5G20950.1","apoplast, beta-glucosidase activity, extracellular region, glucan catabolic process, mitochondrion, plant-type cell wall, plasmodesma, plastid, xyloglucan biosynthetic process"
"Chir07Ox-b15420.2",1.24928520855277e-143,0.407570257169827,0.997,0.938,2.23397180993407e-139,"AT4G18480",NA,NA,"CH42","ATP hydrolysis activity, chlorophyll biosynthetic process, chloroplast, chloroplast stroma, cytosol, magnesium chelatase activity, magnesium chelatase complex, plant-type cell wall"
"Chir01Ox-b27040.2",0,0.942566157367705,1,0.941,0,NA,NA,NA,NA,NA
"Chir01Ox-b37210.2",2.9681877285022e-215,0.405862439714818,0.997,0.944,5.30771329610764e-211,"AT1G48610",NA,NA,"T1N15.24","DNA binding, meristem development, nucleus"
"Chir08Ox-b28090.2",8.37206116036507e-93,0.287471225744934,0.996,0.946,1.49709197669648e-88,"AT5G65410","Yes","ZF-HD","ATHB25","DNA-binding transcription factor activity, nucleus, protein binding, protein homodimerization activity, regulation of DNA-templated transcription, regulation of gibberellin biosynthetic process, seed maturation, transcription cis-regulatory region binding"
"Chir02Ox-b13330.2",0,0.704188491095968,0.996,0.947,0,"AT1G67230",NA,NA,"CRWN1","chromatin, extracellular region, mitochondrion, nuclear envelope, nuclear lamina, nuclear periphery, nucleoplasm, nucleus, nucleus organization, protein binding, regulation of nucleus size"
"Chir06Ox-b19090.2",3.75223743370106e-157,0.484408556750715,0.992,0.947,6.70975097894423e-153,"AT5G19940",NA,NA,"PAP8","cellular catabolic process, chlorophyll biosynthetic process, chloroplast, chloroplast envelope, chloroplast thylakoid, organic substance catabolic process, plastid, plastoglobule, response to low light intensity stimulus, thylakoid"
"Chir07Ox-b07830.2",1.03871523298716e-148,0.32579142422817,0.994,0.947,1.85743057962764e-144,"AT5G35620",NA,NA,"LSP1","cytoplasm, eukaryotic translation initiation factor 4F complex, mRNA cap binding complex, negative regulation of defense response to virus, nucleus, plastid, protein binding, response to virus, RNA 7-methylguanosine cap binding, translation initiation factor activity, translational initiation"
"Chir08Ox-b04130.2",1.06651745675213e-89,0.349567583802355,0.997,0.947,1.90714651616415e-85,"AT4G05180",NA,NA,"PSBQ","apoplast, calcium ion binding, chloroplast, chloroplast stroma, chloroplast thylakoid, chloroplast thylakoid lumen, chloroplast thylakoid membrane, cytosol, electron transporter, transferring electrons within the cyclic electron transport pathway of photosynthesis activity, extrinsic component of membrane, photosynthetic electron transport chain, photosystem II oxygen evolving complex, thylakoid, thylakoid lumen"
"Chir02Ox-b20690.2",7.01005461113252e-114,0.325224091637712,0.996,0.948,1.25353796556272e-109,"AT1G73885",NA,NA,NA,"biological_process, chloroplast, chloroplast thylakoid membrane, molecular_function"
"Chir04Ox-b22670.2",4.18736799032514e-106,0.258859412831525,0.992,0.949,7.48785144029941e-102,"AT2G40060",NA,NA,"CLC2","cell plate, chloroplast envelope, clathrin coat of coated pit, clathrin coat of trans-Golgi network vesicle, clathrin heavy chain binding, clathrin vesicle coat, clathrin-dependent endocytosis, cytoplasm, Golgi apparatus, identical protein binding, intracellular protein transport, plasma membrane, protein binding, structural molecule activity"
"Chir05Ox-b19690.2",1.91683209085525e-107,0.380915048604252,0.995,0.949,3.42767914486737e-103,"AT3G54210",NA,NA,"PRPL17","cellular lipid metabolic process, chloroplast, chloroplast envelope, chloroplast stroma, cytosol, cytosolic large ribosomal subunit, large ribosomal subunit, lipid biosynthetic process, porphyrin-containing compound biosynthetic process, protein-containing complex assembly, structural constituent of ribosome, translation"
"Chir06Ox-b13390.2",4.87212158130844e-128,0.356132475683511,0.996,0.949,8.71232781169575e-124,"AT5G26742",NA,NA,"emb1138","chloroplast, chloroplast envelope, chloroplast organization, chloroplast stroma, cytoplasm, embryo development ending in seed dormancy, Group II intron splicing, mRNA binding, nucleus, plastid, response to salt stress, ribosome biogenesis, RNA binding, RNA helicase activity, rRNA processing, zinc ion binding"
"Chir07Ox-b26280.2",7.20381533111766e-95,0.355572064684149,0.995,0.95,1.28818625751046e-90,"AT4G29060",NA,NA,"emb2726","chloroplast, chloroplast envelope, chloroplast ribosome, chloroplast stroma, embryo development ending in seed dormancy, mRNA binding, plasma membrane, polysome binding, translation elongation factor activity, translation elongation factor binding, translational elongation"
"Chir04Ox-b15540.2",2.40130135968345e-117,0.397703822444263,0.997,0.951,4.29400709138595e-113,"AT2G33450",NA,NA,"PRPL28","carboxylic acid biosynthetic process, cellular lipid metabolic process, chloroplast, chloroplast envelope, chloroplast stroma, endoplasmic reticulum, mitochondrial large ribosomal subunit, mRNA binding, structural constituent of ribosome, translation"
"Chir06Ox-b25960.2",4.00819134237391e-96,0.330125950851222,0.999,0.951,7.16744775843303e-92,"AT5G13510",NA,NA,"EMB3136","chloroplast, chloroplast envelope, chloroplast stroma, cytosolic ribosome, large ribosomal subunit, plastid, structural constituent of ribosome, translation"
"Chir07Ox-b07620.2",2.73729896720397e-87,0.335480391298733,0.999,0.951,4.89483801315413e-83,NA,NA,NA,NA,NA
"Chir01Ox-b16980.2",3.26127050178315e-120,0.268757304874589,0.993,0.953,5.83180391128862e-116,"AT1G16920",NA,NA,"RAB11","endomembrane system, GTP binding, GTPase activity, hyperosmotic salinity response, intracellular protein transport, nucleus, plant-type vacuole, plasma membrane, regulation of vesicle-mediated transport, trans-Golgi network, vacuole"
"Chir01Ox-b01650.2",4.2707159184485e-88,0.256676385359605,0.996,0.954,7.63689420536961e-84,"AT1G02560",NA,NA,"CLPP5","ATP-dependent peptidase activity, ATPase binding, chloroplast, chloroplast envelope, chloroplast stroma, chloroplast thylakoid, chloroplastic endopeptidase Clp complex, embryo development ending in seed dormancy, endopeptidase Clp complex, extracellular region, organic substance catabolic process, phyllome development, plastid stroma, porphyrin-containing compound metabolic process, protein quality control for misfolded or incompletely synthesized proteins, protein-containing complex assembly, serine-type endopeptidase activity, thylakoid"
"Chir02Ox-b00360.2",1.45687640597567e-140,0.432233289803173,0.998,0.954,2.60518638916569e-136,"AT1G64510",NA,NA,"PRPS6","chloroplast, chloroplast thylakoid membrane, mRNA binding, nucleus, rRNA binding, small ribosomal subunit rRNA binding, structural constituent of ribosome, thylakoid, translation"
"Chir03Ox-b34790.2",7.19623683185357e-119,0.421411607202176,0.998,0.954,1.28683107027206e-114,NA,NA,NA,NA,NA
"Chir03Ox-b30430.2",1.81908521007745e-122,0.302802931878438,0.993,0.956,3.2528881726605e-118,NA,NA,NA,NA,NA
"Chir05Ox-b03240.2",6.26581778530961e-66,0.283533321766672,0.998,0.957,1.12045353636907e-61,"AT3G25920",NA,NA,"RPL15","chloroplast, chloroplast envelope, chloroplast stroma, cytosol, cytosolic large ribosomal subunit, mRNA binding, plastid large ribosomal subunit, structural constituent of ribosome, translation"
"Chir02Ox-b22310.2",4.02110595632101e-125,0.407290212052004,0.998,0.958,7.19054167109323e-121,"AT1G75350",NA,NA,"emb2184","chloroplast, chloroplast envelope, chloroplast stroma, embryo development ending in seed dormancy, mitochondrion, structural constituent of ribosome, translation"
"Chir05Ox-b17580.2",2.87140008182225e-92,0.33004838786902,0.998,0.958,5.13463762631455e-88,"AT3G52150",NA,NA,"PSRP2","chloroplast, chloroplast envelope, chloroplast rRNA processing, chloroplast stroma, chloroplast thylakoid membrane, cytosol, mRNA binding, negative regulation of response to salt stress, negative regulation of response to water deprivation, regulation of seed germination, regulation of seedling development, response to cold, response to salt stress, response to water deprivation, RNA binding, single-stranded DNA binding, thylakoid"
"Chir06Ox-b04690.2",3.75947575274291e-113,0.275825923824053,0.994,0.958,6.72269454105488e-109,"AT5G44340",NA,NA,"TUB4","chloroplast stroma, cytoplasm, cytosol, Golgi apparatus, GTP binding, GTPase activity, microtubule, microtubule cytoskeleton organization, mitotic cell cycle, mRNA binding, plant-type cell wall, plasma membrane, plasmodesma, plastid, protein binding, structural constituent of cytoskeleton, tubulin complex"
"Chir06Ox-b25620.2",3.61115443681797e-129,0.295384351952679,0.996,0.959,6.45746636391789e-125,NA,NA,NA,NA,NA
"Chir05Ox-b16170.2",2.05521207035816e-48,0.255613346665294,0.989,0.961,3.67513022421447e-44,"AT3G50820",NA,NA,"PSBO-2","chloroplast, chloroplast stroma, chloroplast thylakoid, chloroplast thylakoid lumen, chloroplast thylakoid membrane, cytosol, mRNA binding, oxygen evolving activity, photoinhibition, photosynthesis, light reaction, photosystem II assembly, photosystem II oxygen evolving complex, photosystem II stabilization, plastoglobule, poly(U) RNA binding, protein binding, regulation of protein dephosphorylation, thylakoid, thylakoid lumen"
"Chir06Ox-b00740.2",4.89331298088259e-271,0.539080611422671,0.999,0.961,8.75022227241424e-267,"AT5G47110",NA,NA,"AT5G47110.1","chloroplast, chloroplast thylakoid membrane, enzyme binding, identical protein binding, plastid, positive regulation of chlorophyll biosynthetic process, positive regulation of phytol biosynthetic process, positive regulation of vitamin E biosynthetic process, protein binding, protein-membrane adaptor activity, thylakoid light-harvesting complex, thylakoid membrane"
"Chir01Ox-b41070.2",4.98311220357921e-128,0.462892001374263,0.998,0.962,8.91080124244035e-124,"AT1G52230",NA,NA,"PSAH2","chloroplast, chloroplast thylakoid, chloroplast thylakoid membrane, molecular_function, nucleus, photosystem I reaction center, porphyrin-containing compound metabolic process, response to light stimulus, thylakoid"
"Chir04Ox-b15980.2",4.95307865285732e-137,0.412476320089139,1,0.962,8.85709524703946e-133,"AT2G33800",NA,NA,"SCA1","adaxial/abaxial pattern specification, chloroplast, chloroplast rRNA processing, chloroplast stroma, chloroplast thylakoid, chloroplast thylakoid membrane, endoplasmic reticulum, mitochondrial small ribosomal subunit, mRNA binding, nucleus, plastid translation, response to cold, structural constituent of ribosome, thylakoid, translation"
"Chir08Ox-b25210.2",4.02411575898742e-129,0.566231991878013,0.98,0.962,7.19592380022131e-125,"AT5G62690",NA,NA,"TUB2","cytoplasm, Golgi apparatus, GTP binding, GTPase activity, microtubule, microtubule cytoskeleton organization, mitotic cell cycle, mRNA binding, nucleolus, plant-type cell wall, plasma membrane, plasmodesma, protein binding, structural constituent of cytoskeleton, tubulin complex"
"Chir01Ox-b43890.2",1.18119884462679e-100,0.362720948699689,0.999,0.964,2.11221977396162e-96,"AT1G55490",NA,NA,"CPN60B","apoplast, cell death, chaperone cofactor-dependent protein refolding, chloroplast, chloroplast envelope, chloroplast stroma, cytosolic ribosome, mRNA binding, nucleus, protein binding, protein folding, protein refolding, response to cold, stromule, systemic acquired resistance"
"Chir07Ox-b17180.2",7.80509768471629e-150,0.433839401777329,1,0.964,1.39570756798097e-145,"AT4G20360",NA,NA,"ATRAB8D","apoplast, chloroplast, chloroplast envelope, chloroplast nucleoid, chloroplast organization, chloroplast stroma, chloroplast thylakoid, chloroplast thylakoid membrane, GTPase activity, leaf development, mitochondrial translational elongation, mitochondrion, mRNA binding, nucleolus, nucleus, plastid, protein binding, translation elongation factor activity, translational elongation"
"Chir01Ox-b28900.2",1.11037058082389e-112,0.42333640683695,0.995,0.965,1.98556467262928e-108,"AT1G30380",NA,NA,"AT1G30380.1","chlorophyll metabolic process, chloroplast, chloroplast thylakoid, chloroplast thylakoid membrane, negative regulation of cellular metabolic process, nucleus, response to light stimulus, thylakoid"
"Chir02Ox-b25690.2",2.61099760027724e-83,0.332320072866259,0.998,0.967,4.66898590881577e-79,"AT1G78630",NA,NA,"emb1473","chloroplast, chloroplast envelope, chloroplast stroma, cytosolic large ribosomal subunit, embryo development ending in seed dormancy, mitochondrion, mRNA binding, negative regulation of translation, ribosome, structural constituent of ribosome, thylakoid, translation"
"Chir08Ox-b00990.2",1.75172907403423e-111,0.347535509470752,0.999,0.967,3.13244193018801e-107,"AT4G01310",NA,NA,"PRPL5","chloroplast, chloroplast envelope, chloroplast stroma, cytosol, cytosolic ribosome, mRNA binding, organelle organization, RNA binding, structural constituent of ribosome, translation"
"Chir01Ox-b36930.2",3.78457288009464e-110,0.399699189393641,0.999,0.968,6.76757322418523e-106,"AT1G48350",NA,NA,"EMB3105","5S rRNA binding, carboxylic acid biosynthetic process, chloroplast, chloroplast envelope, chloroplast stroma, nucleus, response to light stimulus, structural constituent of ribosome, translation"
"Chir07Ox-b14380.2",2.98406992964757e-60,0.262398265747238,0.996,0.968,5.33611384819578e-56,"AT4G17560",NA,NA,"DL4815W","chloroplast, chloroplast envelope, chloroplast stroma, cytosol, mRNA binding, porphyrin-containing compound metabolic process, response to light stimulus, seed development, structural constituent of ribosome, translation"
"Chir03Ox-b12360.2",1.93788784020311e-106,0.351667234900439,0.998,0.969,3.46533103585121e-102,"AT3G13120",NA,NA,"PRPS10","chloroplast, chloroplast stroma, cytosol, mitochondrion, mRNA binding, porphyrin-containing compound biosynthetic process, protein-containing complex assembly, response to light stimulus, seed development, small ribosomal subunit, structural constituent of ribosome, translation"
"Chir05Ox-b18450.2",0,0.862947503422409,0.997,0.97,0,"AT3G52920",NA,NA,"AT3G52920.1","cytosol, nucleus, response to light stimulus"
"Chir08Ox-b16560.2",6.77529411354574e-109,0.373182723282544,0.999,0.97,1.21155809338425e-104,"AT5G54600",NA,NA,"RPL24","chloroplast, chloroplast envelope, chloroplast stroma, mitochondrion, mRNA binding, plastid, plastid translation, ribosome, RNA binding, structural constituent of ribosome, translation"
"Chir04Ox-b20270.2",8.89238210804904e-150,0.433867919434127,0.999,0.971,1.59013576856133e-145,"AT2G37220",NA,NA,"CP29B","chloroplast, chloroplast envelope, chloroplast rRNA processing, chloroplast stroma, chloroplast thylakoid, chloroplast thylakoid membrane, endoplasmic reticulum, innate immune response, mRNA binding, poly(U) RNA binding, response to abscisic acid, response to cold, stromule, thylakoid"
"Chir05Ox-b04550.2",9.08593066692239e-193,0.519097453081959,0.999,0.971,1.62474612185906e-188,"AT3G27160",NA,NA,"GHS1","cellular ketone metabolic process, chlorophyll biosynthetic process, chloroplast, chloroplast stroma, chloroplast thylakoid, cytosol, mRNA binding, seed development, small molecule biosynthetic process, structural constituent of ribosome, translation"
"Chir05Ox-b22500.2",7.64267566581856e-151,0.454929060262907,0.999,0.971,1.36666326256167e-146,"AT3G56910",NA,NA,"AT3G56910.1","chloroplast, chloroplast envelope, chloroplast thylakoid membrane, cytosol, plastid translation, protein binding, thylakoid"
"Chir01Ox-b06720.2",9.61813504628032e-109,0.355840905675249,0.999,0.973,1.71991490897585e-104,"AT1G07320",NA,NA,"RPL4","chloroplast, chloroplast stroma, chloroplast thylakoid membrane, cytosolic ribosome, extracellular region, mRNA binding, nucleus, plastid large ribosomal subunit, plastid ribosome, poly(U) RNA binding, structural constituent of ribosome, thylakoid, translation"
"Chir06Ox-b25090.2",2.41133150482707e-119,0.416347979560308,1,0.973,4.31194299693176e-115,"AT5G14320",NA,NA,"EMB3137","carboxylic acid biosynthetic process, chloroplast, chloroplast envelope, chloroplast stroma, mitochondrion, mRNA binding, response to light stimulus, RNA binding, small ribosomal subunit, structural constituent of ribosome, translation"
"Chir04Ox-b25760.2",2.12953251465617e-194,0.531132359123228,0.999,0.974,3.80803004270816e-190,"AT2G43030",NA,NA,"PRPL3","chloroplast, chloroplast envelope, chloroplast stroma, cytosol, mRNA binding, structural constituent of ribosome, translation"
"Chir05Ox-b18500.2",8.90773273301035e-157,0.409822821587983,0.999,0.974,1.59288076731691e-152,"AT3G52960",NA,NA,"PrxIIE","cell redox homeostasis, cellular response to oxidative stress, chloroplast, chloroplast envelope, chloroplast stroma, cytoplasm, cytosol, hydrogen peroxide catabolic process, plastid, thioredoxin peroxidase activity, thylakoid"
"Chir04Ox-b07110.2",3.57299478822944e-64,0.277503737938849,0.999,0.975,6.38922928031188e-60,"AT2G24090",NA,NA,"PRPL35","chlorophyll biosynthetic process, chloroplast, large ribosomal subunit, mRNA binding, organic acid biosynthetic process, protein binding, structural constituent of ribosome, translation"
"Chir08Ox-b03480.2",8.85506096389651e-58,0.591550916355223,0.995,0.975,1.58346200156397e-53,"AT4G03210",NA,NA,"XTH9","cell wall biogenesis, extracellular region, hydrolase activity, hydrolyzing O-glycosyl compounds, plant-type secondary cell wall biogenesis, polysaccharide binding, xylem development, xyloglucan metabolic process, xyloglucan:xyloglucosyl transferase activity"
"Chir03Ox-b05440.2",3.24120430551128e-94,0.252516264862637,0.998,0.976,5.79592153911527e-90,NA,NA,NA,NA,NA
"Chir05Ox-b29150.2",6.26663799710793e-74,0.301394018007169,0.999,0.976,1.12060020664284e-69,"AT3G63490",NA,NA,"EMB3126","chloroplast, chloroplast envelope, chloroplast stroma, chloroplast thylakoid membrane, cytosol, cytosolic large ribosomal subunit, maturation of LSU-rRNA, mRNA binding, nucleus, RNA binding, structural constituent of ribosome, translation"
"Chir08Ox-b20440.2",5.69405396868538e-167,0.449904159852622,0.999,0.977,1.01821073068032e-162,"AT5G58250",NA,NA,"LCAA/YCF54","chlorophyll biosynthetic process, chloroplast, magnesium-protoporphyrin IX monomethyl ester (oxidative) cyclase activity, plastid, protein binding, thylakoid"
"Chir05Ox-b02690.2",1.05854878231215e-114,0.324574898137381,0.999,0.978,1.89289693253058e-110,"AT2G04030",NA,NA,"CR88","ATP binding, ATP hydrolysis activity, chloroplast, chloroplast envelope, chloroplast stroma, de-etiolation, embryo development ending in seed dormancy, endoplasmic reticulum, mitochondrion, perinuclear region of cytoplasm, plant-type vacuole, plastid, protein binding, protein folding, protein homodimerization activity, protein import into chloroplast stroma, response to chlorate, response to heat, response to salt stress, response to water deprivation, unfolded protein binding"
"Chir05Ox-b05430.2",6.83486343707626e-80,0.308497591108043,0.999,0.979,1.22221027981798e-75,"AT3G27850",NA,NA,"RPL12-C","chloroplast, chloroplast stroma, chloroplast thylakoid membrane, cytosol, mRNA binding, plastid large ribosomal subunit, structural constituent of ribosome, thylakoid, translation"
"Chir07Ox-b01410.2",3.86434447304547e-178,0.489836709467081,0.999,0.979,6.91022078669991e-174,"AT5G40950",NA,NA,"RPL27","chlorophyll metabolic process, chloroplast, chloroplast envelope, chloroplast stroma, mRNA binding, pigment metabolic process, plastid, small molecule biosynthetic process, structural constituent of ribosome, thylakoid, translation"
"Chir02Ox-b21420.2",1.28257427424187e-249,0.558259308804677,1,0.98,2.29349931719932e-245,"AT1G74470",NA,NA,"AT1G74470.1","chlorophyll biosynthetic process, chloroplast, chloroplast envelope, chloroplast thylakoid, chloroplast thylakoid membrane, cytoplasm, geranylgeranyl diphosphate reductase activity, geranylgeranyl reductase activity, mitochondrion, protein binding, vitamin E biosynthetic process"
"Chir07Ox-b12320.2",0,0.971533110605416,1,0.98,0,"AT4G15802",NA,NA,"HSBP","cellular heat acclimation, cytosol, Golgi apparatus, heat shock protein binding, nucleus, protein binding, protein self-association, response to heat, seed development, transcription corepressor activity"
"Chir02Ox-b13970.2",4.86662006114598e-120,0.403677385096417,0.998,0.981,8.70248999334124e-116,"AT1G67740",NA,NA,"YCF32","cell redox homeostasis, chloroplast, chloroplast stromal thylakoid, chloroplast thylakoid, chloroplast thylakoid membrane, manganese ion binding, photoinhibition, photosynthesis, photosystem II"
"Chir03Ox-b14840.2",2.39248123481159e-139,0.424305357236262,0.999,0.981,4.27823494409009e-135,"AT3G15190",NA,NA,"PRPS20","cellular lipid metabolic process, chloroplast, chloroplast envelope, chloroplast stroma, cytosol, mRNA binding, response to light stimulus, small ribosomal subunit, small ribosomal subunit rRNA binding, structural constituent of ribosome, translation"
"Chir04Ox-b09410.2",8.58202426049485e-108,0.31905881422756,0.999,0.981,1.53463757826169e-103,"AT2G28000",NA,NA,"CPN60A","apoplast, chloroplast, chloroplast envelope, chloroplast organization, chloroplast stroma, cytosolic ribosome, embryo development ending in seed dormancy, mitochondrion, peroxisome, protein binding, protein folding, protein refolding, protein stabilization, stromule, thylakoid"
"Chir05Ox-b05310.2",1.89942799989805e-76,0.336171870711944,0.998,0.981,3.3965571494177e-72,"AT3G27690",NA,NA,"LHCB2.4","cellular response to abscisic acid stimulus, chlorophyll binding, chloroplast, chloroplast envelope, chloroplast thylakoid membrane, cytosol, mRNA binding, photosynthesis, light harvesting, photosynthesis, light harvesting in photosystem I, photosynthesis, light harvesting in photosystem II, photosystem I, photosystem II, positive regulation of reactive oxygen species biosynthetic process, PSII associated light-harvesting complex II, regulation of stomatal closure, response to cold, response to desiccation, response to far red light, response to high light intensity, response to light stimulus, response to low light intensity stimulus, response to red light, thylakoid, water homeostasis"
"Chir02Ox-b28130.2",5.21970968972422e-173,0.524190982627595,1,0.982,9.33388486716485e-169,"AT1G79850",NA,NA,"RPS17","chloroplast, chloroplast envelope, chloroplast stroma, chloroplast thylakoid, mitochondrion, mRNA binding, plastid small ribosomal subunit, plastid translation, structural constituent of ribosome, translation"
"Chir05Ox-b27730.2",1.95698512889454e-55,0.259778031233777,0.999,0.982,3.49948080748921e-51,"AT3G62030",NA,NA,"ROC4","apoplast, chloroplast, chloroplast envelope, chloroplast stroma, chloroplast thylakoid membrane, cyclosporin A binding, cysteine biosynthetic process, cytoplasm, cytosol, cytosolic ribosome, mRNA binding, peptidyl-prolyl cis-trans isomerase activity, protein binding, protein folding, response to abscisic acid, response to light intensity, response to mannitol, response to oxidative stress, response to salt stress, signal transduction, thylakoid, thylakoid lumen"
"ChirPtOx-b00100.2",6.53326840403023e-67,0.296165946469125,1,0.982,1.16827905600869e-62,"ATCG00170",NA,NA,"RPOC2","chloroplast, chloroplast nucleoid, chloroplast stroma, DNA-directed 5'-3' RNA polymerase activity, DNA-templated transcription elongation"
"Chir01Ox-b27570.2",3.67189597817624e-93,0.361349877617827,1,0.983,6.56608438817475e-89,"AT1G29070",NA,NA,"PRPL34","cellular lipid metabolic process, chloroplast, lipid biosynthetic process, mitochondrial large ribosomal subunit, organic acid biosynthetic process, porphyrin-containing compound metabolic process, structural constituent of ribosome, translation"
"Chir01Ox-b28660.2",9.55952923662731e-116,0.526119891785036,0.998,0.983,1.7094350180937e-111,NA,NA,NA,NA,NA
"Chir06Ox-b21430.2",1.78207070937709e-77,0.2940668833014,0.999,0.983,3.18669884250812e-73,"AT5G17870",NA,NA,"PSRP6","chloroplast, mRNA binding, plastid, protein-containing complex assembly, response to light stimulus, rRNA binding, structural constituent of ribosome, translation"
