"gene_ID","p_val","avg_log2FC","pct.1","pct.2","p_val_adj","AT_ID","TF","TF_family","Gene_code_name","Gene_functions"
"Chir02Ox-b00200.2",2.99571900633821e-43,0.530721798488164,0.635,0.159,5.88958356646092e-39,"AT1G64640",NA,NA,"ENODL8","cell wall biogenesis, electron transfer activity, growth, membrane, response to auxin, response to red light"
"Chir08Ox-b28950.2",7.4511756983671e-23,0.295816201134671,0.519,0.159,1.46490114229897e-18,"AT5G67350",NA,NA,"K8K14.7","cellular response to organic substance, cellular response to oxygen-containing compound, cellular response to salicylic acid stimulus, defense response to bacterium, defense response to fungus, molecular_function, nucleus, regulation of defense response, regulation of immune system process, response to inorganic substance, response to nitrogen compound, signal transduction, tissue development"
"Chir03Ox-b31530.2",6.03995955776559e-19,0.30737287483812,0.481,0.16,1.18745604905672e-14,"AT2G17280",NA,NA,"F5J6.4","carbohydrate derivative metabolic process, cytoplasm, phosphatase activity, response to hypoxia, response to light stimulus"
"Chir07Ox-b04460.2",1.90379810109727e-27,0.320508919973675,0.548,0.162,3.74286706675724e-23,"AT5G38560",NA,NA,"PERK8","developmental growth, lipid metabolic process, negative regulation of cellular process, negative regulation of gene expression, nucleus, plasma membrane, protein kinase binding, protein phosphorylation, protein serine/threonine kinase activity, regulation of developmental process, response to wounding, shoot system development"
"Chir02Ox-b27070.2",2.06860784583685e-20,0.393894089389102,0.49,0.163,4.06688302491525e-16,"AT1G80850",NA,NA,"AT1G80850.1","base-excision repair, DNA-3-methyladenine glycosylase activity, nucleus"
"Chir06Ox-b15990.2",6.09760004469637e-34,0.331412998756633,0.606,0.165,1.19878816878731e-29,"AT5G23760",NA,NA,"MRO11.20","carboxylic acid metabolic process, cellular catabolic process, cellular_component, metal ion binding, organic substance catabolic process, pigment metabolic process, response to light stimulus, terpenoid biosynthetic process"
"Chir01Ox-b14510.2",2.24805334648714e-92,0.916694310209317,0.837,0.166,4.41967287919371e-88,"AT1G14460",NA,NA,"F14L17.24","DNA binding, DNA clamp loader activity, DNA polymerase III complex, DNA repair, DNA replication factor C complex, DNA-directed DNA polymerase activity, DNA-templated DNA replication, nucleus, plasma membrane"
"Chir03Ox-b20600.2",6.45517083072059e-40,0.377768759964082,0.635,0.166,1.26908658531967e-35,"AT3G20560",NA,NA,"ATPDIL5-3","COPII-coated ER to Golgi transport vesicle, endoplasmic reticulum, protein disulfide isomerase activity"
"Chir02Ox-b25160.2",6.97838626086637e-32,0.336509029244831,0.596,0.168,1.37195073888633e-27,"AT1G78140",NA,NA,"T11I11.8","chloroplast, methyltransferase activity, mitochondrion, plastoglobule, ubiquinone biosynthetic process"
"Chir02Ox-b20160.2",7.01315245417289e-18,0.290273392345925,0.49,0.169,1.37878577249039e-13,"AT1G73390",NA,NA,"T9L24.40","abscisic acid-activated signaling pathway, mitochondrion, molecular_function, nucleus, response to light stimulus, response to water deprivation, secondary metabolic process, small molecule metabolic process"
"Chir06Ox-b29570.2",7.32000748046723e-46,0.513407634839464,0.673,0.169,1.43911347065986e-41,"AT5G09760",NA,NA,"AT5G09760.1","cell wall modification, chloroplast, meiotic cell cycle process, negative regulation of metabolic process, pectin catabolic process, pectinesterase activity, pectinesterase inhibitor activity, small molecule metabolic process"
"Chir07Ox-b20940.2",9.18813311285737e-100,1.23215159084596,0.846,0.169,1.80638696998776e-95,"AT4G23920",NA,NA,"UGE2","cell wall biogenesis, cytosol, galactose metabolic process, protein dimerization activity, RNA binding, rRNA processing, salicylic acid binding, UDP-glucose 4-epimerase activity"
"Chir08Ox-b05940.2",1.4584103187614e-20,0.380294417148031,0.519,0.169,2.86723468668491e-16,"AT4G12000",NA,NA,"AT4G12000.1","plasma membrane, response to oxidative stress"
"Chir05Ox-b01550.2",4.33104647400137e-23,0.288403764444536,0.538,0.17,8.5148373678867e-19,"AT2G02710",NA,NA,"PLP","cellular catabolic process, cellular response to organic substance, cellular response to oxygen-containing compound, leaf senescence, molecular_function, nucleus, organic substance catabolic process, response to alcohol, response to inorganic substance, response to light intensity, response to salt stress, response to water deprivation, signal transduction"
"Chir07Ox-b29520.2",4.4680427416161e-47,0.442768678682829,0.673,0.17,8.78417203001724e-43,"AT4G32272",NA,NA,"UGNT1","antiporter activity, Golgi apparatus, Golgi membrane, nucleotide-sugar transmembrane transporter activity, plasma membrane, trans-Golgi network, UDP-glucuronic acid transmembrane transporter activity, UDP-N-acetylgalactosamine transmembrane transporter activity, UDP-N-acetylglucosamine transmembrane transport, UDP-N-acetylglucosamine transmembrane transporter activity"
"Chir01Ox-b27680.2",4.29916113082234e-99,1.00328366369412,0.856,0.174,8.45215078319671e-95,"AT1G29120",NA,NA,"UP9","cellular lipid metabolic process, chloroplast, chloroplast organization, molecular_function, monocarboxylic acid metabolic process, nucleus, organic substance transport, peroxisome, response to red light, response to water deprivation"
"Chir07Ox-b16290.2",6.05555752140259e-56,0.681121816458473,0.731,0.175,1.19052260870775e-51,"AT4G19420",NA,NA,"AT4G19420.1","cell wall organization, extracellular region, pectin acetylesterase activity"
"Chir07Ox-b33640.2",5.1363707153938e-44,0.384011719871573,0.702,0.177,1.00981048264642e-39,"AT4G36120",NA,NA,"T19K4.250","cell differentiation, cell division, defense response to other organism, developmental growth, molecular_function, nucleus, plant epidermis development, regionalization, regulation of multicellular organismal process, response to bacterium, root morphogenesis"
"Chir03Ox-b08940.2",6.12738742557421e-86,0.747237602164331,0.846,0.178,1.20464436786789e-81,"AT3G09730",NA,NA,"F11F8.32","asymmetric cell division, cell division, cellular lipid metabolic process, cytoplasm, lipid biosynthetic process, molecular_function, monocarboxylic acid biosynthetic process, negative regulation of cellular biosynthetic process, positive regulation of cellular process"
"Chir07Ox-b34940.2",4.81051004478799e-18,0.280000139880658,0.5,0.181,9.4574627480532e-14,NA,NA,NA,NA,NA
"Chir01Ox-b01170.2",1.04183390032367e-32,0.397803809431952,0.625,0.182,2.04824544803634e-28,"AT1G01110",NA,NA,"IQD18","cell division, developmental growth, flower development, meiotic cell cycle process, molecular_function, nucleus, phyllome development, seed development, shoot system morphogenesis"
"Chir08Ox-b12800.2",4.79489893598716e-17,0.388572208282671,0.5,0.182,9.42677130815076e-13,"AT5G51260",NA,NA,"MWD22.21","acid phosphatase activity, chloroplast, regulation of multicellular organismal development, response to light stimulus, secondary metabolic process"
"Chir03Ox-b02860.2",4.32920120148773e-65,0.697984003211402,0.798,0.183,8.51120956212487e-61,"AT3G03680",NA,NA,"MCTP14","carboxylic acid biosynthetic process, cell division, epigenetic regulation of gene expression, meristem development, plant-type cell wall organization or biogenesis, porphyrin-containing compound metabolic process, post-embryonic plant morphogenesis, response to inorganic substance, vesicle"
"Chir08Ox-b13550.2",9.88989420648875e-26,0.278114551161512,0.596,0.185,1.94435320099569e-21,"AT5G51910","Yes","TCP","TCP19","DNA-binding transcription factor activity, nucleus, protein binding, regulation of defense response, regulation of DNA-templated transcription, sequence-specific DNA binding, transcription cis-regulatory region binding"
"Chir03Ox-b21230.2",3.61417530357841e-106,1.54473905966233,0.885,0.186,7.10546864683516e-102,"AT3G21160",NA,NA,"MNS2","alpha-mannosidase activity, calcium ion binding, carbohydrate metabolic process, endoplasmic reticulum, endosome, Golgi apparatus, Golgi cis cisterna, Golgi membrane, mannosyl-oligosaccharide 1,2-alpha-mannosidase activity, N-glycan processing, protein glycosylation, root development, trans-Golgi network"
"Chir01Ox-b30900.2",5.6950784240135e-74,0.745165475618555,0.827,0.187,1.11965241816106e-69,"AT1G32330","Yes","HSF","ATHSFA1D","cellular response to heat, DNA-binding transcription factor activity, nucleus, protein binding, regulation of DNA-templated transcription, regulation of transcription by RNA polymerase II, response to heat, RNA polymerase II cis-regulatory region sequence-specific DNA binding, sequence-specific DNA binding"
"Chir06Ox-b31720.2",3.09861912852058e-80,1.58888168423397,0.875,0.187,6.09188520667147e-76,"AT5G07220",NA,NA,"ATBAG3","adenyl-nucleotide exchange factor activity, chaperone binding, cytoplasm, nucleus, protein stabilization"
"Chir07Ox-b17140.2",8.38186219801732e-39,0.468399886394514,0.702,0.187,1.6478741081302e-34,"AT4G20320",NA,NA,"CTPS4","'de novo' CTP biosynthetic process, CTP biosynthetic process, CTP synthase activity, cytoophidium, cytosol, identical protein binding, nucleus, pyrimidine nucleobase biosynthetic process"
"Chir08Ox-b30550.2",1.04908527408133e-14,0.252265532258552,0.5,0.194,2.0625016488439e-10,"AT5G66040",NA,NA,"AT5G66040.1","carboxylic acid metabolic process, chloroplast, cytosol, glucosinolate metabolic process, plastid, response to light intensity, thiosulfate sulfurtransferase activity"
"Chir01Ox-b16020.2",2.38917901900637e-66,0.887330830813986,0.779,0.196,4.69712595136653e-62,"AT1G15970",NA,NA,"AT1G15970.1","base-excision repair, DNA-3-methyladenine glycosylase activity, nucleus"
"Chir02Ox-b18520.2",6.24814580986578e-25,0.276875628111237,0.596,0.196,1.22838546621961e-20,"AT1G71940",NA,NA,"F17M19.9","cell growth, cell morphogenesis, developmental growth involved in morphogenesis, Golgi apparatus, molecular_function, organonitrogen compound catabolic process"
"Chir07Ox-b15820.2",1.06976304058948e-22,0.46749184689337,0.558,0.198,2.10315413779891e-18,"AT4G18880","Yes","HSF","AT-HSFA4A","cellular response to heat, DNA-binding transcription factor activity, nucleus, positive regulation of DNA-templated transcription, protein binding, protein homodimerization activity, regulation of DNA-templated transcription, regulation of transcription by RNA polymerase II, response to reactive oxygen species, RNA polymerase II cis-regulatory region sequence-specific DNA binding, transcription cis-regulatory region binding"
"Chir07Ox-b30490.2",4.87690905996792e-24,0.452437506137427,0.596,0.199,9.58800321189694e-20,"AT4G33150",NA,NA,"LKR","cytoplasm, cytosol, L-lysine catabolic process, L-lysine catabolic process to acetyl-CoA via saccharopine, lysine biosynthetic process via aminoadipic acid, mitochondrion, saccharopine dehydrogenase (NAD+, L-glutamate-forming) activity, saccharopine dehydrogenase (NADP+, L-lysine-forming) activity, saccharopine dehydrogenase activity"
"Chir02Ox-b11580.2",9.58333132770407e-19,0.255900738408562,0.558,0.202,1.88408293902662e-14,"AT1G65900",NA,NA,"F12P19.7","chloroplast, cytokinesis, macromolecule catabolic process, meiotic cell cycle process, meristem development, molecular_function, response to inorganic substance"
"Chir04Ox-b00170.2",6.41917204890634e-67,1.03842101987596,0.827,0.202,1.26200922481499e-62,NA,NA,NA,NA,NA
"Chir05Ox-b24480.2",1.82807067245368e-101,1.35209395212554,0.913,0.202,3.59398694204394e-97,"AT3G58640",NA,NA,"F14P22.230","cytoplasm, phosphorylation, protein phosphorylation, protein serine/threonine kinase activity, signal transduction"
"Chir05Ox-b27300.2",7.65177639622141e-23,0.274031624571582,0.587,0.203,1.50433923949713e-18,"AT3G61610",NA,NA,"AT3G61610.1","carbohydrate metabolic process, cell wall organization or biogenesis, cytoplasm, glucose-6-phosphate 1-epimerase activity, nucleus, stomatal complex development"
"Chir04Ox-b20820.2",2.36400185025281e-20,0.496496134209384,0.567,0.207,4.64762763759702e-16,"AT2G38360",NA,NA,"PRA1.B4","endoplasmic reticulum, endosome, Golgi apparatus, molecular_function, plasma membrane, trans-Golgi network, vesicle-mediated transport"
"Chir02Ox-b22220.2",1.28701286459486e-18,0.264656630099003,0.558,0.208,2.5302672917935e-14,"AT1G75270",NA,NA,"DHAR2","acquisition of seed longevity, ascorbate glutathione cycle, cellular oxidant detoxification, cellular response to hydrogen peroxide, cytosol, glutathione binding, glutathione dehydrogenase (ascorbate) activity, glutathione transferase activity, L-ascorbic acid metabolic process, mitochondrion, plasma membrane, positive regulation of salicylic acid mediated signaling pathway"
"Chir08Ox-b21260.2",1.49606319492234e-46,0.521234055656377,0.76,0.208,2.94126024121731e-42,"AT5G59000",NA,NA,"K19M22.19","biological_process, cellular_component, zinc ion binding"
"Chir05Ox-b01290.2",2.5013698825686e-22,0.936300000279746,0.587,0.209,4.91769318912986e-18,"AT2G02230",NA,NA,"AtPP2-B1","carbohydrate binding, cellular catabolic process, cellular lipid metabolic process, monocarboxylic acid metabolic process, nucleus, protein binding"
"Chir06Ox-b27080.2",9.2260756983514e-14,0.370691382392718,0.529,0.209,1.81384648229588e-09,"AT5G12050",NA,NA,"BG1","auxin transport, circadian rhythm, molecular_function, nucleus, plasma membrane, positive regulation of auxin mediated signaling pathway"
"Chir01Ox-b24010.2",2.61475565548956e-34,0.65145173117045,0.683,0.21,5.14060961869247e-30,"AT1G27130",NA,NA,"ATGSTU13","cytoplasm, cytosol, defense response by callose deposition, defense response to fungus, glutathione metabolic process, glutathione transferase activity, indole glucosinolate catabolic process, innate immune response, nucleus, toxin catabolic process"
"Chir06Ox-b31830.2",2.91399940854446e-40,0.725357772618551,0.74,0.212,5.7289228371984e-36,"AT5G07100","Yes","WRKY","WRKY26","cellular heat acclimation, cellular response to heat, DNA-binding transcription factor activity, nucleus, protein binding, regulation of DNA-templated transcription, sequence-specific DNA binding"
"Chir01Ox-b16700.2",1.52589979751792e-30,0.324573813829346,0.683,0.214,2.99991900192023e-26,"AT1G16680",NA,NA,"F19K19.3","biological_process, cytoplasm, molecular_function"
"Chir01Ox-b12770.2",1.08712216556297e-26,0.378409411172272,0.644,0.215,2.13728217749679e-22,"AT1G12845",NA,NA,NA,"cellular_component, molecular_function, response to water deprivation"
"Chir04Ox-b19690.2",6.66107473466705e-52,1.12333910207766,0.798,0.22,1.30956729283554e-47,"AT2G37770",NA,NA,"ChlAKR","alcohol dehydrogenase (NADP+) activity, alditol:NADP+ 1-oxidoreductase activity, aldo-keto reductase (NADP) activity, chloroplast, cytoplasm, cytosol, endoplasmic reticulum, NADP+ binding, response to cold, response to salt stress, response to water deprivation, steroid dehydrogenase activity"
"Chir08Ox-b27770.2",1.12317819398861e-19,0.289889739448581,0.596,0.223,2.20816832938161e-15,"AT5G65110",NA,NA,"ACX2","acyl-CoA oxidase activity, FAD binding, fatty acid beta-oxidation, fatty acid beta-oxidation using acyl-CoA oxidase, fatty acid binding, flavin adenine dinucleotide binding, lipid homeostasis, long-chain fatty acid metabolic process, mitochondrion, peroxisome"
"Chir05Ox-b23050.2",6.15815568185032e-15,0.30586121511515,0.577,0.225,1.21069340705177e-10,"AT3G57400",NA,NA,"F28O9.250","cell wall biogenesis, molecular_function, nucleus, plant-type cell wall organization or biogenesis, tropism"
"Chir07Ox-b01770.2",2.42927139706098e-28,0.681846334567228,0.663,0.225,4.77594756662189e-24,"AT5G40700",NA,NA,"MNF13.26","biological_process, molecular_function, nucleus"
"Chir01Ox-b28830.2",1.5459925557127e-25,0.256363188811985,0.663,0.226,3.03942136453118e-21,"AT1G30300",NA,NA,"F12P21.8","amino acid metabolic process, cellular catabolic process, flavonoid metabolic process, molecular_function, nucleus, response to organonitrogen compound"
"Chir05Ox-b26390.2",9.69239849909585e-39,0.548731284173918,0.731,0.227,1.90552554492224e-34,"AT3G60530","Yes","GATA","AT3G60530.1","cell differentiation, DNA-binding transcription factor activity, nucleus, positive regulation of DNA-templated transcription, response to light stimulus, transcription cis-regulatory region binding, zinc ion binding"
"Chir06Ox-b15930.2",1.12865298362239e-27,0.325592976386386,0.683,0.227,2.21893176580161e-23,"AT5G23850",NA,NA,"MRO11.11","cellular response to oxygen-containing compound, defense response to other organism, endosome, extracellular region, Golgi apparatus, molecular_function, negative regulation of metabolic process, response to fungus, response to light stimulus, response to wounding, tissue development, trans-Golgi network"
"Chir01Ox-b19840.2",4.46857337927831e-37,0.576838075234078,0.692,0.229,8.78521526366116e-33,"AT1G19950",NA,NA,"HVA22H","cellular_component, meiotic cell cycle, molecular_function"
"Chir05Ox-b05600.2",4.34686490967542e-25,0.267240432506646,0.654,0.229,8.54593641242187e-21,"AT3G27930",NA,NA,"AtOM47","mitochondrial outer membrane, nucleus, positive regulation of leaf senescence, voltage-gated anion channel activity"
"Chir04Ox-b07410.2",2.52503459765481e-19,0.286049681926199,0.596,0.23,4.96421801898935e-15,"AT2G26600",NA,NA,"AT2G26600.1","carbohydrate metabolic process, cellular response to oxygen-containing compound, defense response to other organism, extracellular region, glucan endo-1,3-beta-D-glucosidase activity, hormone-mediated signaling pathway, membrane, response to lipid"
"Chir04Ox-b17200.2",5.62186121168468e-32,0.374405588645821,0.702,0.23,1.10525791421721e-27,"AT2G35020",NA,NA,"GlcNAc1pUT2","cytoplasm, embryo development ending in seed dormancy, embryo sac development, pollen development, UDP-glucose metabolic process, UDP-N-acetylgalactosamine diphosphorylase activity, UDP-N-acetylgalactosamine metabolic process, UDP-N-acetylglucosamine biosynthetic process, UDP-N-acetylglucosamine diphosphorylase activity, UDP-N-acetylglucosamine metabolic process, UTP:glucose-1-phosphate uridylyltransferase activity"
"Chir07Ox-b20890.2",7.2767967909094e-29,0.418681911021827,0.663,0.235,1.43061824909279e-24,"AT4G23885",NA,NA,NA,"chloroplast, defense response to other organism, mitochondrion, molecular_function"
"Chir01Ox-b17440.2",2.3082095072179e-35,0.407423751238008,0.75,0.236,4.5379398911904e-31,"AT1G17360",NA,NA,"F28G4.18","defense response to other organism, extracellular region, molecular_function, response to abscisic acid, response to water deprivation"
"Chir05Ox-b00670.2",6.14725128860976e-21,0.377574426718874,0.615,0.236,1.20854960334068e-16,"AT2G01680",NA,NA,"AT2G01680.1","cytoplasm, plasma membrane, protein phosphatase 1 binding, protein phosphatase regulator activity, regulation of protein dephosphorylation, tissue development"
"Chir05Ox-b24720.2",3.14638717720707e-20,0.54853845634437,0.577,0.236,6.18579719038909e-16,"AT3G58850",NA,NA,"PAR2","chloroplast, circadian rhythm, developmental process, nucleus, regulation of DNA-templated transcription, shade avoidance"
"Chir05Ox-b17380.2",4.66299587009385e-22,0.390271534731753,0.606,0.238,9.16744988060451e-18,"AT3G51980",NA,NA,"F4F15.90","adenyl-nucleotide exchange factor activity, cellular catabolic process, chloroplast, endoplasmic reticulum, endoplasmic reticulum unfolded protein response, organonitrogen compound catabolic process"
"Chir06Ox-b23460.2",2.86228299509349e-20,0.31970945675071,0.625,0.238,5.62724836835379e-16,"AT5G15930",NA,NA,"PAM1","activation of GTPase activity, cytoplasm, GTPase activator activity"
"Chir04Ox-b10210.2",1.19048965479867e-37,0.379116954886373,0.808,0.239,2.34050266133418e-33,"AT2G28620",NA,NA,"RSW7","cortical microtubule organization, cytokinesis by cell plate formation, microtubule, microtubule binding, microtubule motor activity, microtubule-based movement, mitotic cytokinesis, mitotic sister chromatid segregation, mitotic spindle, mitotic spindle assembly, mitotic spindle organization, spindle, spindle elongation, spindle microtubule, unidimensional cell growth"
"Chir01Ox-b06840.2",3.67431925801905e-19,0.357239273763155,0.606,0.242,7.22371166126546e-15,"AT1G07410",NA,NA,"ATRABA2B","cell plate, cell wall biogenesis, endosome, Golgi apparatus, GTP binding, GTPase activity, plasma membrane"
"Chir01Ox-b31010.2",7.86802226756315e-51,0.637102874624605,0.788,0.242,1.54685317780291e-46,"AT1G32380",NA,NA,"PRS2","5-phosphoribose 1-diphosphate biosynthetic process, chloroplast, cytoplasm, magnesium ion binding, purine nucleotide biosynthetic process, ribonucleoside monophosphate biosynthetic process, ribose phosphate diphosphokinase activity, ribose phosphate diphosphokinase complex"
"Chir06Ox-b24310.2",1.13469589171808e-23,0.423183848232466,0.663,0.242,2.23081212311775e-19,"AT5G15070",NA,NA,"ATVIP2","cytoplasm, diphosphoinositol-pentakisphosphate kinase activity, inositol heptakisphosphate kinase activity, inositol hexakisphosphate 1-kinase activity, inositol hexakisphosphate 3-kinase activity, inositol hexakisphosphate 5-kinase activity, inositol hexakisphosphate kinase activity, inositol metabolic process, inositol phosphate biosynthetic process, inositol-1,3,4,5,6-pentakisphosphate kinase activity, phosphorylation, plasma membrane, plastid, positive regulation of vitamin E biosynthetic process"
"Chir05Ox-b27680.2",4.33477200353341e-19,0.62537373370655,0.577,0.243,8.52216175894669e-15,"AT3G61970","Yes","B3","AT3G61970.1","DNA-binding transcription factor activity, flower development, leaf development, nucleus, regulation of leaf morphogenesis"
"Chir04Ox-b21600.2",1.9855534484114e-19,0.316330318276309,0.635,0.244,3.9035980795768e-15,"AT2G39050",NA,NA,"ArathEULS3","carbohydrate binding, cytoplasm, defense response to bacterium, Golgi apparatus, nucleus, protein binding, stomatal closure"
"Chir01Ox-b26450.2",1.49426954969563e-98,2.34200562929168,0.933,0.245,2.9377339347016e-94,"AT1G27680",NA,NA,"APL2","chloroplast, glucose-1-phosphate adenylyltransferase activity, glycogen biosynthetic process, starch biosynthetic process"
"Chir03Ox-b17840.2",7.61948764345641e-28,0.36147595579256,0.702,0.245,1.49799127070353e-23,"AT3G18040",NA,NA,"MPK9","abscisic acid-activated signaling pathway, ATP binding, cytoplasm, cytosol, intracellular signal transduction, MAP kinase activity, mitochondrion, nucleus, protein kinase activity, protein phosphorylation, protein serine/threonine kinase activity, signal transduction"
"Chir04Ox-b28900.2",7.10082064998482e-27,0.428709582056073,0.663,0.246,1.39602133978702e-22,"AT2G46000",NA,NA,"F4I18.48","carbohydrate derivative metabolic process, cellular_component, lipid biosynthetic process, molecular_function, protein folding, small molecule metabolic process"
"Chir08Ox-b27680.2",2.50246294125039e-71,2.07519911467003,0.856,0.246,4.91984214249827e-67,"AT5G65020",NA,NA,"ANNAT2","calcium ion binding, cell surface, chloroplast, cytoplasm, cytosol, phloem sucrose unloading, plastid, polysaccharide transport, primary root development, response to cold, response to heat, response to salt stress, response to water deprivation, thylakoid"
"Chir02Ox-b13420.2",4.7291081184577e-52,0.64619769810415,0.817,0.248,9.29742656088783e-48,"AT1G67300",NA,NA,"AT1G67300.4","carbohydrate transmembrane transporter activity, hexose transmembrane transporter activity, membrane, monosaccharide transmembrane transport, plasma membrane, transmembrane transport, transmembrane transporter activity"
"Chir06Ox-b35780.2",1.35414642163264e-38,0.791455646291498,0.779,0.248,2.66225186492977e-34,"AT5G03230",NA,NA,"F15A17.260","hormone-mediated signaling pathway, molecular_function, nucleus, regulation of signal transduction, response to abscisic acid, response to organonitrogen compound"
"Chir02Ox-b10440.2",1.07614538662654e-52,0.613056949749219,0.827,0.249,2.11570183010778e-48,"AT1G65040",NA,NA,"AT1G65040.5","mitochondrion, ubiquitin protein ligase activity, ubiquitin-dependent ERAD pathway, ubiquitin-dependent protein catabolic process"
"Chir05Ox-b24560.2",1.37353469765433e-21,0.322101618542378,0.663,0.25,2.70036921558841e-17,"AT3G58710","Yes","WRKY","WRKY69","anatomical structure maturation, DNA-binding transcription factor activity, jasmonic acid mediated signaling pathway, nucleus, organic acid biosynthetic process, plant epidermis development, regulation of DNA-templated transcription, response to fungus, response to water deprivation, response to wounding, root development, transcription cis-regulatory region binding, tryptophan metabolic process"
"Chir07Ox-b01390.2",1.75046301606626e-78,1.15322705978045,0.885,0.251,3.44141028958627e-74,NA,NA,NA,NA,NA
"Chir01Ox-b00480.2",4.13227311006328e-24,0.373258855140098,0.663,0.252,8.1240489343844e-20,NA,NA,NA,NA,NA
"Chir01Ox-b21400.2",2.99715852140567e-30,0.345468165706059,0.74,0.252,5.89241365308354e-26,"AT1G21660",NA,NA,"AT1G21660.1","clathrin binding, clathrin coat disassembly, clathrin-dependent endocytosis, cytoplasm, intracellular membrane-bounded organelle, nucleus, vesicle"
"Chir02Ox-b13510.2",2.07914665100628e-21,0.376384701765896,0.635,0.254,4.08760231587835e-17,"AT1G67340",NA,NA,"AT1G67340.1","cellular response to oxygen-containing compound, defense response to bacterium, flower development, hormone-mediated signaling pathway, jasmonic acid mediated signaling pathway, negative regulation of metabolic process, negative regulation of nitrogen compound metabolic process, nucleus, phloem or xylem histogenesis, phosphorelay signal transduction system, protein binding, response to chitin, response to ethylene, response to inorganic substance, response to osmotic stress, response to salicylic acid, response to wounding, shoot system development"
"Chir05Ox-b25840.2",4.49800231925412e-18,0.408685485327094,0.606,0.254,8.8430725596536e-14,"AT3G60080",NA,NA,"AT3G60080.1","nucleus, ubiquitin protein ligase activity, ubiquitin-dependent protein catabolic process"
"Chir08Ox-b29130.2",3.80901295246341e-16,0.307274208204114,0.606,0.254,7.48851946454307e-12,"AT5G67180","Yes","AP2","TOE3","DNA binding, DNA-binding transcription factor activity, nucleus, protein binding, regulation of DNA-templated transcription"
