"gene_ID","p_val","avg_log2FC","pct.1","pct.2","p_val_adj","AT_ID","TF","TF_family","Gene_code_name","Gene_functions"
"Chir07Ox-b33710.2",6.25252798254535e-23,0.409538820034977,0.769,0.361,1.22924700136842e-18,"AT4G36195",NA,NA,"AT4G36195.1","cellular catabolic process, dipeptidyl-peptidase activity, extracellular region, monocarboxylic acid metabolic process, organic substance catabolic process, plant-type vacuole, proteolysis, response to jasmonic acid, response to wounding, secretory vesicle, serine-type peptidase activity"
"Chir02Ox-b02260.2",6.48488844633364e-20,0.462112954682592,0.769,0.362,1.27492906854919e-15,"AT1G63010",NA,NA,"PHT5;1","Golgi apparatus, membrane, nucleus, phosphate ion homeostasis, phosphate ion transmembrane transporter activity, phosphate ion transport, plant-type vacuole, plant-type vacuole membrane, plasma membrane, transmembrane phosphate ion transport from cytosol to vacuole, transmembrane transport, transmembrane transporter activity, transport, vacuolar membrane, vacuole"
"Chir04Ox-b19610.2",1.29071998263972e-47,1.56190915984953,0.942,0.363,2.53755548586969e-43,NA,NA,NA,NA,NA
"Chir05Ox-b02260.2",9.16525095921421e-17,0.311354897761999,0.731,0.364,1.80188833858151e-12,"AT2G03510",NA,NA,"AT2G03510.1","cholesterol binding, endoplasmic reticulum, endoplasmic reticulum membrane, Golgi apparatus, mitochondrion, nucleolus, nucleus, plant-type vacuole, plasmodesma, signal transduction, SREBP signaling pathway, ubiquitin protein ligase binding"
"Chir07Ox-b07360.2",5.05049130310992e-18,0.392657253141009,0.712,0.364,9.9292659019141e-14,"AT5G35080",NA,NA,"OS9","endoplasmic reticulum, endoplasmic reticulum lumen, endoplasmic reticulum unfolded protein response, ERAD pathway, plastid, protein binding, response to salt stress, retrograde protein transport, ER to cytosol, ubiquitin-dependent ERAD pathway"
"Chir01Ox-b04500.2",5.65520217844093e-32,0.475423466286724,0.846,0.368,1.11181274828149e-27,"AT1G05270",NA,NA,"YUP8H12.12","biological_process, mitochondrial outer membrane, molecular_function, plasma membrane"
"Chir07Ox-b25470.2",3.62833754530812e-14,0.416633479936336,0.702,0.369,7.13331161407577e-10,"AT4G28300",NA,NA,"FLOE1","cellular response to abscisic acid stimulus, defense response to other organism, hormone-mediated signaling pathway, molecular_function, nucleus, plasma membrane, positive regulation of cellular process, protein body, regulation of defense response, regulation of seed germination, response to chitin, response to heat, response to organic cyclic compound, response to osmotic stress, response to oxidative stress, response to salt, response to salt stress, response to water, response to water deprivation, response to wounding, small molecule metabolic process"
"Chir01Ox-b42150.2",4.96140590773105e-31,0.60865688177392,0.788,0.37,9.75412401459925e-27,"AT1G53280",NA,NA,"DJ1B","chloroplast, chloroplast stroma, cytoplasm, glyoxal metabolic process, glyoxalase III activity"
"Chir08Ox-b28440.2",1.40798801354286e-11,0.254711443208718,0.683,0.371,2.76810443462526e-07,"AT5G65750",NA,NA,"E1-OGDH2","cobalt ion binding, mitochondrion, oxoglutarate dehydrogenase (succinyl-transferring) activity, oxoglutarate dehydrogenase complex, plastid, thiamine pyrophosphate binding, tricarboxylic acid cycle, zinc ion binding"
"Chir04Ox-b12620.2",1.98420209301048e-52,0.999356080326258,0.894,0.372,3.9009413148586e-48,"AT2G30880",NA,NA,"SWAP70","cytoplasm, defense response to bacterium, intracellular signal transduction, peptidyl-serine phosphorylation, phosphatidylinositol binding, protein serine/threonine kinase activity, signal transduction"
"Chir04Ox-b03670.2",2.10749712668345e-10,0.256190463632108,0.683,0.374,4.14333935105966e-06,"AT2G23790",NA,NA,"F27L4.3","calcium channel activity, calcium import into the mitochondrion, chloroplast, mitochondrial calcium ion homeostasis, mitochondrion, uniplex complex, uniporter activity"
"Chir07Ox-b20410.2",9.61933535552508e-15,0.270814402108715,0.74,0.374,1.89116133089623e-10,"AT4G23470",NA,NA,"F16G20.170","cell differentiation, defense response, defense response to other organism, developmental growth, hormone-mediated signaling pathway, phosphate-containing compound metabolic process, regulation of defense response, response to abscisic acid, response to lipid, response to organic cyclic compound, root morphogenesis, tissue development, unidimensional cell growth"
"Chir05Ox-b09800.2",6.97639481945878e-17,0.522516011443512,0.75,0.376,1.3715592215056e-12,"AT3G45090",NA,NA,"T14D3.30","carbohydrate derivative metabolic process, molecular_function, nucleus, positive regulation of cellular process, regulation of biological quality, small molecule metabolic process"
"Chir07Ox-b27250.2",2.9772785393756e-19,0.447875263910025,0.721,0.376,5.85332960841243e-15,"AT4G29960",NA,NA,"AT4G29960.1","endoplasmic reticulum, ERAD pathway, nucleus, protein binding"
"Chir07Ox-b33720.2",8.48439614600834e-34,0.57453331526412,0.846,0.376,1.66803228230524e-29,"AT4G36210",NA,NA,"F23E13.100","cellular response to hormone stimulus, cellular response to oxygen-containing compound, chloroplast, molecular_function, response to lipid, shoot system development, signal transduction, small molecule metabolic process"
"Chir01Ox-b24260.2",5.03309930956056e-16,0.350957769770419,0.712,0.378,9.89507324259606e-12,"AT1G26940",NA,NA,"T2P11.13","cytoplasm, endosome, Golgi apparatus, peptidyl-prolyl cis-trans isomerase activity, protein catabolic process, trans-Golgi network"
"Chir06Ox-b05350.2",2.15685126951841e-28,0.572624066444636,0.837,0.378,4.2403695958732e-24,"AT5G43900",NA,NA,"MYA2","actin cytoskeleton, actin filament binding, actin filament organization, actin filament-based movement, cytoplasm, cytoskeletal motor activity, cytosol, Golgi localization, GTP-dependent protein binding, gynoecium development, leaf pavement cell development, microfilament motor activity, mitochondrion localization, myosin complex, nucleus, peroxisome, peroxisome localization, protein binding, root hair elongation, small GTPase binding, trichome morphogenesis, vesicle, vesicle transport along actin filament"
"Chir08Ox-b16370.2",1.19533679137269e-12,0.262344175496477,0.721,0.379,2.3500321318387e-08,"AT5G54390",NA,NA,"AHL","3'(2'),5'-bisphosphate nucleotidase activity, cytoplasm, inositol phosphate dephosphorylation, phosphatidylinositol phosphate biosynthetic process, phosphoric ester hydrolase activity, sulfate assimilation"
"Chir08Ox-b21440.2",2.19862392909784e-17,0.381585523416077,0.75,0.379,4.32249464460636e-13,"AT5G59140",NA,NA,"AT5G59140.1","elongin complex, nucleus, protein-macromolecule adaptor activity, response to inorganic substance, ubiquitin-dependent protein catabolic process"
"Chir07Ox-b37420.2",4.56663217679885e-11,0.261257083459514,0.692,0.38,8.97799885958653e-07,"AT4G38210",NA,NA,"ATEXPA20","extracellular region, plant-type cell wall loosening, plant-type cell wall organization, syncytium formation, unidimensional cell growth"
"Chir01Ox-b08380.2",4.72020673641676e-16,0.353811442917467,0.75,0.381,9.27992644379535e-12,"AT1G08820",NA,NA,"VAP27-2","endoplasmic reticulum membrane, endoplasmic reticulum membrane organization, endoplasmic reticulum-plasma membrane tethering, extracellular region, intracellular transport, plasma membrane"
"Chir07Ox-b12910.2",2.22065659642424e-53,0.956989209580805,0.904,0.383,4.36581086857005e-49,NA,NA,NA,NA,NA
"Chir02Ox-b03970.2",4.11677452988754e-57,1.10187559795248,0.913,0.39,8.09357872575891e-53,"AT1G61770",NA,NA,"T13M11.13","chloroplast, endoplasmic reticulum, endoplasmic reticulum membrane, nucleus, protein folding"
"Chir07Ox-b00180.2",4.61244533661057e-13,0.29588297488227,0.74,0.39,9.06806753177638e-09,"AT5G41990",NA,NA,"WNK8","cytoplasm, identical protein binding, intracellular signal transduction, nucleus, photoperiodism, flowering, positive regulation of flower development, protein autophosphorylation, protein binding, protein kinase activity, protein phosphorylation, protein serine/threonine kinase activity, regulation of flower development, vegetative to reproductive phase transition of meristem"
"Chir04Ox-b13260.2",4.06789185503739e-27,0.556684612224137,0.865,0.391,7.99747538700352e-23,"AT2G31390",NA,NA,"FRK2","chloroplast, cytosol, fructokinase activity, fructose metabolic process, peroxisome, plasma membrane, starch biosynthetic process"
"Chir07Ox-b24250.2",1.37883081875203e-14,0.300113251541727,0.74,0.391,2.71078138966649e-10,"AT4G27120",NA,NA,"AT4G27120.1","cytoplasm, cytosol"
"Chir08Ox-b18610.2",1.986769140723e-20,0.405751725405594,0.817,0.391,3.90598813066141e-16,"AT5G56500",NA,NA,"Cpn60beta3","chaperone cofactor-dependent protein refolding, chloroplast, chloroplast stroma, mitochondrion, plastid, protein folding, protein refolding"
"Chir01Ox-b28400.2",2.21950268754145e-18,0.389409723416085,0.75,0.392,4.36354228370648e-14,"AT1G30200",NA,NA,"F12P21.1","chloroplast, developmental growth, molecular_function"
"Chir04Ox-b26070.2",8.45535504528684e-14,0.271176894151599,0.731,0.392,1.66232280190339e-09,"AT2G43350",NA,NA,"ATGPX3","abscisic acid-activated signaling pathway, cellular response to water deprivation, chloroplast, cytosol, endoplasmic reticulum, endosome, glutathione peroxidase activity, Golgi apparatus, mitochondrion, peroxidase activity, response to hydrogen peroxide, trans-Golgi network"
"Chir03Ox-b07540.2",1.16455100212597e-20,0.540541819513294,0.769,0.397,2.28950727017965e-16,"AT3G07890",NA,NA,"F17A17.23","activation of GTPase activity, cytoplasm, GTPase activator activity"
"Chir04Ox-b17700.2",1.23763385779574e-18,0.346197681500364,0.808,0.397,2.43318816442643e-14,NA,NA,NA,NA,NA
"Chir01Ox-b20740.2",8.83525260737249e-12,0.259636327912345,0.74,0.4,1.73701066260943e-07,"AT1G20920",NA,NA,"RCF1","mRNA splicing, via spliceosome, nucleus, RNA helicase activity"
"Chir08Ox-b15410.2",1.43495678592597e-11,0.302721748762969,0.712,0.404,2.82112504113046e-07,"AT5G53530",NA,NA,"VPS26A","chloroplast, endosome, endosome to lysosome transport, intracellular membrane-bounded organelle, intracellular protein transport, membrane, multivesicular body, retrograde transport, endosome to Golgi, retromer complex"
"Chir05Ox-b26270.2",1.6044442941253e-15,0.276601117459763,0.75,0.408,3.15433748225033e-11,"AT3G60450",NA,NA,"T8B10.110","cellular response to oxygen-containing compound, defense response to other organism, molecular_function, nucleus, regulation of defense response, response to jasmonic acid, response to oxidative stress, response to water"
"Chir07Ox-b26760.2",4.74498081751279e-37,1.50160396461554,0.817,0.409,9.32863228723015e-33,"AT4G29520",NA,NA,"SES1","chaperone-mediated protein folding, endoplasmic reticulum, plasma membrane, protein binding, protein folding chaperone, response to heat"
"ChirMtOx-b00150.2",7.98546195689016e-14,0.290398591933942,0.788,0.409,1.56994182072461e-09,"AT2G07718",NA,NA,"T18C6.22","mitochondrion, molecular_function"
"Chir01Ox-b25040.2",5.02740772528209e-15,0.282294193092479,0.769,0.41,9.88388358790459e-11,"AT1G26160",NA,NA,"F28B23.16","5'-deoxynucleotidase activity, cellular component biogenesis, chloroplast, inorganic ion homeostasis, protein catabolic process, seed development"
"Chir07Ox-b15750.2",4.32301132897488e-24,0.492951427090014,0.808,0.41,8.49904027276462e-20,"AT4G18800",NA,NA,"ATHSGBP","cell wall biogenesis, early endosome membrane, endomembrane system, GTPase activity, intracellular protein transport, plasmodesma, protein binding, trans-Golgi network membrane"
"Chir06Ox-b01880.2",3.41257791380463e-13,0.284985907167762,0.779,0.411,6.7091281785399e-09,"AT5G46250",NA,NA,"LARP6a","defense response to other organism, mRNA binding, nucleus, oxoacid metabolic process, polysome, response to alcohol, response to lipid, RNA binding, RNA processing"
"Chir03Ox-b06100.2",3.62147992659535e-15,0.322480438007132,0.76,0.413,7.11982953568646e-11,"AT3G06580",NA,NA,"GAL1","carbohydrate phosphorylation, cytoplasm, cytosol, galactokinase activity, galactose metabolic process"
"Chir01Ox-b27560.2",1.85287905270738e-11,0.267405190292125,0.721,0.414,3.64276021762271e-07,"AT4G14600",NA,NA,"SFT11","endoplasmic reticulum, Golgi apparatus, plasma membrane"
"Chir01Ox-b10990.2",9.45675432845858e-13,0.270247513415293,0.74,0.416,1.85919790097496e-08,"AT1G11180",NA,NA,"AtSCAMP2","plasma membrane, protein transport, recycling endosome membrane, trans-Golgi network membrane"
"Chir01Ox-b16690.2",1.32816443042354e-17,0.825378483904005,0.769,0.416,2.61117127021267e-13,"AT1G16670",NA,NA,"CRPK1","nucleus, plasma membrane, protein autophosphorylation, protein binding, protein serine/threonine kinase activity, response to cold, response to freezing, response to insect, response to molecule of bacterial origin"
"Chir06Ox-b32630.2",2.75286052616736e-44,0.886584905864821,0.865,0.418,5.41212379444503e-40,"AT5G06140",NA,NA,"SNX1","auxin homeostasis, chloroplast, endosome, endosome to lysosome transport, Golgi to vacuole transport, intracellular membrane-bounded organelle, membrane, multivesicular body, phosphatidylinositol binding, plasma membrane, positive gravitropism, protein binding, protein targeting to vacuole, retromer complex, root development"
"Chir07Ox-b13400.2",2.0644776725641e-31,0.983023411037143,0.827,0.419,4.05876310426102e-27,"AT4G16660",NA,NA,"HSP70","cellular response to hypoxia, cytosol, endoplasmic reticulum, endoplasmic reticulum chaperone complex, Golgi apparatus, negative regulation of hypoxia-induced intrinsic apoptotic signaling pathway, plant-type vacuole, secretory vesicle"
"Chir02Ox-b15470.2",8.33159164210758e-21,0.762645477971004,0.769,0.421,1.63799091683835e-16,"AT1G69040",NA,NA,"AT1G69040.1","chloroplast, cytosol, plasmodesma, protein binding, regulation of cellular amino acid metabolic process, response to cytokinin"
"Chir08Ox-b19180.2",1.49089627285187e-11,0.323025310837457,0.74,0.421,2.93110207242678e-07,"AT5G57015",NA,NA,"ckl12","cytoplasm, endocytosis, mitochondrion, nucleus, peptidyl-serine phosphorylation, protein serine/threonine kinase activity, signal transduction"
"Chir03Ox-b28740.2",1.97604461131983e-12,0.271615360297045,0.76,0.422,3.8849037058548e-08,"AT2G14835",NA,NA,NA,"Golgi apparatus"
"Chir03Ox-b19370.2",6.3578808442487e-14,0.368457301391948,0.769,0.424,1.24995937397930e-09,"AT3G19540",NA,NA,"BDR4","meiotic cell cycle, mitochondrion, molecular_function, organelle organization, response to chitin"
"Chir04Ox-b13020.2",4.15862662458649e-20,0.661782394552634,0.837,0.424,8.17585994393704e-16,"AT2G31200",NA,NA,"ADF6","actin cytoskeleton, actin filament binding, actin filament depolymerization, cytoplasm"
"Chir05Ox-b11190.2",2.62503882061935e-14,0.299299802953262,0.76,0.424,5.16082632133765e-10,"AT3G46440",NA,NA,"UXS5","chloroplast, cytoplasm, cytosol, D-xylose metabolic process, NAD+ binding, plasma membrane, UDP-D-xylose biosynthetic process, UDP-glucuronate decarboxylase activity, xylan biosynthetic process"
"Chir06Ox-b25980.2",7.70182132126637e-18,0.467125891079843,0.788,0.424,1.51417807176097e-13,"AT5G13490",NA,NA,"AAC2","ATP:ADP antiporter activity, chloroplast envelope, copper ion binding, mitochondrial ADP transmembrane transport, mitochondrial ATP transmembrane transport, mitochondrial envelope, mitochondrial inner membrane, mitochondrion, plant-type vacuole, plastid, protein binding, purine nucleotide transport"
"Chir07Ox-b35550.2",1.69013425555853e-15,0.415710797059688,0.75,0.424,3.32280394642806e-11,"AT4G38100",NA,NA,"CURT1D","biological_process, chloroplast, chloroplast thylakoid membrane, molecular_function, thylakoid"
"Chir04Ox-b20770.2",2.37307535732163e-17,0.606487410383801,0.808,0.426,4.66546615249433e-13,"AT2G38310",NA,NA,"PYL4","abscisic acid binding, abscisic acid-activated signaling pathway, cytoplasm, nucleus, plant-type vacuole membrane, plasma membrane, protein binding, protein homodimerization activity, protein phosphatase inhibitor activity, regulation of protein serine/threonine phosphatase activity, signaling receptor activity, ubiquitin-like protein ligase binding"
"Chir03Ox-b10250.2",3.18088383294723e-13,0.352921119779319,0.731,0.427,6.25361761557426e-09,NA,NA,NA,NA,NA
"Chir08Ox-b04270.2",1.50165841676624e-37,0.722457770115998,0.923,0.437,2.95226044736243e-33,"AT4G05020",NA,NA,"NDB2","alternative oxidase activity, alternative respiration, calcium ion binding, extrinsic component of mitochondrial inner membrane, mitochondrial intermembrane space, mitochondrion, NADH dehydrogenase activity, NADH oxidation, oxidoreductase activity"
"Chir03Ox-b28850.2",6.66086464872319e-56,1.39819671260263,0.923,0.438,1.30952598993898e-51,"AT2G14740",NA,NA,"ATVSR3","calcium ion binding, endosome, Golgi apparatus, Golgi cis cisterna, Golgi to vacuole transport, Golgi transport complex, membrane, mitochondrion, protein targeting to vacuole, trans-Golgi network, ubiquitin protein ligase activity, ubiquitin-dependent protein catabolic process"
"Chir08Ox-b27660.2",6.03389194591129e-11,0.254090867863906,0.76,0.441,1.18626315656616e-06,"AT5G65000",NA,NA,"TEX2","chloroplast, endoplasmic reticulum, negative regulation of cytokinin dehydrogenase activity, negative regulation of ER-associated ubiquitin-dependent protein catabolic process, pollen exine formation, protein binding, regulation of shoot apical meristem development, sialic acid transmembrane transporter activity, sialic acid transport, UDP-N-acetylgalactosamine transmembrane transport, UDP-N-acetylgalactosamine transmembrane transporter activity, UDP-N-acetylglucosamine transmembrane transport"
"Chir02Ox-b17800.2",5.43750425087113e-18,0.469067779553498,0.788,0.442,1.06901333572126e-13,"AT1G71220",NA,NA,"EBS1","anthocyanin-containing compound metabolic process, chloroplast, endoplasmic reticulum, ER-associated misfolded protein catabolic process, glycosyltransferase activity, mitochondrion, plant-type hypersensitive response, protein glycosylation, protein N-linked glycosylation via asparagine, response to salicylic acid, UDP-glucose:glycoprotein glucosyltransferase activity, unfolded protein binding"
"Chir03Ox-b24270.2",1.56036701545398e-18,0.431754973779096,0.779,0.445,3.06768155238253e-14,"AT3G24150",NA,NA,"KIX8","meristem development, negative regulation of gene expression, nucleus, regulation of DNA-templated transcription, transcription coregulator activity"
"Chir06Ox-b13200.2",9.16768420699943e-51,1.13536271934407,0.962,0.445,1.80236671509609e-46,"AT5G26600",NA,NA,NA,"auxin metabolic process, cell wall organization or biogenesis, cellular catabolic process, chloroplast, defense response to bacterium, defense response to fungus, glucosinolate metabolic process, jasmonic acid mediated signaling pathway, molecular_function, monocarboxylic acid biosynthetic process, organonitrogen compound catabolic process, regulation of defense response, response to ethylene, response to wounding, tryptophan metabolic process"
"Chir01Ox-b26160.2",1.08838337324154e-38,0.948053524217788,0.875,0.446,2.13976171179287e-34,"AT1G27350",NA,NA,"F17L21.31","cellular catabolic process, endoplasmic reticulum unfolded protein response, mitochondrion, molecular_function, organonitrogen compound catabolic process, response to inorganic substance, response to organic cyclic compound, response to organonitrogen compound, small molecule metabolic process"
"Chir07Ox-b35080.2",3.95343810872789e-13,0.356151829893635,0.779,0.446,7.77245932175904e-09,"AT4G37660",NA,NA,"F19F18.150","mitochondrion, mRNA binding, structural constituent of ribosome, translation"
"Chir07Ox-b14150.2",9.73761278541026e-33,0.572965033246862,0.894,0.447,1.91441467361166e-28,"AT4G17420",NA,NA,"AT4G17420.1","chloroplast, endoplasmic reticulum, endoplasmic reticulum unfolded protein response, Hrd1p ubiquitin ligase complex, protein binding, regulation of ERAD pathway"
"Chir05Ox-b23250.2",2.86536228311592e-11,0.384386900376954,0.788,0.45,5.63330224860591e-07,"AT3G57550",NA,NA,"AGK2","cytoplasm, cytosol, gametophyte development, guanylate kinase activity, nucleotide metabolic process, regulation of developmental growth"
"Chir07Ox-b35310.2",4.58206058951815e-40,1.31635675714982,0.923,0.45,9.00833111899269e-36,"AT4G37870",NA,NA,"PCK1","cellular response to phosphate starvation, cytoplasm, cytosol, gluconeogenesis, nucleolus, phosphoenolpyruvate carboxykinase (ATP) activity"
"Chir01Ox-b24560.2",1.71693699398291e-22,0.562534111164204,0.817,0.454,3.3754981301704e-18,"AT1G26690",NA,NA,"T24P13.7","COPII-coated ER to Golgi transport vesicle, endoplasmic reticulum, endoplasmic reticulum to Golgi vesicle-mediated transport, endoplasmic reticulum-Golgi intermediate compartment, extracellular region, Golgi apparatus, Golgi organization, intracellular protein transport, molecular_function"
"Chir08Ox-b11000.2",2.74315957012342e-32,0.604571652041357,0.885,0.455,5.39305171486264e-28,"AT5G50000",NA,NA,"CBC2","ATP binding, cell differentiation, cytoplasm, developmental growth, plasma membrane, plasmodesma, plastid, protein binding, protein kinase activity, protein phosphorylation, protein serine/threonine kinase activity, protein serine/threonine/tyrosine kinase activity"
"Chir04Ox-b14980.2",6.03154800757308e-12,0.30059389397526,0.779,0.456,1.18580233828887e-07,"AT2G32970",NA,NA,"T21L14.9","biological_process, cellular_component, molecular_function"
"Chir06Ox-b11480.2",1.56511036417594e-22,0.51894224333091,0.856,0.456,3.0770069759699e-18,"AT5G28040","Yes","GeBP","VFP4","cytoplasm, defense response to bacterium, nucleus, protein binding, regulation of DNA-templated transcription, transcription cis-regulatory region binding"
"Chir07Ox-b21600.2",3.28479436342258e-26,0.520343036820795,0.846,0.458,6.45790571848879e-22,"AT4G24550",NA,NA,"AP4M","AP-4 adaptor complex, clathrin adaptor complex, cytoplasmic vesicle, cytosol, Golgi to lysosome transport, protein targeting, trans-Golgi network, vesicle-mediated transport"
"Chir02Ox-b15440.2",1.25988426055349e-12,0.314214279575722,0.788,0.459,2.47693245624817e-08,"AT1G69010","Yes","bHLH","AT1G69010.1","DNA-binding transcription factor activity, DNA-templated transcription, identical protein binding, nucleus, protein binding, protein dimerization activity, transcription cis-regulatory region binding"
"Chir04Ox-b09230.2",1.14447034992017e-29,0.575511676128129,0.894,0.463,2.25002870794306e-25,"AT2G27860",NA,NA,"AT2G27860.1","cytoplasm, cytosol, Golgi apparatus, NAD binding, nucleotide-sugar biosynthetic process, peroxisome, UDP-glucuronate decarboxylase activity"
"Chir06Ox-b08940.2",7.13221405845406e-51,1.98900361935006,0.952,0.467,1.40219328389207e-46,NA,NA,NA,NA,NA
"Chir06Ox-b35860.2",4.57303802455154e-48,1.34984029963812,0.904,0.467,8.99059275626834e-44,"AT5G03160",NA,NA,"ATP58IPK","endoplasmic reticulum, endoplasmic reticulum lumen, positive regulation by host of viral process"
"Chir07Ox-b34070.2",1.7172556618123e-16,0.772280619534181,0.846,0.467,3.37612463112298e-12,"AT1G19397",NA,NA,NA,"biological_process, mitochondrion, molecular_function"
"Chir01Ox-b20420.2",8.74903994808457e-36,0.782725372633105,0.856,0.468,1.72006125379343e-31,"AT1G20575",NA,NA,"DPMS1","dolichol metabolic process, dolichol-phosphate-mannose synthase complex, dolichyl-phosphate beta-D-mannosyltransferase activity, endoplasmic reticulum, endoplasmic reticulum membrane, GPI anchor biosynthetic process, protein O-linked mannosylation, response to ammonium ion"
"Chir03Ox-b15480.2",4.1946268974202e-11,0.304047030035641,0.808,0.468,8.24663648032811e-07,"AT3G15710",NA,NA,"MSJ11.11","chloroplast, endoplasmic reticulum, peptidase activity, plant-type vacuole, plasma membrane, serine-type endopeptidase activity, signal peptidase complex, signal peptide processing"
"Chir04Ox-b22200.2",7.84144666643973e-33,0.676665725032719,0.875,0.469,1.54162841462205e-28,"AT2G39630",NA,NA,"F12L6.29","dolichyl-phosphate beta-glucosyltransferase activity, endoplasmic reticulum, endoplasmic reticulum membrane, extracellular region, protein N-linked glycosylation"
"Chir07Ox-b32100.2",1.05942647542608e-11,0.310630356388372,0.788,0.469,2.08283245068768e-07,"AT4G34630",NA,NA,"T4L20.210","molecular_function, organic acid biosynthetic process, plant-type cell wall organization or biogenesis, response to blue light, response to jasmonic acid, response to wounding, tryptophan metabolic process"
"Chir01Ox-b08740.2",1.99744515002228e-14,0.381190764648833,0.779,0.471,3.9269771649438e-10,NA,NA,NA,NA,NA
"Chir06Ox-b30880.2",8.48021046643961e-13,0.33364559414258,0.808,0.477,1.66720937770203e-08,"AT5G08130","Yes","bHLH","BIM1","brassinosteroid mediated signaling pathway, DNA binding, DNA-binding transcription factor activity, DNA-templated transcription, identical protein binding, nucleus, positive regulation of shade avoidance, protein binding, protein dimerization activity, regulation of DNA-templated transcription, transcription cis-regulatory region binding"
"Chir03Ox-b21560.2",1.7985540929705e-12,0.430215123588819,0.788,0.478,3.53595734678e-08,"AT3G21400",NA,NA,"MHC9.8","cytosol, mitochondrion, molecular_function"
"Chir06Ox-b07690.2",2.76269422782854e-16,0.574597810322889,0.837,0.481,5.43145685191092e-12,"AT5G42570",NA,NA,"K16E1.4","chloroplast, endoplasmic reticulum, endoplasmic reticulum membrane, endoplasmic reticulum to Golgi vesicle-mediated transport, molecular_function, plant-type vacuole, plasmodesma, plastid"
"Chir07Ox-b26410.2",3.31639632270616e-38,1.27588556842777,0.894,0.482,6.5200351704403e-34,"AT4G29190","Yes","C3H","AtOZF2","DNA-binding transcription factor activity, nucleus, plasma membrane, regulation of DNA-templated transcription"
"Chir04Ox-b01740.2",2.09914101487388e-11,0.295459743028706,0.817,0.484,4.12691123524205e-07,"AT2G22425",NA,NA,NA,"molecular_function, protein targeting to ER, signal peptidase complex, signal peptide processing, unidimensional cell growth"
