"","gene_ID","AT_ID","Gene_code_name","avg_log2FC","pct.1","pct.2","p_val","p_val_adj","TF","TF_family","Gene_functions","source"
"Chir05Ox-b18300.2","Chir05Ox-b18300.2","AT3G52770","ZPR3",0.250661251883071,0.225,0.072,2.12308452985159e-177,4.17398418568822e-173,NA,NA,"adaxial/abaxial axis specification, leaf shaping, leaf vascular tissue pattern formation, meristem maintenance, negative regulation of DNA-binding transcription factor activity, nucleus, protein binding, regulation of meristem growth","GEP_43and DEGs"
"Chir03Ox-b33620.2","Chir03Ox-b33620.2","AT2G18969","HLH3",0.386324504902966,0.343,0.086,0,0,NA,NA,"molecular_function, nucleus, regulation of DNA-templated transcription","GEP_43and DEGs"
"Chir07Ox-b23230.2","Chir07Ox-b23230.2","AT4G26150","GATA22",0.295067930258705,0.369,0.131,1.14515653995272e-278,2.25137775754705e-274,"Yes","GATA","chloroplast elongation, chloroplast organization, circadian rhythm, cytokinin-activated signaling pathway, DNA-binding transcription factor activity, gibberellic acid mediated signaling pathway, negative regulation of flower development, negative regulation of gibberellic acid mediated signaling pathway, negative regulation of seed germination, nucleus, plant organ senescence, positive regulation of chlorophyll biosynthetic process, protein binding, regulation of carbohydrate utilization, regulation of chlorophyll biosynthetic process, regulation of DNA-templated transcription, regulation of gene expression, regulation of photoperiodism, flowering, regulation of seed development, regulation of seed germination, response to auxin, response to cytokinin, response to gibberellin, response to light stimulus, response to nitrate, response to red light, transcription cis-regulatory region binding, zinc ion binding","GEP_43"
"Chir01Ox-b12050.2","Chir01Ox-b12050.2","AT1G12090","ELP",0.70865174053217,0.454,0.186,1.63953988599271e-272,3.22333541586167e-268,NA,NA,"biological_process, cellular_component, molecular_function","GEP_43"
"Chir01Ox-b14670.2","Chir01Ox-b14670.2","AT1G14600","AT1G14600.1",0.34617967990127,0.493,0.191,0,0,"Yes","G2-like","DNA-binding transcription factor activity, nucleus, regulation of DNA-templated transcription","GEP_43and DEGs"
"Chir01Ox-b05100.2","Chir01Ox-b05100.2","AT1G05835",NA,0.723235389668114,0.656,0.307,0,0,NA,NA,"cell fate determination, cellular_component, molecular_function, plant-type cell wall organization or biogenesis, tissue development","GEP_43and DEGs"
"Chir01Ox-b12060.2","Chir01Ox-b12060.2","AT1G12100","AT1G12100.1",0.390268986276773,0.618,0.335,6.05098890365949e-185,1.18962441845946e-180,NA,NA,"cellular developmental process, extracellular region, organelle organization, seed development, small molecule metabolic process","GEP_43"
"Chir03Ox-b00610.2","Chir03Ox-b00610.2","AT3G01500","CA1",1.55782794864009,0.672,0.351,0,0,NA,NA,"apoplast, carbon utilization, carbonate dehydratase activity, chloroplast, chloroplast envelope, chloroplast stroma, chloroplast thylakoid membrane, cytoplasm, cytosol, mRNA binding, negative regulation of stomatal complex development, photosynthesis, plasma membrane, regulation of stomatal movement, response to carbon dioxide, response to cold, stromule, thylakoid, zinc ion binding","GEP_43and DEGs"
"Chir06Ox-b11160.2","Chir06Ox-b11160.2","AT5G49450","AtbZIP1",0.362689198332392,0.65,0.38,5.15638980294044e-192,1.01374623525809e-187,"Yes","bZIP","anther dehiscence, cellular response to glucose stimulus, cellular response to starvation, DNA-binding transcription factor activity, nucleus, positive regulation of DNA-templated transcription, protein binding, protein heterodimerization activity, regulation of cellular amino acid metabolic process, response to bacterium, response to osmotic stress, response to salt stress, sequence-specific DNA binding, sugar mediated signaling pathway, transcription cis-regulatory region binding","GEP_43"
"Chir08Ox-b02870.2","Chir08Ox-b02870.2","AT4G02700","SULTR3;2",0.469088195775932,0.678,0.432,9.1003813236794e-160,1.78913496823537e-155,NA,NA,"chloroplast, secondary active sulfate transmembrane transporter activity, sulfate transmembrane transporter activity","GEP_43"
"Chir01Ox-b40890.2","Chir01Ox-b40890.2","AT1G52040","ATMBP",1.5860137126638,0.177,0.059,3.33870253356537e-133,6.56388918098951e-129,NA,NA,"cytoplasm, defense response, nucleus, plant-type vacuole","DEGs"
"Chir05Ox-b05920.2","Chir05Ox-b05920.2","AT3G28220","AT3G28220.1",1.29157978465989,0.249,0.083,2.56577699341588e-199,5.04431756905563e-195,NA,NA,"alpha-amino acid metabolic process, amine metabolic process, cellular component assembly, chloroplast envelope, cytosol, nucleus, plant-type vacuole, response to jasmonic acid, response to wounding, secondary metabolic process","DEGs"
"Chir01Ox-b40930.2","Chir01Ox-b40930.2",NA,NA,1.19911213908396,0.678,0.308,0,0,NA,NA,NA,"DEGs"
"Chir01Ox-b40880.2","Chir01Ox-b40880.2",NA,NA,1.37703831953107,0.726,0.361,0,0,NA,NA,NA,"DEGs"
"Chir01Ox-b08930.2","Chir01Ox-b08930.2","AT1G09340","CRB",1.11808618124238,0.937,0.625,0,0,NA,NA,"apoplast, cellular response to water deprivation, chloroplast, chloroplast envelope, chloroplast organization, chloroplast stroma, circadian rhythm, cytosol, DNA binding, extracellular region, Golgi apparatus, heteropolysaccharide binding, monosaccharide metabolic process, mRNA binding, peroxisome, plant-type vacuole, plasmodesma, plastid translation, plastid-encoded plastid RNA polymerase complex, plastoglobule, positive regulation of DNA-templated transcription, positive regulation of translation, protein binding, regulation of gene expression, response to cold, response to wounding, ribosome, RNA binding, rRNA processing, stromule","DEGs"
"Chir04Ox-b09790.2","Chir04Ox-b09790.2",NA,NA,0.973892520578635,0.937,0.568,0,0,NA,NA,NA,"DEGs"
"Chir03Ox-b22180.2","Chir03Ox-b22180.2","AT3G22142",NA,0.774973303366448,0.995,0.691,0,0,NA,NA,"cell differentiation, cellular_component, molecular_function, root development, shoot system development, tissue development","DEGs"
"Chir02Ox-b21810.2","Chir02Ox-b21810.2","AT1G74880","NDH-O",0.74381868142796,0.912,0.537,0,0,NA,NA,"chloroplast, chloroplast thylakoid membrane, mitochondrion, NAD(P)H dehydrogenase complex (plastoquinone), oxidoreductase activity, acting on NAD(P)H, quinone or similar compound as acceptor, plasma membrane","DEGs"
"Chir02Ox-b20340.2","Chir02Ox-b20340.2",NA,NA,0.710841587744236,0.199,0.076,2.4891865102205e-122,4.8937406790935e-118,NA,NA,NA,"DEGs"
"Chir05Ox-b05320.2","Chir05Ox-b05320.2",NA,NA,0.701961506448504,0.959,0.653,0,0,NA,NA,NA,"DEGs"
