"gene_ID","p_val","avg_log2FC","pct.1","pct.2","p_val_adj","AT_ID","TF","TF_family","Gene_code_name","Gene_functions"
"Chir05Ox-b03500.2",0,0.269683741389205,0.222,0.012,0,NA,NA,NA,NA,NA
"Chir08Ox-b22580.2",0,0.294483294772789,0.286,0.013,0,NA,NA,NA,NA,NA
"Chir06Ox-b35150.2",0,0.37969248310347,0.178,0.014,0,"AT5G67651","Yes",NA,"RCO","Leaf Complexity"
"Chir06Ox-b35140.2",0,0.299272890552518,0.185,0.016,0,NA,NA,NA,NA,NA
"Chir03Ox-b19030.2",0,0.348050254816418,0.29,0.02,0,"AT3G19200",NA,NA,"MVI11.12","defense response to other organism, molecular_function, nucleus"
"Chir06Ox-b35870.2",0,0.407246654131783,0.338,0.021,0,"AT5G03150","Yes","C2H2","JKD","asymmetric cell division, DNA-binding transcription factor activity, nucleus, positive regulation of DNA-templated transcription, protein binding, protein homodimerization activity, regulation of cell division, regulation of DNA-templated transcription, regulation of epidermal cell differentiation, regulation of meristem growth, root development, sequence-specific DNA binding"
"Chir01Ox-b13690.2",0,0.745217454578922,0.212,0.025,0,"AT1G13710",NA,NA,"CYP78A5","chloroplast, endoplasmic reticulum, floral organ development, heme binding, iron ion binding, leaf formation, organ growth, oxidoreductase activity, acting on paired donors, with incorporation or reduction of molecular oxygen, positive regulation of cell population proliferation, positive regulation of organ growth, regulation of growth rate, regulation of meristem growth"
"Chir03Ox-b23410.2",3.69042216303288e-290,0.42436688583989,0.182,0.025,7.25536997252263e-286,"AT3G23290",NA,NA,"LSH4","mitochondrion, mRNA transcription, nucleus, post-embryonic plant morphogenesis, response to light stimulus"
"Chir05Ox-b14670.2",1.15005438068489e-186,0.317496534104874,0.155,0.028,2.2610069124265e-182,"AT3G49620",NA,NA,"AT3G49620.1","aging, cellular response to starvation, cytoplasm, dioxygenase activity"
"Chir08Ox-b07590.2",0,0.700892319089423,0.328,0.028,0,"AT4G10640",NA,NA,"ABS6","biological_process, calmodulin binding, microtubule, nucleus, plasma membrane, protein binding"
"Chir08Ox-b09120.2",0,0.289333646822157,0.293,0.028,0,NA,NA,NA,NA,NA
"Chir05Ox-b16230.2",0,0.520495385017822,0.309,0.032,0,"AT3G50870","Yes","GATA","HAN","cotyledon development, DNA-binding transcription activator activity, RNA polymerase II-specific, DNA-binding transcription factor activity, embryo development ending in seed dormancy, flower development, negative regulation of DNA-templated transcription, nucleus, protein binding, protein homodimerization activity, regulation of DNA-templated transcription, regulation of flower development, regulation of meristem structural organization, sequence-specific DNA binding, zinc ion binding"
"Chir01Ox-b42060.2",0,0.371289524126017,0.325,0.033,0,"AT1G53180",NA,NA,"F12M16.8","hormone-mediated signaling pathway, molecular_function, nucleus, protein localization, regulation of signal transduction"
"Chir01Ox-b35290.2",0,0.53556099988031,0.352,0.035,0,"AT1G44830","Yes","ERF","AtERF014","DNA-binding transcription factor activity, jasmonic acid and ethylene-dependent systemic resistance, nucleus, positive regulation of DNA-templated transcription, regulation of innate immune response, regulation of pectin biosynthetic process, salicylic acid mediated signaling pathway, transcription cis-regulatory region binding"
"Chir02Ox-b16340.2",0,0.282089693815817,0.33,0.036,0,"AT1G69850",NA,NA,"ATNRT1:2","abscisic acid transmembrane transporter activity, abscisic acid transport, nucleus, plasma membrane, protein binding, regulation of stomatal movement, response to nematode, transmembrane transport"
"Chir01Ox-b41040.2",9.7948061672089e-182,0.358114262659188,0.181,0.038,1.92565889247327e-177,"AT1G52190",NA,NA,"NRT1.11","low-affinity nitrate transmembrane transporter activity, nitrate transmembrane transport, nucleus, plasma membrane"
"Chir07Ox-b21340.2",0,0.293137339112994,0.304,0.04,0,"AT4G24275",NA,NA,NA,"molecular_function, nucleus, response to water deprivation"
"Chir01Ox-b13370.2",2.41070191038221e-301,0.311562875905818,0.24,0.044,4.73943995581142e-297,"AT1G13400",NA,NA,"NUB","anther development, carpel development, DNA-binding transcription factor activity, nucleus, stamen development"
"Chir01Ox-b14900.2",0,0.475477013571876,0.323,0.046,0,"AT1G14760",NA,NA,"KNATM","cytoplasm, DNA binding, leaf proximal/distal pattern formation, nucleus, positive regulation of DNA-templated transcription"
"Chir04Ox-b12980.2",0,0.268852187615317,0.318,0.046,0,"AT2G31160",NA,NA,"LSH3","maintenance of shoot apical meristem identity, mRNA transcription, nucleus, organ boundary specification between lateral organs and the meristem, petal development, post-embryonic plant morphogenesis, response to light stimulus, specification of petal number"
"Chir03Ox-b30470.2",0,0.536151798848977,0.401,0.047,0,"AT2G16580",NA,NA,"SAUR8","mitochondrion, molecular_function, response to abscisic acid, response to auxin"
"Chir03Ox-b19330.2",0,0.316780340927989,0.284,0.054,0,"AT3G19500","Yes","bHLH","MLD14.24","DNA-binding transcription factor activity, DNA-binding transcription factor activity, RNA polymerase II-specific, nucleus, protein dimerization activity, regulation of DNA-templated transcription, regulation of transcription by RNA polymerase II, RNA polymerase II cis-regulatory region sequence-specific DNA binding"
"Chir01Ox-b24160.2",0,0.581689236548918,0.41,0.057,0,"AT1G27020",NA,NA,"T7N9.8","cytosol, defense response to bacterium, defense response to fungus, molecular_function, nucleus, oxoacid metabolic process, regulation of biological quality, response to wounding"
"Chir07Ox-b25110.2",2.59713276466959e-256,0.255246219316237,0.264,0.058,5.10596301534041e-252,"AT4G27950","Yes","ERF","AT4G27950.1","DNA-binding transcription factor activity, leaf development, nucleus, protein binding, regulation of DNA-templated transcription"
"Chir07Ox-b35240.2",0,0.796376567086308,0.442,0.058,0,"AT4G37800",NA,NA,"XTH7","cell wall biogenesis, cellular component biogenesis, extracellular region, hydrolase activity, hydrolyzing O-glycosyl compounds, plant-type cell wall organization or biogenesis, polysaccharide binding, xyloglucan metabolic process, xyloglucan:xyloglucosyl transferase activity"
"Chir03Ox-b20060.2",0,0.326344103581179,0.377,0.059,0,NA,NA,NA,NA,NA
"Chir05Ox-b02030.2",5.34641895279439e-176,0.264293516399997,0.234,0.06,1.05110596611938e-171,NA,NA,NA,NA,NA
"Chir01Ox-b16570.2",2.33751452315353e-194,0.290297506598922,0.24,0.061,4.59555355251984e-190,"AT1G16530","Yes","LBD","LBD3","cell differentiation, nucleus, root morphogenesis, tissue development, transcription cis-regulatory region binding"
"Chir01Ox-b03040.2",2.92756353987004e-48,0.266550174091409,0.145,0.062,5.7555899193845e-44,"AT1G03940",NA,NA,"AT1G03940.1","anthocyanin-containing compound biosynthetic process, cytoplasm, regulation of flavonoid biosynthetic process, response to jasmonic acid"
"Chir01Ox-b19910.2",0,0.303394705582672,0.386,0.063,0,"AT1G20010",NA,NA,"TUB5","chloroplast stroma, cytoplasm, cytosol, GTP binding, GTPase activity, microtubule, microtubule cytoskeleton organization, microtubule-based process, mitotic cell cycle, mRNA binding, nucleus, plant-type cell wall, plant-type vacuole, plasma membrane, protein binding, structural constituent of cytoskeleton, tubulin complex"
"Chir08Ox-b16470.2",6.9839342781256e-41,0.258990893757314,0.142,0.063,1.37304147907949e-36,"AT5G54510",NA,NA,"GH3.6","acid-amino acid ligase activity, auxin homeostasis, auxin-activated signaling pathway, cytoplasm, indole-3-acetic acid amido synthetase activity, nucleus, response to auxin, unidimensional cell growth"
"Chir04Ox-b20280.2",1.24491284123407e-294,0.543887288660216,0.294,0.067,2.44749864586618e-290,NA,NA,NA,NA,NA
"Chir06Ox-b10180.2",0,0.320604402134386,0.316,0.068,0,"AT5G48900",NA,NA,"AT5G48900.1","cellular developmental process, developmental growth, extracellular region, lipid metabolic process, lyase activity, pectate lyase activity, pectin catabolic process, response to auxin, response to red or far red light"
"Chir01Ox-b23400.2",0,0.265483632462975,0.348,0.069,0,"AT1G23560",NA,NA,"F28C11.32","cell differentiation, molecular_function, nucleus, root morphogenesis, tissue development"
"Chir07Ox-b11520.2",0,1.25032866107276,0.514,0.071,0,"AT4G15210",NA,NA,"ATBETA-AMY","amylopectin maltohydrolase activity, beta-amylase activity, extracellular region, response to herbivore, secretory vesicle, starch catabolic process"
"Chir03Ox-b30070.2",0,0.448024483008885,0.363,0.073,0,NA,NA,NA,NA,NA
"Chir01Ox-b42810.2",9.74888387197745e-277,0.606661783508934,0.307,0.074,1.91663056923077e-272,"AT1G53903",NA,NA,NA,"hormone-mediated signaling pathway, mitochondrion, molecular_function, response to light intensity, response to wounding"
"Chir01Ox-b29650.2",0,0.49163611413985,0.476,0.077,0,"AT1G31040",NA,NA,"PLATZ3","leaf development, leaf senescence, mitochondrion, nucleus, response to auxin, response to cytokinin"
"Chir06Ox-b04340.2",3.02663383507725e-205,0.451526778605354,0.28,0.078,5.95036211976187e-201,"AT5G44578",NA,NA,"PROSCOOP9","biological_process, endoplasmic reticulum, extracellular region, mitochondrion, molecular_function"
"Chir06Ox-b21550.2",0,0.379793022061796,0.392,0.078,0,"AT5G17760",NA,NA,"MVA3.110","cellular catabolic process, cytoplasm, defense response to bacterium, defense response to fungus, molecular_function, plasma membrane, protein catabolic process, response to abscisic acid, response to heat, response to inorganic substance, response to jasmonic acid, response to molecule of bacterial origin, response to salicylic acid"
"Chir01Ox-b28850.2",0,0.276794457467514,0.407,0.086,0,"AT1G30330","Yes","ARF","AT1G30330.1","DNA-binding transcription factor activity, flower development, nucleus, protein binding, regulation of DNA-templated transcription, response to auxin"
"Chir05Ox-b20810.2",3.86961446846297e-234,0.687361941883756,0.311,0.087,7.60766204499819e-230,"AT3G55240",NA,NA,"T26I12.120","chloroplast, developmental process, molecular_function"
"Chir06Ox-b17160.2",9.03815944256137e-199,1.11253107277627,0.295,0.088,1.77690214640756e-194,"AT5G22580",NA,NA,"AT5G22580.1","chloroplast, cytosol, defense response to other organism, plastid, regulation of hormone levels, tissue development"
"Chir08Ox-b06850.2",0,2.78190382574622,0.6,0.088,0,"AT4G11320",NA,NA,"CP2","cysteine-type endopeptidase activity, extracellular region, extracellular space, lysosome, peptidase activity, proteolysis, proteolysis involved in protein catabolic process"
"Chir01Ox-b24510.2",2.9722813656296e-153,0.275652634177445,0.276,0.089,5.8435051648278e-149,"AT1G26730",NA,NA,"T24P13.11","cellular response to phosphate starvation, cytoplasm, Golgi apparatus, inositol hexakisphosphate binding, phosphate ion transmembrane transporter activity, phosphate ion transport, plasma membrane, trans-Golgi network"
"Chir02Ox-b03920.2",5.10345488801234e-163,0.429940021042459,0.278,0.089,1.00333923098323e-158,"AT1G61810",NA,NA,"BGLU45","beta-glucosidase activity, carbohydrate metabolic process, coniferin beta-glucosidase activity, extracellular region, hydrolase activity, hydrolyzing O-glycosyl compounds, lignin biosynthetic process, plasma membrane, scopolin beta-glucosidase activity"
"Chir06Ox-b28700.2",0,0.3699802002425,0.36,0.089,0,"AT5G10570","Yes","bHLH","F12B17.80","DNA-binding transcription factor activity, nucleus, protein dimerization activity, regulation of DNA-templated transcription, sequence-specific DNA binding"
"Chir08Ox-b28070.2",2.87295314426416e-139,0.259259339267298,0.267,0.091,5.64822588162334e-135,"AT5G65390",NA,NA,"AT5G65390.1","cell differentiation, cell wall organization or biogenesis, developmental growth, membrane, plant epidermis development, plasma membrane, root morphogenesis"
"Chir06Ox-b04370.2",2.58549787310598e-143,0.481486271522739,0.273,0.093,5.08308881852636e-139,"AT5G44572",NA,NA,"PROSCOOP6","defense response to insect, endoplasmic reticulum, extracellular region, molecular_function, response to wounding"
"Chir06Ox-b11590.2",0,0.521902997168001,0.419,0.093,0,"AT5G28490",NA,NA,"LSH1","mRNA transcription, nucleus, post-embryonic plant morphogenesis, response to blue light, response to far red light, response to light stimulus, response to red light, unidimensional cell growth"
"Chir05Ox-b09870.2",1.05556479675731e-62,0.641717038490934,0.207,0.095,2.07524039042486e-58,NA,NA,NA,NA,NA
"Chir01Ox-b06960.2",0,0.279642825670003,0.374,0.096,0,NA,NA,NA,NA,NA
"Chir08Ox-b08610.2",1.70386374708871e-93,0.39047884988253,0.238,0.096,3.3497961267764e-89,"AT4G09820","Yes","bHLH","BHLH42","DNA-binding transcription factor activity, jasmonic acid mediated signaling pathway, nucleus, positive regulation of anthocyanin biosynthetic process, protein binding, protein dimerization activity, regulation of flavonoid biosynthetic process, regulation of proanthocyanidin biosynthetic process, seed coat development, seed development, transcription cis-regulatory region binding, trichome differentiation"
"Chir01Ox-b18920.2",0,0.38484737194373,0.412,0.103,0,"AT1G18870",NA,NA,"ICS2","biosynthetic process, chloroplast, isochorismate synthase activity, phylloquinone biosynthetic process, plastid, salicylic acid biosynthetic process"
"Chir08Ox-b18120.2",0,0.272890034762795,0.431,0.104,0,"AT5G56140",NA,NA,"KH29","cytoplasm, mRNA binding, nucleus, plasma membrane, regulation of mRNA splicing, via spliceosome, response to abscisic acid, response to salicylic acid"
"Chir08Ox-b23810.2",0,0.757472738988369,0.499,0.107,0,"AT5G61290",NA,NA,"MFB13.9","alpha-amino acid metabolic process, chloroplast, defense response, flavin adenine dinucleotide binding, flavonoid metabolic process, glucosinolate metabolic process, N,N-dimethylaniline monooxygenase activity, NADP binding, plant-type secondary cell wall biogenesis, response to wounding"
"Chir02Ox-b14000.2",0,1.15420024220515,0.566,0.111,0,"AT1G67750",NA,NA,"AT1G67750.1","extracellular region, meiotic cell cycle process, mitochondrion, pectate lyase activity, pectin catabolic process, response to nutrient levels"
"Chir02Ox-b13550.2",0,0.434588286614173,0.518,0.129,0,"AT1G67400",NA,NA,"ELMOD_C","chloroplast, ethylene-activated signaling pathway, molecular_function"
"Chir03Ox-b05480.2",0,0.462755191533504,0.537,0.147,0,"AT3G05980",NA,NA,"F2O10.6","anatomical structure maturation, cell differentiation, developmental growth, meristem development, molecular_function, nucleus, oxoacid metabolic process, pattern specification process, plant organ morphogenesis, reproductive shoot system development, response to inorganic substance, root development"
"Chir05Ox-b12990.2",0,0.703009364249084,0.573,0.15,0,"AT3G48100",NA,NA,"ARR5","circadian rhythm, cytokinin-activated signaling pathway, cytoplasm, nucleus, phosphorelay response regulator activity, protein binding, regulation of DNA-templated transcription, response to cytokinin, response to red light"
"Chir04Ox-b25400.2",0,1.53833766319912,0.772,0.159,0,"AT2G42610",NA,NA,"LSH10","cellular developmental process, glucosinolate metabolic process, molecular_function, mRNA transcription, nucleus, oxoacid metabolic process, post-embryonic plant morphogenesis, regionalization, response to light intensity, response to light stimulus, stomatal complex development"
"Chir08Ox-b28310.2",3.97548120415938e-303,0.399296659023425,0.477,0.161,7.81579604737733e-299,"AT5G65640","Yes","bHLH","bHLH093","DNA-binding transcription factor activity, gibberellin catabolic process, nucleus, protein dimerization activity, regulation of DNA-templated transcription, regulation of gibberellin biosynthetic process, sequence-specific DNA binding"
"Chir01Ox-b01170.2",0,0.332765493379299,0.495,0.162,0,"AT1G01110",NA,NA,"IQD18","cell division, developmental growth, flower development, meiotic cell cycle process, molecular_function, nucleus, phyllome development, seed development, shoot system morphogenesis"
"Chir02Ox-b02980.2",0,2.99382186255408,0.772,0.174,0,"AT1G62480",NA,NA,"AT1G62480.1","cytosol, nucleus"
"Chir03Ox-b32220.2",4.87522700877914e-286,0.393049220022756,0.509,0.184,9.58469629925979e-282,"AT2G17770","Yes","bZIP","ATBZIP27","DNA-binding transcription factor activity, nucleus, positive regulation of DNA-templated transcription, protein binding, protein self-association, regulation of photoperiodism, flowering"
"Chir05Ox-b11620.2",0,0.678175436024751,0.6,0.185,0,"AT3G46490",NA,NA,"F12A12.10","cytoplasm, molecular_function, plant epidermis development"
"Chir06Ox-b14320.2",9.88572956933681e-248,0.484681839546267,0.495,0.19,1.94353443333162e-243,"AT5G25460",NA,NA,"DGR2","extracellular region, molecular_function, plant-type cell wall, plasmodesma, plastid, root morphogenesis"
"Chir06Ox-b00490.2",0,0.637708618584298,0.562,0.204,0,"AT5G47370","Yes","HD-ZIP","HAT2","auxin-activated signaling pathway, DNA binding, DNA-binding transcription factor activity, DNA-binding transcription factor activity, RNA polymerase II-specific, negative regulation of DNA-templated transcription, nucleus, protein binding, response to auxin, sequence-specific DNA binding, shade avoidance, unidimensional cell growth"
"Chir04Ox-b08330.2",5.98847697346146e-256,0.330534818503779,0.535,0.21,1.17733457298252e-251,NA,NA,NA,NA,NA
"Chir04Ox-b19210.2",4.47266849644765e-227,0.318890696756009,0.528,0.214,8.79326626401609e-223,"AT2G36870",NA,NA,"XTH32","carbohydrate metabolic process, cell wall biogenesis, cell wall macromolecule catabolic process, chloroplast, extracellular region, hydrolase activity, hydrolyzing O-glycosyl compounds, polysaccharide binding, xyloglucan metabolic process, xyloglucan:xyloglucosyl transferase activity"
"Chir06Ox-b20020.2",0,0.654603448627737,0.592,0.215,0,"AT5G19110",NA,NA,"T24G5.10","aspartic-type endopeptidase activity, extracellular region, proteolysis"
"Chir02Ox-b16260.2",0,0.629089734120158,0.693,0.224,0,"AT1G69780","Yes","HD-ZIP","ATHB13","cotyledon morphogenesis, DNA-binding transcription factor activity, DNA-binding transcription factor activity, RNA polymerase II-specific, leaf morphogenesis, nucleus, positive regulation of DNA-templated transcription, primary root development, response to sucrose, sequence-specific DNA binding, transcription cis-regulatory region binding"
"Chir04Ox-b18040.2",0,0.409034182418526,0.579,0.224,0,"AT2G35820",NA,NA,"F11F19.27","cytosol, mitochondrion, protein-containing complex assembly, ureidoglycolate hydrolase activity"
"Chir07Ox-b30310.2",8.90343907881929e-225,0.3223595040902,0.527,0.226,1.75041612289587e-220,"AT4G32980","Yes","TALE","ATH1","DNA binding, DNA-binding transcription factor activity, DNA-binding transcription factor activity, RNA polymerase II-specific, floral organ abscission, meristem maintenance, negative regulation of cell population proliferation, nucleus, photomorphogenesis, protein binding, regulation of gibberellin biosynthetic process, regulation of transcription by RNA polymerase II, RNA polymerase II cis-regulatory region sequence-specific DNA binding, sequence-specific DNA binding, shoot organ boundary specification, vegetative to reproductive phase transition of meristem"
"Chir03Ox-b13460.2",0,0.579725763658087,0.577,0.229,0,"AT3G13960","Yes","GRF","AtGRF5","ATP binding, DNA-templated transcription, leaf development, nucleus, protein binding, regulation of DNA-templated transcription, response to cold, response to gibberellin"
"Chir02Ox-b11660.2",0,0.797503153056409,0.702,0.242,0,"AT1G65960",NA,NA,"GAD2","calmodulin binding, cytosol, glutamate catabolic process, glutamate decarboxylase activity, glutamate metabolic process, nitrogen compound metabolic process, nucleus, pyridoxal phosphate binding"
"Chir04Ox-b18080.2",2.32269072356227e-278,0.385155954342803,0.609,0.243,4.56640996252343e-274,"AT2G35860",NA,NA,"AT2G35860.1","carboxylic acid metabolic process, extracellular region, plant-type cell wall biogenesis, positive regulation of cellular biosynthetic process, positive regulation of gene expression, positive regulation of nucleobase-containing compound metabolic process"
"Chir05Ox-b28860.2",0,0.818239750043648,0.656,0.244,0,"AT3G63200",NA,NA,"PLP9","anatomical structure formation involved in morphogenesis, cellular polysaccharide metabolic process, meiotic cell cycle, plant-type cell wall organization or biogenesis"
"Chir05Ox-b09350.2",4.95454679399186e-232,0.454188027078024,0.558,0.252,9.740638996988e-228,"AT3G44735",NA,NA,"PSK1","cell population proliferation, extracellular region, lipid biosynthetic process"
"Chir07Ox-b06140.2",1.26786986786958e-238,0.356621388807559,0.579,0.261,2.4926321602316e-234,"AT5G37020","Yes","ARF","ATARF8","DNA-binding transcription factor activity, flower development, fruit development, nucleus, protein binding, regulation of DNA-templated transcription, response to auxin, transcription cis-regulatory region binding"
"Chir03Ox-b12420.2",0,0.964713583251754,0.739,0.262,0,"AT3G13175",NA,NA,"PRCE1","carboxylic acid biosynthetic process, cellular polysaccharide biosynthetic process, cellular_component, cellulose metabolic process, organelle organization, protein binding, secondary metabolic process"
"Chir04Ox-b18730.2",6.38129596062089e-229,0.409009219068513,0.58,0.266,1.25456278585807e-224,"AT2G36460",NA,NA,"FBA6","cellular response to hypoxia, copper ion binding, cytoplasm, cytosol, endoplasmic reticulum, fructose 1,6-bisphosphate metabolic process, fructose-bisphosphate aldolase activity, gluconeogenesis, glycolytic process, mitochondria-nucleus signaling pathway, mitochondrion, mRNA binding, pentose-phosphate shunt, plasma membrane, plasmodesma, protein binding, salicylic acid binding"
"Chir01Ox-b33620.2",0,1.01827772147446,0.81,0.274,0,"AT1G35720",NA,NA,"ANNAT1","apoplast, ATP binding, calcium ion binding, calcium ion transmembrane transport, chloroplast, chloroplast stroma, copper ion binding, cytoplasm, cytosol, membrane, mitochondrion, nucleus, peroxidase activity, phloem sucrose unloading, plant-type cell wall, plant-type vacuole, plasma membrane, plasmodesma, potassium ion export across plasma membrane, primary root development, protein homodimerization activity, response to abscisic acid, response to cold, response to heat, response to osmotic stress, response to oxidative stress, response to salt stress, response to water deprivation, root hair tip, thylakoid, zinc ion binding"
"Chir03Ox-b25200.2",3.51547260031058e-273,0.497677160011609,0.626,0.281,6.9114191322106e-269,"AT3G24770",NA,NA,"AT3G24770.1","apoplast, axillary shoot meristem initiation, cell division, cell-cell signaling involved in cell fate commitment, maintenance of root meristem identity, mitochondrion, phloem development, phloem or xylem histogenesis, procambium histogenesis, receptor serine/threonine kinase binding, regulation of cell differentiation, secondary shoot formation, xylem development"
"Chir07Ox-b03460.2",1.87304800597965e-225,0.364094631115912,0.602,0.281,3.682412379756e-221,"AT5G39410",NA,NA,"AT5G39410.1","chloroplast envelope, glycolipid biosynthetic process, lipid droplet, mitochondrion, nucleus, oxoacid metabolic process, plant-type vacuole, plasma membrane, plastid"
"Chir04Ox-b10950.2",3.5824765413873e-252,0.460799517064786,0.619,0.283,7.04314888036744e-248,"AT2G29320",NA,NA,"F16P2.30","cellular_component, defense response to other organism, oxidoreductase activity"
"Chir04Ox-b25070.2",0,0.633997183853141,0.664,0.286,0,"AT2G42320",NA,NA,"AT2G42320.1","cytoskeleton-dependent cytokinesis, developmental growth, nuclear pore, nucleus"
"Chir01Ox-b14810.2",0,1.21088122851608,0.805,0.298,0,"AT1G14700",NA,NA,"PAP3","acid phosphatase activity, dephosphorylation, ferric iron binding, ferrous iron binding, generation of precursor metabolites and energy, negative regulation of cellular metabolic process, negative regulation of cellular process, nucleus, plant-type vacuole, response to light intensity"
"Chir06Ox-b13240.2",0,0.856367241663772,0.751,0.315,0,NA,NA,NA,NA,NA
"Chir07Ox-b27160.2",0,1.41576042960778,0.747,0.319,0,"AT4G29905",NA,NA,NA,"cellular_component, oxoacid metabolic process, response to light intensity"
"Chir01Ox-b30190.2",4.6701893053327e-252,0.522229782510588,0.643,0.327,9.18159217428409e-248,"AT1G31710",NA,NA,"CuAOalpha3","aliphatic amine oxidase activity, amine metabolic process, aminoacetone:oxygen oxidoreductase(deaminating) activity, copper ion binding, extracellular region, peroxisome, phenethylamine:oxygen oxidoreductase (deaminating) activity, primary amine oxidase activity, putrescine catabolic process, quinone binding, response to abscisic acid, response to auxin, response to jasmonic acid, response to putrescine, response to salicylic acid, response to water deprivation, response to wounding, tryptamine:oxygen oxidoreductase (deaminating) activity"
"Chir05Ox-b14200.2",1.61720296733903e-199,0.339055043611724,0.666,0.335,3.17942103378854e-195,"AT3G49220",NA,NA,"PME34","cell wall modification, chloroplast, enzyme inhibitor activity, pectin catabolic process, pectinesterase activity, pectinesterase inhibitor activity, plant-type cell wall, plasma membrane, regulation of stomatal movement"
"Chir03Ox-b05520.2",1.4759065575579e-235,0.343791960512155,0.725,0.343,2.90163229215883e-231,"AT3G06035",NA,NA,NA,"carbohydrate derivative metabolic process, carboxylic acid metabolic process, cytosol, flavonoid biosynthetic process, membrane, molecular_function, regulation of secondary cell wall biogenesis, response to inorganic substance, response to wounding"
"Chir06Ox-b17060.2",1.21863970036248e-278,0.500577124649972,0.73,0.353,2.39584565091263e-274,"AT5G22740",NA,NA,"ATCSLA02","glucomannan 4-beta-mannosyltransferase activity, glycosyltransferase activity, Golgi apparatus, Golgi medial cisterna, mannan synthase activity, mucilage biosynthetic process, mucilage metabolic process involved in seed coat development"
"Chir04Ox-b10970.2",0,0.831050806410036,0.731,0.355,0,NA,NA,NA,NA,NA
