"gene_ID","p_val","avg_log2FC","pct.1","pct.2","p_val_adj","AT_ID","TF","TF_family","Gene_code_name","Gene_functions"
"Chir08Ox-b24850.2",6.57476707430963e-247,0.914013999610226,0.692,0.358,1.29259920680927e-242,"AT5G62350",NA,NA,"MMI9.21","enzyme inhibitor activity, negative regulation of catalytic activity, plastid"
"Chir01Ox-b04960.2",1.0505294049082e-258,0.600596386251667,0.708,0.39,2.06534081004953e-254,"AT1G05710","Yes","bHLH","F3F20.16","DNA-binding transcription factor activity, DNA-binding transcription factor activity, RNA polymerase II-specific, nucleus, protein binding, protein dimerization activity, regulation of transcription by RNA polymerase II, RNA polymerase II cis-regulatory region sequence-specific DNA binding"
"Chir02Ox-b22720.2",0,0.869444842812274,0.806,0.405,0,"AT1G75780",NA,NA,"TUB1","cytoplasm, GTP binding, GTPase activity, microtubule, microtubule cytoskeleton organization, mitotic cell cycle, mRNA binding, response to light stimulus, structural constituent of cytoskeleton, unidimensional cell growth, vacuole"
"Chir08Ox-b28190.2",3.88788921484738e-262,0.540773962712336,0.732,0.417,7.64359019638996e-258,"AT5G65510","Yes","AP2","PLT7","auxin mediated signaling pathway involved in phyllotactic patterning, callus formation, DNA binding, DNA-binding transcription factor activity, lateral root formation, leaf phyllotactic patterning, maintenance of shoot apical meristem identity, nucleus, phyllotactic patterning, protein binding, regulation of DNA-templated transcription"
"Chir01Ox-b21060.2",0,1.91804310553752,0.867,0.425,0,"AT1G21310",NA,NA,"ATEXT3","anatomical structure maturation, cell differentiation, cellular catabolic process, defense response to bacterium, defense response to fungus, immune system process, plant epidermis development, plant-type cell wall organization, response to inorganic substance, response to oxidative stress, response to salicylic acid, root morphogenesis, structural constituent of cell wall, toxin metabolic process"
"Chir03Ox-b17790.2",0,1.04548535602207,0.759,0.444,0,"AT3G18000",NA,NA,"NMT1","choline biosynthetic process, cytoplasm, methyltransferase activity, phosphatidylcholine biosynthetic process, phosphoethanolamine N-methyltransferase activity, phosphomethylethanolamine N-methyltransferase activity, pollen development, pollen tube growth, pollen tube guidance, post-embryonic root development, unidimensional cell growth"
"Chir06Ox-b07690.2",3.22528028617084e-150,0.295526439826572,0.765,0.463,6.34090104261187e-146,"AT5G42570",NA,NA,"K16E1.4","chloroplast, endoplasmic reticulum, endoplasmic reticulum membrane, endoplasmic reticulum to Golgi vesicle-mediated transport, molecular_function, plant-type vacuole, plasmodesma, plastid"
"Chir05Ox-b06790.2",3.2623617690883e-253,0.478000080723992,0.781,0.478,6.41380323802759e-249,"AT3G28860",NA,NA,"ATMDR1","ABC-type transporter activity, acropetal auxin transport, anthocyanin accumulation in tissues in response to UV light, ATPase-coupled transmembrane transporter activity, auxin efflux transmembrane transporter activity, auxin polar transport, auxin transport, basipetal auxin transport, cytosol, formation of plant organ boundary, lateral root development, nucleus, photomorphogenesis, plasma membrane, positive gravitropism, protein binding, regulation of cell size, response to auxin, response to blue light, response to far red light, response to red or far red light, root development, stamen development, transmembrane transport"
"Chir04Ox-b10500.2",7.8101256443858e-301,0.718622998477519,0.799,0.489,1.53547070168625e-296,"AT2G28840",NA,NA,"AT2G28840.1","cellular response to oxygen-containing compound, chloroplast, hormone-mediated signaling pathway, nucleus, protein binding, response to abscisic acid, response to heat, response to light stimulus, response to water"
"Chir05Ox-b19470.2",0,0.825571540156088,0.88,0.519,0,"AT3G53990",NA,NA,"USP17","chaperone-mediated protein folding, cytoplasm, cytosol, nucleic acid binding, nucleus, plasma membrane, plasmodesma, response to cold, response to heat, response to oxidative stress, RNA folding"
"Chir04Ox-b17280.2",0,0.75128053274686,0.882,0.52,0,"AT2G35120",NA,NA,"T4C15.21","ATP binding, cytoplasm, glycine cleavage complex, glycine decarboxylation via glycine cleavage system, mitochondrion, protein lipoylation"
"Chir04Ox-b10440.2",0,1.17914055258803,0.912,0.549,0,"AT2G28790",NA,NA,"F8N16.8","defense response, extracellular region, molecular_function, plant-type cell wall, plasmodesma, secretory vesicle"
"Chir04Ox-b19160.2",0,1.56320013593142,0.908,0.551,0,"AT2G36830",NA,NA,"TIP1;1","central vacuole, chloroplast envelope, cytoplasm, gibberellic acid mediated signaling pathway, hydrogen peroxide transmembrane transport, membrane, plant-type vacuole, plant-type vacuole membrane, protein storage vacuole, transmembrane transport, urea transmembrane transporter activity, urea transport, water channel activity, water transport"
"Chir04Ox-b08240.2",0,0.63190691130393,0.959,0.575,0,"AT5G23820",NA,NA,"AT5G23820.1","defense response, ER body, extracellular region, plant-type vacuole, protein binding, secretory vesicle, sterol binding, sterol transport"
"Chir03Ox-b09250.2",0,1.96196370140612,0.922,0.581,0,"AT3G10020",NA,NA,"HUP26","anaerobic respiration, cellular response to hypoxia, cytosol, molecular_function, nucleus, response to oxidative stress"
