"gene_ID","p_val","avg_log2FC","pct.1","pct.2","p_val_adj","AT_ID","TF","TF_family","Gene_code_name","Gene_functions"
"Chir08Ox-b28310.2",5.27760431276025e-102,1.02228116881617,0.536,0.177,1.03757700788866e-97,"AT5G65640","Yes","bHLH","bHLH093","DNA-binding transcription factor activity, gibberellin catabolic process, nucleus, protein dimerization activity, regulation of DNA-templated transcription, regulation of gibberellin biosynthetic process, sequence-specific DNA binding"
"Chir03Ox-b15700.2",5.48310710492158e-90,0.75014291802158,0.577,0.183,1.07797885682758e-85,"AT3G15950",NA,NA,"AT3G15950.3","chloroplast, ER body, ER body organization, nucleus, peroxisome, plasmodesma, protein binding, secretory vesicle"
"Chir07Ox-b17140.2",9.06014876249644e-105,1.14467604584966,0.571,0.183,1.7812252467068e-100,"AT4G20320",NA,NA,"CTPS4","'de novo' CTP biosynthetic process, CTP biosynthetic process, CTP synthase activity, cytoophidium, cytosol, identical protein binding, nucleus, pyrimidine nucleobase biosynthetic process"
"Chir05Ox-b22010.2",4.73888042911419e-81,1.203336860854,0.538,0.185,9.3166389236385e-77,"AT3G56400","Yes","WRKY","WRKY70","camalexin biosynthetic process, cellular response to hypoxia, defense response to bacterium, defense response to fungus, defense response to oomycetes, DNA-binding transcription factor activity, floral organ senescence, indole glucosinolate biosynthetic process, induced systemic resistance, induced systemic resistance, jasmonic acid mediated signaling pathway, leaf senescence, negative regulation of DNA-templated transcription, negative regulation of leaf senescence, nucleus, positive regulation of salicylic acid mediated signaling pathway, protein binding, regulation of brassinosteroid mediated signaling pathway, regulation of defense response, regulation of DNA-templated transcription, regulation of ethylene-activated signaling pathway, regulation of jasmonic acid mediated signaling pathway, regulation of response to osmotic stress, regulation of response to water deprivation, regulation of salicylic acid mediated signaling pathway, regulation of stomatal closure, response to bacterium, response to insect, response to jasmonic acid, response to osmotic stress, response to reactive oxygen species, response to salicylic acid, sequence-specific DNA binding, systemic acquired resistance, salicylic acid mediated signaling pathway, transcription cis-regulatory region binding"
"Chir04Ox-b13940.2",3.35284694393495e-65,1.26507347314129,0.49,0.187,6.59169709177611e-61,"AT2G32020",NA,NA,"AT2G32020.1","acetyltransferase activity, cytoplasm, response to abscisic acid"
"Chir01Ox-b27110.2",2.86569526560996e-137,1.00649562064689,0.625,0.189,5.63395689218919e-133,"AT1G28360","Yes","ERF","ATERF12","DNA binding, DNA-binding transcription factor activity, ethylene-activated signaling pathway, intracellular anatomical structure, nucleus, protein binding, regulation of DNA-templated transcription"
"Chir04Ox-b25400.2",1.20302538773185e-294,2.19412380003197,0.839,0.19,2.36514791228083e-290,"AT2G42610",NA,NA,"LSH10","cellular developmental process, glucosinolate metabolic process, molecular_function, mRNA transcription, nucleus, oxoacid metabolic process, post-embryonic plant morphogenesis, regionalization, response to light intensity, response to light stimulus, stomatal complex development"
"Chir02Ox-b19300.2",9.64162818844187e-89,0.692592114455987,0.538,0.194,1.89554410184767e-84,"AT1G72630",NA,NA,"ELF4-L2","entrainment of circadian clock, mitochondrion, nucleus, photoperiodism, positive regulation of circadian rhythm, protein homodimerization activity"
"Chir04Ox-b00170.2",1.02785676382659e-121,1.17042039176069,0.633,0.198,2.02076639768308e-117,NA,NA,NA,NA,NA
"Chir03Ox-b35050.2",1.05016953596561e-82,0.783898961897088,0.543,0.203,2.06463330770839e-78,"AT2G20515",NA,NA,NA,"cell cycle, extracellular region, molecular_function"
"Chir08Ox-b16780.2",7.70908692257769e-68,0.485242495923677,0.515,0.206,1.51560648897877e-63,"AT5G54800",NA,NA,"GPT1","antiporter activity, chloroplast, embryo development ending in seed dormancy, embryo sac development, glucose-6-phosphate transmembrane transporter activity, glucose-6-phosphate transport, Golgi apparatus, inorganic phosphate transmembrane transporter activity, lipid droplet organization, peroxisome, phosphoenolpyruvate transport, phosphoglycerate transmembrane transport, phosphoglycerate transmembrane transporter activity, plastid, pollen maturation, response to nematode, triose phosphate transmembrane transport, triose-phosphate transmembrane transporter activity, vacuole organization"
"Chir01Ox-b09120.2",1.05208577121518e-79,0.64115916656533,0.541,0.212,2.06840062620904e-75,"AT1G09530","Yes","bHLH","POC1","de-etiolation, DNA binding, DNA-binding transcription factor activity, gibberellic acid mediated signaling pathway, identical protein binding, nucleus, positive regulation of anthocyanin metabolic process, protein binding, protein dimerization activity, red or far-red light signaling pathway, regulation of DNA-templated transcription, regulation of photosynthesis, light reaction, regulation of plant organ morphogenesis, response to red or far red light, response to water-immersion restraint stress, signal transduction, transcription cis-regulatory region binding, unidimensional cell growth"
"Chir07Ox-b27880.2",7.24286103979818e-61,0.471622297928143,0.528,0.217,1.42394648042432e-56,"AT4G30650",NA,NA,"F17I23.10","defense response to fungus"
"Chir02Ox-b22110.2",2.3608529486451e-119,0.812633327180966,0.635,0.221,4.64143689703627e-115,"AT1G75170",NA,NA,"AT1G75170.3","catabolic process, cell wall organization or biogenesis, defense response to other organism, phosphatidylinositol transfer activity, pigment metabolic process, plasma membrane, regulation of defense response, response to fungus, response to inorganic substance, response to light stimulus, secondary metabolic process, small molecule metabolic process"
"Chir06Ox-b12910.2",4.05756952028575e-90,0.700859046212034,0.589,0.223,7.97718167688179e-86,"AT5G27930",NA,NA,"EGR2","cytoplasm, drought recovery, microtubule cytoskeleton organization, myosin phosphatase activity, negative regulation of growth, peptidyl-threonine dephosphorylation, plasma membrane, protein binding, protein dephosphorylation, protein serine/threonine phosphatase activity"
"Chir03Ox-b12440.2",5.81280781998216e-91,0.630822953158085,0.582,0.224,1.14279801740849e-86,"AT3G13190",NA,NA,"MJG19.15","chloroplast accumulation movement, chloroplast avoidance movement, cytoplasm, cytosol, molecular_function"
"Chir01Ox-b22760.2",1.46094887385531e-115,0.88386057873589,0.648,0.23,2.87222548599954e-111,"AT1G23000",NA,NA,"AtHMP05","cell division, cellular developmental process, extracellular region, flower development, meiotic cell cycle process, metal ion binding, negative regulation of cellular process, nucleus, pattern specification process, tissue development"
"Chir02Ox-b25520.2",1.03760098047298e-58,0.587091804178984,0.559,0.235,2.03992352760987e-54,"AT1G78430",NA,NA,"RIP2","cytoskeleton organization, extracellular region, molecular_function, phloem or xylem histogenesis"
"Chir07Ox-b30310.2",2.70048576443783e-138,0.947445142085403,0.684,0.24,5.30915501288478e-134,"AT4G32980","Yes","TALE","ATH1","DNA binding, DNA-binding transcription factor activity, DNA-binding transcription factor activity, RNA polymerase II-specific, floral organ abscission, meristem maintenance, negative regulation of cell population proliferation, nucleus, photomorphogenesis, protein binding, regulation of gibberellin biosynthetic process, regulation of transcription by RNA polymerase II, RNA polymerase II cis-regulatory region sequence-specific DNA binding, sequence-specific DNA binding, shoot organ boundary specification, vegetative to reproductive phase transition of meristem"
"Chir01Ox-b09360.2",1.54123648134392e-65,0.935453211978276,0.541,0.241,3.03007092232215e-61,"AT1G09750",NA,NA,"F21M12.13","apoplast, aspartic-type endopeptidase activity, extracellular region, plant-type cell wall, proteolysis, secretory vesicle, systemic acquired resistance"
"Chir01Ox-b26450.2",1.56552767646082e-103,0.684446914348976,0.638,0.242,3.07782741192197e-99,"AT1G27680",NA,NA,"APL2","chloroplast, glucose-1-phosphate adenylyltransferase activity, glycogen biosynthetic process, starch biosynthetic process"
"Chir01Ox-b28620.2",2.44736861655612e-64,0.616021215228701,0.579,0.251,4.81152670014932e-60,"AT1G29950","Yes","bHLH","AT1G29950.1","DNA-binding transcription factor activity, nucleus, protein binding, protein dimerization activity, regulation of DNA-templated transcription"
"Chir08Ox-b22870.2",3.67730309576509e-111,0.890160548095422,0.666,0.252,7.22957788627417e-107,"AT5G60400",NA,NA,"MUF9.14","chloroplast, lipid biosynthetic process, molecular_function"
"Chir03Ox-b09390.2",3.72015015716559e-83,0.833041741018763,0.607,0.255,7.31381520898756e-79,"AT3G10190",NA,NA,"CML36","calcium ion binding, defense response to fungus, protein binding"
"Chir03Ox-b12090.2",1.67260117816201e-130,1.18689128548626,0.707,0.26,3.28833391626652e-126,"AT3G12920",NA,NA,"BRG3","cytoplasm, nucleus, proteasome-mediated ubiquitin-dependent protein catabolic process, regulation of programmed cell death, ubiquitin-protein transferase activity"
"Chir03Ox-b12420.2",1.01627823606196e-251,1.71747744990285,0.901,0.285,1.99800301209782e-247,"AT3G13175",NA,NA,"PRCE1","carboxylic acid biosynthetic process, cellular polysaccharide biosynthetic process, cellular_component, cellulose metabolic process, organelle organization, protein binding, secondary metabolic process"
"Chir06Ox-b12130.2",8.63833453881132e-76,0.663929621880567,0.617,0.285,1.69829657033031e-71,"AT5G27150",NA,NA,"ATNHX","extracellular region, leaf development, lithium ion transport, plant-type vacuole, plasma membrane, plastid, potassium ion homeostasis, potassium ion transmembrane transport, potassium:proton antiporter activity, protein binding, regulation of intracellular pH, regulation of stomatal closure, response to salt stress, sodium ion import across plasma membrane, sodium ion transmembrane transport, sodium ion transmembrane transporter activity, sodium ion transport, sodium:proton antiporter activity, vacuolar membrane, vacuole"
"Chir01Ox-b38720.2",1.3640898868192e-83,0.963519493725119,0.63,0.295,2.68180071748654e-79,"AT1G49750",NA,NA,"AT1G49750.1","chloroplast, nucleus"
"Chir05Ox-b08940.2",4.92300328836861e-91,0.793639503602243,0.663,0.297,9.67862446493269e-87,"AT3G44290","Yes","NAC","ANAC060","cellular response to glucose stimulus, DNA binding, DNA-binding transcription factor activity, nucleus, protein binding, regulation of DNA-templated transcription"
"Chir04Ox-b10950.2",3.19133017804177e-74,0.924068439870789,0.63,0.3,6.27415513003011e-70,"AT2G29320",NA,NA,"F16P2.30","cellular_component, defense response to other organism, oxidoreductase activity"
"Chir02Ox-b21820.2",1.97693594645873e-94,1.06773436620537,0.661,0.301,3.88665607073786e-90,NA,NA,NA,NA,NA
"Chir01Ox-b09350.2",2.16259260874978e-99,0.847624680070811,0.676,0.303,4.25165706880208e-95,"AT1G09740",NA,NA,"F21M12.12","biological_process, cellular_component, cytoplasm, molecular_function"
"Chir01Ox-b33620.2",8.14050247415553e-102,1.12692168758888,0.737,0.303,1.60042278641898e-97,"AT1G35720",NA,NA,"ANNAT1","apoplast, ATP binding, calcium ion binding, calcium ion transmembrane transport, chloroplast, chloroplast stroma, copper ion binding, cytoplasm, cytosol, membrane, mitochondrion, nucleus, peroxidase activity, phloem sucrose unloading, plant-type cell wall, plant-type vacuole, plasma membrane, plasmodesma, potassium ion export across plasma membrane, primary root development, protein homodimerization activity, response to abscisic acid, response to cold, response to heat, response to osmotic stress, response to oxidative stress, response to salt stress, response to water deprivation, root hair tip, thylakoid, zinc ion binding"
"Chir01Ox-b42640.2",1.72956305975829e-64,0.510527215363903,0.617,0.312,3.4003209754848e-60,"AT1G53730",NA,NA,"SRF6","cell wall biogenesis, cell wall macromolecule metabolic process, cellular polysaccharide biosynthetic process, developmental maturation, hormone-mediated signaling pathway, nucleus, plant-type cell wall organization, plasma membrane, protein binding, protein phosphorylation, regulation of signal transduction, response to heat, transmembrane receptor protein tyrosine kinase activity, trichoblast differentiation, unidimensional cell growth"
"Chir06Ox-b13240.2",4.8509762210388e-151,1.41750323149037,0.819,0.337,9.53701925056227e-147,NA,NA,NA,NA,NA
"Chir07Ox-b27160.2",1.01206307288687e-134,1.80029186662129,0.801,0.34,1.98971600129559e-130,"AT4G29905",NA,NA,NA,"cellular_component, oxoacid metabolic process, response to light intensity"
"Chir05Ox-b20300.2",7.75461943793637e-270,3.6119424787127,0.936,0.342,1.52455818149829e-265,"AT3G54820",NA,NA,"PIP2D","plasma membrane, protein binding, transmembrane transport, water channel activity, water transport"
"Chir05Ox-b26210.2",3.45421408373223e-61,0.733125573166204,0.661,0.358,6.79098488861757e-57,"AT3G60390","Yes","HD-ZIP","HAT3","DNA-binding transcription factor activity, DNA-binding transcription factor activity, RNA polymerase II-specific, nucleus, protein binding, response to hypoxia, sequence-specific DNA binding"
"Chir04Ox-b10110.2",4.93647389540279e-106,1.09707609189812,0.745,0.37,9.70510767836189e-102,"AT2G28550","Yes","AP2","RAP2.7","DNA binding, DNA-binding transcription factor activity, negative regulation of gene expression, negative regulation of innate immune response, nucleus, plant organ morphogenesis, protein binding, regulation of DNA-templated transcription, sequence-specific DNA binding, vegetative to reproductive phase transition of meristem"
"Chir04Ox-b13260.2",4.44916970915773e-157,1.44996523483886,0.875,0.386,8.74706764820411e-153,"AT2G31390",NA,NA,"FRK2","chloroplast, cytosol, fructokinase activity, fructose metabolic process, peroxisome, plasma membrane, starch biosynthetic process"
"Chir02Ox-b06460.2",1.15547538793753e-127,1.377255604226,0.798,0.402,2.27166461268518e-123,"AT1G59940",NA,NA,"ARR3","chloroplast, circadian rhythm, cytokinin-activated signaling pathway, cytoplasm, nucleus, phosphorelay response regulator activity, phosphorelay signal transduction system, protein binding, red light signaling pathway, regulation of circadian rhythm, regulation of DNA-templated transcription, response to cytokinin, response to red light"
"Chir05Ox-b10710.2",4.82998838161289e-108,1.47456485367812,0.829,0.403,9.49575715825093e-104,"AT3G45970",NA,NA,"ATEXLA1","extracellular region, Golgi apparatus, plant-type cell wall, plant-type cell wall loosening, plasmodesma, secretory vesicle, unidimensional cell growth"
"Chir01Ox-b04960.2",3.59887293854046e-81,1.19353669692274,0.732,0.406,7.07538419717055e-77,"AT1G05710","Yes","bHLH","F3F20.16","DNA-binding transcription factor activity, DNA-binding transcription factor activity, RNA polymerase II-specific, nucleus, protein binding, protein dimerization activity, regulation of transcription by RNA polymerase II, RNA polymerase II cis-regulatory region sequence-specific DNA binding"
"Chir06Ox-b36610.2",4.75455839331341e-199,2.6780359824158,0.923,0.418,9.34746180125416e-195,"AT5G02380",NA,NA,"MT2B","copper ion binding, oxoacid metabolic process, secondary metabolic process"
"Chir06Ox-b24600.2",2.41472508696892e-116,1.13244241241977,0.842,0.421,4.7473495209809e-112,"AT5G14780",NA,NA,"AtFDH1","chloroplast, cytosol, formate dehydrogenase (NAD+) activity, mitochondrion, NAD binding, oxidoreductase activity, acting on the CH-OH group of donors, NAD or NADP as acceptor, plastid, response to wounding, thylakoid"
"Chir07Ox-b35310.2",7.71389786054148e-120,1.59528844995663,0.844,0.447,1.51655231938246e-115,"AT4G37870",NA,NA,"PCK1","cellular response to phosphate starvation, cytoplasm, cytosol, gluconeogenesis, nucleolus, phosphoenolpyruvate carboxykinase (ATP) activity"
"Chir05Ox-b00920.2",1.22742918285647e-77,0.764211933212389,0.76,0.454,2.41312577349583e-73,"AT2G01910",NA,NA,"ATMAP65-6","cytoplasm, microtubule binding, microtubule cytoskeleton organization, mitochondrion, nucleus, phragmoplast, plastid, preprophase band, spindle"
"Chir05Ox-b15100.2",1.52881072509988e-122,1.05514106237661,0.852,0.478,3.00564188554637e-118,"AT3G50070",NA,NA,"CYCD3;3","cyclin-dependent protein kinase holoenzyme complex, cyclin-dependent protein serine/threonine kinase regulator activity, cytoplasm, guard mother cell differentiation, mitotic cell cycle phase transition, nucleus, protein binding, regulation of cell population proliferation, regulation of cyclin-dependent protein serine/threonine kinase activity, seed development"
"Chir04Ox-b17280.2",4.39834546418652e-84,0.812110952596664,0.88,0.539,8.64714718259071e-80,"AT2G35120",NA,NA,"T4C15.21","ATP binding, cytoplasm, glycine cleavage complex, glycine decarboxylation via glycine cleavage system, mitochondrion, protein lipoylation"
"Chir07Ox-b26300.2",8.67740098627699e-134,1.62641512100054,0.901,0.55,1.70597703390206e-129,"AT4G29080",NA,NA,"IAA27","DNA-binding transcription factor activity, identical protein binding, nucleus, protein binding, regulation of DNA-templated transcription, response to auxin, transcription cis-regulatory region binding"
"Chir01Ox-b19320.2",7.33501614068574e-121,1.00431589312945,0.913,0.564,1.44206417325882e-116,"AT1G19330",NA,NA,"AFR2","histone deacetylase complex, nucleus, protein binding, regulation of circadian rhythm, regulation of DNA-templated transcription, transcription coregulator activity"
"Chir03Ox-b32690.2",1.64311667631303e-114,1.40004469634302,0.878,0.567,3.23036738563141e-110,"AT2G18160","Yes","bZIP","ATBZIP2","DNA-binding transcription factor activity, nucleus, positive regulation of DNA-templated transcription, protein binding, protein heterodimerization activity, transcription cis-regulatory region binding"
"Chir04Ox-b10440.2",7.23040581763549e-103,1.41500803750632,0.929,0.567,1.42149778374714e-98,"AT2G28790",NA,NA,"F8N16.8","defense response, extracellular region, molecular_function, plant-type cell wall, plasmodesma, secretory vesicle"
"Chir04Ox-b19160.2",3.89591298890907e-163,2.86251553022911,0.911,0.57,7.65936493619524e-159,"AT2G36830",NA,NA,"TIP1;1","central vacuole, chloroplast envelope, cytoplasm, gibberellic acid mediated signaling pathway, hydrogen peroxide transmembrane transport, membrane, plant-type vacuole, plant-type vacuole membrane, protein storage vacuole, transmembrane transport, urea transmembrane transporter activity, urea transport, water channel activity, water transport"
"Chir04Ox-b08240.2",3.46670605213491e-52,0.633287747879629,0.908,0.596,6.81554409849724e-48,"AT5G23820",NA,NA,"AT5G23820.1","defense response, ER body, extracellular region, plant-type vacuole, protein binding, secretory vesicle, sterol binding, sterol transport"
