"gene_ID","p_val","avg_log2FC","pct.1","pct.2","p_val_adj","AT_ID","TF","TF_family","Gene_code_name","Gene_functions"
"Chir07Ox-b36000.2",2.03946855597222e-243,0.342912217482473,0.768,0.45,4.00959518104137e-239,"AT4G39710",NA,NA,"FKBP16-2","chloroplast, chloroplast thylakoid lumen, chloroplast thylakoid membrane, extracellular region, peptidyl-prolyl cis-trans isomerase activity, plasma membrane, protein binding, response to light stimulus, thylakoid"
"Chir03Ox-b16010.2",0,1.10209162582551,0.774,0.451,0,"AT3G16240",NA,NA,"DELTA-TIP","ammonium transmembrane transporter activity, central vacuole, chloroplast envelope, Golgi apparatus, identical protein binding, membrane, methylammonium transmembrane transporter activity, plant-type cell wall, plant-type vacuole, plant-type vacuole membrane, plasma membrane, plasmodesma, protein storage vacuole, transmembrane transport, urea transmembrane transporter activity, urea transport, water channel activity, water transport"
"Chir06Ox-b28930.2",4.15928410681319e-210,0.364868656390012,0.758,0.452,8.17715255399473e-206,NA,NA,NA,NA,NA
"Chir03Ox-b14680.2",2.25525806412153e-211,0.250619775381537,0.763,0.453,4.43383735406293e-207,"AT3G15060",NA,NA,"AtRABA1g","cell wall biogenesis, endosome, GTP binding, GTPase activity, vesicle-mediated transport"
"Chir03Ox-b24080.2",1.73005432336208e-289,0.324249970935383,0.791,0.456,3.40128679972984e-285,"AT3G23910",NA,NA,"F14O13.10","molecular_function, nucleus, response to oxidative stress"
"Chir03Ox-b08170.2",1.52212767964402e-226,0.295031772018133,0.779,0.462,2.99250301818015e-222,"AT3G08947",NA,NA,"T16O11.10","cytoplasm, cytosol, nuclear import signal receptor activity, nuclear localization sequence binding, nucleus, protein import into nucleus"
"Chir04Ox-b09380.2",0,1.71404770711609,0.971,0.463,0,"AT2G27970",NA,NA,"CKS2","cyclin-dependent protein kinase holoenzyme complex, cyclin-dependent protein serine/threonine kinase activator activity, cytoplasm, histone binding, nucleus, protein binding, protein kinase binding, regulation of mitotic cell cycle, SCF ubiquitin ligase complex, ubiquitin binding"
"Chir01Ox-b41930.2",0,0.588599545489896,0.801,0.471,0,"AT1G53070",NA,NA,"F8L10.7","biological_process, extracellular region, molecular_function, plant-type cell wall"
"Chir06Ox-b16670.2",4.08920958203593e-238,0.301213813318575,0.783,0.471,8.03938603828263e-234,"AT5G23070",NA,NA,"TK1b","chloroplast, identical protein binding, response to cold, seedling development, thymidine kinase activity, thymidine metabolic process"
"Chir01Ox-b09070.2",0,0.69609384229656,0.877,0.493,0,"AT1G09480",NA,NA,"F14J9.14","alcohol dehydrogenase (NAD+) activity, cellular_component, organonitrogen compound catabolic process, oxidoreductase activity, acting on the CH-OH group of donors, NAD or NADP as acceptor, response to alcohol, response to water deprivation, signal transduction"
"Chir06Ox-b23350.2",0,1.2025582828723,0.925,0.494,0,"AT5G16030",NA,NA,"F1N13.170","mitochondrion, molecular_function, nucleus, porphyrin-containing compound metabolic process, protein-containing complex assembly, response to bacterium, response to light intensity, response to red or far red light"
"Chir01Ox-b39340.2",0,0.434415836322314,0.863,0.497,0,NA,NA,NA,NA,NA
"Chir04Ox-b07030.2",0,0.6981182694911,0.916,0.504,0,"AT2G24150",NA,NA,"AT2G24150.1","mitochondrion, response to hormone, response to oxidative stress, response to sucrose, signaling receptor activity"
"Chir05Ox-b27020.2",1.97263625953667e-290,0.417339257320908,0.829,0.515,3.8782028862491e-286,"AT3G61310",NA,NA,"AHL11","cell differentiation, minor groove of adenine-thymine-rich DNA binding, negative regulation of metabolic process, nucleus, regionalization"
"Chir04Ox-b22470.2",0,0.497476489324942,0.868,0.521,0,"AT2G39870",NA,NA,"T28M21.3","cellular_component, growth, meiotic cell cycle process, meristem development, molecular_function"
"Chir04Ox-b19160.2",4.39385093368539e-262,0.581920823966162,0.871,0.543,8.63831093562548e-258,"AT2G36830",NA,NA,"TIP1;1","central vacuole, chloroplast envelope, cytoplasm, gibberellic acid mediated signaling pathway, hydrogen peroxide transmembrane transport, membrane, plant-type vacuole, plant-type vacuole membrane, protein storage vacuole, transmembrane transport, urea transmembrane transporter activity, urea transport, water channel activity, water transport"
"Chir05Ox-b25990.2",0,0.93110812089129,0.963,0.547,0,"AT3G60190",NA,NA,"ADL4","cytoplasm, cytosol, defense response to fungus, GTPase activity, membrane, microtubule, microtubule binding, mitochondrion, plant-type vacuole, plasma membrane, plasmodesma, vesicle-mediated transport"
"Chir04Ox-b13230.2",0,0.495686956938069,0.89,0.554,0,"AT2G31360",NA,NA,"ADS2","16:0 monogalactosyldiacylglycerol desaturase activity, endoplasmic reticulum, endoplasmic reticulum membrane, oxidoreductase activity, acting on paired donors, with oxidation of a pair of donors resulting in the reduction of molecular oxygen to two molecules of water, response to red light, unsaturated fatty acid biosynthetic process, very long-chain fatty acid biosynthetic process"
"Chir03Ox-b07300.2",1.90901118600545e-298,0.378783655713416,0.861,0.557,3.75311599168672e-294,"AT3G07670",NA,NA,"MLP3.12","[ribulose-bisphosphate carboxylase]-lysine N-methyltransferase activity, chloroplast, peptidyl-lysine methylation, peptidyl-lysine monomethylation, protein-lysine N-methyltransferase activity"
"Chir01Ox-b09980.2",0,0.48272843248752,0.91,0.578,0,"AT1G10290",NA,NA,"ADL6","cytoplasm, extracellular region, Golgi apparatus, Golgi to vacuole transport, GTPase activity, membrane, microtubule, microtubule binding, plant-type vacuole, plasma membrane, plasmodesma"
"Chir07Ox-b00090.2",0,0.895842275378529,0.941,0.582,0,"AT5G42080",NA,NA,"ADL1","cell cortex, cell plate, cell plate formation involved in plant-type cell wall biogenesis, cellular response to boron-containing substance levels, chloroplast thylakoid membrane, clathrin binding, clathrin-coated endocytic vesicle, clathrin-coated vesicle, clathrin-dependent endocytosis, cytokinesis by cell plate formation, cytoplasm, cytoskeleton, embryo development ending in seed dormancy, GTPase activity, intracellular protein transport, membrane, microtubule, microtubule binding, phragmoplast, plant-type vacuole, plasma membrane, plasmodesma, plastid, protein binding, protein histidine kinase binding, receptor-mediated endocytosis, regulation of endocytosis, regulation of establishment of cell polarity, regulation of lipid localization, regulation of phragmoplast microtubule organization, regulation of plant-type cell wall organization or biogenesis, response to boron-containing substance, root hair initiation, stigma development, trichome branching, xylem and phloem pattern formation"
"Chir04Ox-b16960.2",0,0.510820349391634,0.912,0.601,0,"AT2G34770",NA,NA,"FAH1","endoplasmic reticulum, fatty acid alpha-hydroxylase activity, fatty acid metabolic process, iron ion binding, negative regulation of programmed cell death, very long-chain fatty acid metabolic process"
"Chir03Ox-b19420.2",0,1.22915915009387,0.98,0.606,0,"AT3G19590",NA,NA,"BUB3.1","bub1-bub3 complex, Cul4-RING E3 ubiquitin ligase complex, kinetochore, kinetochore microtubule, mitotic checkpoint complex, mitotic spindle assembly checkpoint signaling, nucleus, phragmoplast, protein binding, spindle microtubule, ubiquitin binding"
"Chir04Ox-b11270.2",0,1.38075194115979,0.984,0.651,0,"AT2G29550",NA,NA,"TUB7","cytoplasm, cytosol, Golgi apparatus, GTP binding, GTPase activity, microtubule, microtubule cytoskeleton organization, microtubule-based process, mitotic cell cycle, mRNA binding, peroxisome, plant-type cell wall, plasma membrane, plasmodesma, structural constituent of cytoskeleton, tubulin complex, vacuole"
